,score,comment
468,3,Como não faz 1 mês que estou tomando. Não tem como dizer se gostei se deu resultado satisfatório!.
469,5,"Muito bom produto, já é o segundo frasco que uso, e já estou vendo o resultado, usei um de outra marca, mais não senti diferença, esse com pouco tempo de uso, minhas unhas fortaleceram e não racham, e cresceram bem, meus cabelos mais fortes!."
470,4,"Ainda não mandei analisar o conteúdo das cápsulas, mas parece ser um bom produto. Tudo correu a contento."
471,5,"Achei o produto excelente. As capsulas são fáceis de tomar e segui a recomendação de quatro capsulas por dia. Depois de 06 semanas, quase dois meses, eu comecei a sentir os benefícios. Minha pele ficou melhor e me senti bem em geral."
472,5,"Estou tomando a pouco tempo, ainda não tem como ver resultados, mas acredito que seja bom sim."
473,5,"Já é a segunda vez que eu compro esse colágeno e super recomendo. Minhas unhas pararam de quebrar, meu cabelo cresceu mais rápido e mais forte e a pele está bem mais bonita e firme. Podem comprar sem medo. Eu recomendo!."
474,4,"Estou tomando o colágeno, espero logo ter um bom resultado com a pele cabelo e unha."
475,5,"Estou feliz e impressionada com os resultados tomando estas cápsulas. É claro que nada acontece por acaso. É preciso cuidar de hábitos alimentares saudáveis,atividades físicas e também de tomar outras cápsulas para que o resultados sejam eficazes e duradouros !."
476,5,"Gostei!!!. 
Deixa a pele bonita, as unhas fortes e o cabelo com muito brilho saudável. 
Recomendo."
477,5,"Òtimo esse colàgeno hidrolisado em càpsulas,eu e minha esposa jà usamos faz um bom tempo. 
Como estava em falta na farmàcia e não ficamos sem esse produto,resolvemos comprar por aqui no ml,veio corretamente. 
Esse colàgeno è òtimo pra pele,cabelo e unhas."
478,5,Estou gostando. Como ainda estou fazendo uso  a menos de 1 mês  não senti muita diferença.
479,5,"Quase 1 mês tomando vejo diferença, mais disposição e vejo que até meu rosto mudou muito , a pele bastante diferença. Acredito que com 2 a 3 meses verei muito mais diferença. Continuarei a comprar e a tomar super recomendo."
480,4,"Já esou usando o prduto á muito tempo, e gosto do resultado. Ótimo produto. Recomendo."
481,4,"Está muito cedo ainda para opinar, comecei tomar faz um mes, tive uma pequena melhora de dor lombar, más ainda é muito cedo para opinar, vou esperar acabar o frasco e depois opino com mais precisão. Abç a todos."
482,4,Um excelente suplemento. Principalmente para pessoas com artrite reumatóide. Gostei também do ótimo preço.
483,5,"Estou tomando há quase 2 meses, percebi que minhas unhas e cabelos fortaleceram bem, a pele da minha mão ficou com um aspecto bem melhor, não tive mais gripes desde o período que comecei a tomar o mesmo. 
. 
Recomendo!!!."
484,5,Estou gostando só posso dar um resultado ótimo mesmo daqui à as alguns dias. Obrigada.
485,5,"Ja conhecia e tomava o produto e sei que realmente  da resultado. Estou usando a poucas semanas mas indico produto mesmo assim. Com uso certinho da super certo, minhas unhas e cabelos melhoram muito quando tomo esse colágeno."
486,4,"Ótimo produto, depois de um bom tempo usando já se nota a diferença!."
487,4,"Produto bom, cada organismo reage de forma diferente. Na primeira semana já consegui ver o resultado nas unhas. Hoje já com algum tempo de uso já consigo ver o resultado na minha pele. Recomendo e voltarei a comprar."
488,4,Comecei tomar agora por isso ainda é cedo pra opinião sobre o produto.
489,3,"Aberto o primeiro frasco, e o conteúdo não é 240 capsulas e sim só 228 (contados duas vezes). Acompanharemos e veremos a contagem na abertura dos próximos frascos. 
Estou dando 3 estrelas por acreditar no produto das cápsulas."
490,5,Comecei agora  e necessito de um tempo maior para ver o real efeito.
491,5,"Já usava dessa marca e agora nesse pote com bastante cápsulas achei excelente e o preço ótimo , o resultado vem com certeza , eu tomo 3 ao dia e sinto bem a diferença na pele , vale a pena !!."
492,3,Parece ser bom mas vou esperar mas tempo p eu vê o resultado.
493,3,"Bom ainda não posso opinar pois não senti nenhum resultado diferente,mais ainda faz somente 15 dias que estou fazendo uso contínuo,depois volto para dar minha opinião com mais tempo de uso para poder ver resultados."
494,5,"Produto de excelente resultado. 
Ótimo custo / benefício. 
Resultado em poucos dias. 
Super recomendo."
495,4,"Parece ser bom! é complicado avaliar esse tipo de produto logo no início de uso,porque leva algum tempo pra fazer efeito. Porém notei q meu cabelo diminuiu a queda,estou com esperança q pare de cair."
496,5,"O produto é ótimo, já faz tempo que uso é gosto muito."
497,4,Ainda não fez o efeito esperado.
498,3,Ainda eata em teste  so posso opinar depois de novos exames   a pesquisa é insistenre  deviam dar outras opcoes para nao prejudicar o fornexedor.
499,4,"Deve ser bom, so com tempo apos os exames de vitamina d poderemos informar melhor."
500,5,Muito boas as cápsulas realmente vem a vitamina d3.
501,5,Sensacional. Tomo de manhã na hora do café. Fico o dia todo no gás e com foco bacana!.
502,5,Bom gostei eu faço uso já bastante tempo e aí ficasse produz um bom efeito.
503,5,Superou minhas expectativas. No primeiro dia aumentou bem a producao em meu trabalho. Recomendo!.
504,1,"Ainda estou avaliando, mas estou sem grandes expectativas."
505,5,Excelente produto manipulação confiav.
506,5,"Ainda estou usando, faz aproximadamente 1 mês, gostei da textura e cheiro, como ustilizo outros produtos associados, não consigo opinar claramente sobre o resultado, mas acredito que é uma boa associação e bom produto!."
507,1,"Não valeu nada, usei quase o tubo inteiro e até agora não vi resultados."
508,5,Produto maravilhoso pouco dias de uso e já começou a aparecer os resultados.
509,3,"Não resolveu o problema,mas eu prossigo tentando ,obrigada."
510,1,Esse produto nao fez efeito o que peco em farmacia de manipulacao numa porcentagem menor de 30% faz efeito enquanto este nao fez absolutamente nada.
