,score,comment
480,5,Excelente produto recomendo a todos do mercadolivre.
481,5,Bom  nao tenho q reclamar do produlto.
482,5,"Ótimo, console novo exatamente como eu queria."
483,5,"Ótimo, tela iluminada e funciona perfeitamente."
484,5,"Produto excelente, novo, já estou jogando."
485,5,"Ótimo! portátil, superou minhas expectativas."
486,5,"Excelente produto, muito bom mesmo."
487,5,"Excelente produto, recomendo com certeza!."
488,5,"Perfeito estado, nostalgia pura."
489,5,"Excelente, original, funcionando certinho!."
490,5,Ótimo produto. Satisfação garantida !!!.
491,5,"Sensacional. O carregador é idêntico ao do switch normal e dá pra usar os controles sem fio. Bateria dura cerca de 6hrs. Super leve e acabamento muito bom! notei que não precisa de película, a tela original é muito resistente."
492,5,"Demorei um pouco pra dar a minha opinião do produto, e garanto que é ótimo!! ele é mais em conta do q o switch normal e muito bom por conta do joystick já no próprio aparelho, não me arrependo nenhum pouco de ter pego ele. Esperando agora o lançamento do legend's arceus para poder jogar uma nova jornada."
493,5,"Muito bom! exatamente o que eu estava esperando. Vale constar que o único acessório que vem com ele é o carregador, que possui a tomada de dois pinos com entrada redonda."
494,5,"Já estava querendo um switch a algum tempo. A versão lite é só portatil, mas a qualidade é muito, muito boa. 
Vem dois jogos ruins de brinde, vão ficar pra coleção. 
Próximo game que me aguarde, zelda links awakening."
495,5,Um dos melhores consoles da nintendo que já tive.
496,5,"Ótimo pra quem não quer ou não tem como jogar na tv ou até mesmo que queira um switch mais resistente pra carregar na mochila/bolsa, como não tem peças que desencaixam é bem mais resistente o que o torna melhor para deixar com crianças, as funcionalidades que foram retiradas (rumble, sensor infravermelho e etc) não me fizeram falta alguma mas podem fazer para outras pessoas."
497,5,"Produto é bom, o que é ruim é o suporte a jogos. Cada jogo 'hit' custando 250 reais é de descabelar o palhaço, fora que pra poder baixar os jogos grátis, você precisa mudar a região pra  estados unidos, do contrário a store brasileira dentro do switch só te dá opção pra por códigos. Comprei exclusivamente por ser o mais barato pra poder jogar animal crossing, e por não ter tv, do contrário teria comprado o switch normal. 
Se vc tem grana pra jogar na cara da nintendo, aconselho a pegar o normal, as vantagens se pagam, especialmente quando der pau do direcional (joycon drift) nesse aqui vc vai ter de gastar com uma oficina, no normal vc pode comprar um controle a parte e seja feliz."
498,5,"O nintendo switch lite é muito fofo e perfeito para quem deseja ter um console portátil. Ele é confortável para as mãos e é super leve, superou minhas espectativas em tamanho e tamanho da tela também."
499,5,"Muito bom o console com excelente jogos e de poder levar e jogar em qualquer lugar. Para alguns podem incomodar por ser pequeno, mas não atrapalha na jogatina. Essa é a versão portátil, então não dar para ligar na tv. Para aqueles que querem jogar os exclusivos e não liga por ser apenas portátil, é uma boa opção por também ser mais barato. Um ponto importante é o fato de ter apenas 32gb, que é pouco e acaba exigindo muito a compra de um micro sd. Recomendo."
500,4,"O switch veio funcionando direito. Só não darei 5 estrelas pois o carregador que veio é um de hong kong; é preciso comprar um adaptador brasileiro para poder carregar o switch. A caixa também não veio lacrada nem com o manual. Fora isso, o produto veio em excelentes condições."
501,5,"Produto de boa qualidade, bastante portátil e confortável."
502,5,"Achei excelente essa revisão do switch lite. Pra mim o switch sempre foi um portátil, mas o modelo original era meio incomodo por ser maior e mais pesado. Com o lite não temos mais esse problema. Ele e bem mais leve, com um quê de portátil mesmo, o que faz com que ele fique melhor nas mãos. Para quem assim como eu usava o seu switch como um portátil, pode migrar para esse modelo sem medo."
503,5,"É uma versão lite, claro, então não se pode esperar que tenha todos os recursos do irmão maior, mas ainda sim é um ótimo console, a construção é muito boa e o tamanho reduzido torna ele um ótimo console para um gaming-to-go. 
. 
Pena que não vai na tv ou os controles não possuem os recursos apenas, mas não tira o merecimento do console. :)."
504,5,"Produto muito bom para o que é vendido. Mas realmente as vezes faz falta não poder jogar na televisão. Mas fora isso, ótimo console, resistente, bonito e tudo mais."
505,5,"Esse não é meu primeiro switch lite! ja tinha um, e é otimo um aparelho com essa leveza e desempenho fantastico para jogar monster hunter rise, game aaa que cabe perfeitamente em um portatil!. 
Sem contar que roda praticamente todos os games do hibrido. 
Se vc adora consoles portateis, esse sem duvida vai te agradar demais!."
506,5,"Produto tem excelente qualidade, gera mta praticidade. Os gráficos são excelentes (a depender do jogo, é claro). É possível colocar o console em modo repouso (com o jogo suspenso) e ligar o console em poucos segundos, já entrando direto no jogo. Os jogos da nintendo dispensam comentários."
507,5,"Excelente!!! para quem esta em duvida entre esse ou o neon explico as diferencas: esse e menor e os controles do lado nao saem para jogar na tv ele nao tem esse console, porem para criancas ele acaba sendo mais seguro e confortavel justamente por isso, sendo assim recomendo esse produto!!."
508,5,"Simplesmente amável!. 
De uma experiência casual jogando super mario bros. Até novos jogos como monster hunter: rise, este console é adorável e genuinamente bom para uso. Controles precisos e extremamente funcionais e uma biblioteca imensa de jogos, tudo num corpo pequeno e fácil de carregar!. 
Adorei a compra e estou muito feliz com a adição para a minha coleção."
509,5,"Excelente produto, a sensação na mão é ótima apesar de não ter o formato do controle, resolução ótima para usar os aplicativos gratuitos também."
510,5,"Compacto, confortável e os jogos da nintendo são incríveis. Pra quem quer um portátil e não faz questão da dock é uma ótima compra. Os únicos contras que eu tenho é a bateria durar menos que o normal e o preço dos jogos exclusivos serem abusivos (e de quebra não tem nem legenda em português)."
511,5,"O único fato que me incomodou um pouco foi a caixa não ter vindo lacrada, mas fora isso não há nada de errado com o console. Já estou usando ele a semanas e posso dizer que valeu muito a pena."
512,5,"Console espetacular. A nintendo acertou em cheio e a prova disso é que o switch não para de quebrar recordes de venda. Só tem 2 problemas: os preços dos jogos e o descaso da nintendo com relação ao público brasileiro, pois poucos são os jogos traduzidos para o português."
513,5,"Nintendo é nintendo! apesar de não está oficialmente no brasil, o switch dispensa comentários. Juntamente aos grandes títulos lançados é o melhor vídeo game da atualidade! e minha experiência com o lite não poderia ser melhor, visto que aprecio demais portabilidade!."
514,5,"Maravilhoso e essa cor é linda e diferenciada, vale muito a pena pessoal, se tiver a oportunidade de comprar, faça isso!."
515,5,"Sem dúvidas um dos melhores portáteis da nintendo. Jogos excelentes, produto leve, fácil de levar em qualquer lugar. Comprei de novo, depois de ter vendido um, porque o switch lite é necessário para jogar aonde você estiver, quando desejar."
516,4,"Na descrição poderia constar o modelo do carregador do console, como é uma versão australiana se não me engano, os pinos sao retangulares inclinados, nao cabendo em nenhuma tomada ou adaptador brasileiro. 
. 
Fora isso console e games em perfeito estado."
517,5,"Eu já tive o nintendo switch normal, mas este sem dúvidas é o melhor videogame que já possuí. A portabilidade, duração de bateria e qualidade são os pontos que me fizeram trocar do switch que tinha para este, afinal eu só usava no modo portátil."
518,5,"Melhor do que esperava, o switch lite eh incrivel e confesso q achei a tela maior do que eu tinha previsto, ele fica perfeitamente bem nas maos. O unico ponto negativo seria a bateria, q realmente nao dura mt."
519,4,"Bom, bem portavel e com boa duração de bateria porém o produto vem com muito pouco espaço de armazenamento."
520,5,"O switch lite é muito bom! é exatamente o que eu esperava. 
As vezes, realmente, sinto falta de não poder conectar em alguma tv ou monitor, é o único detalhe. 
Recomendo."
521,5,"O produto é excelente, pois tem compatibilidade com os jogos do nintendo switch (cartuchos). A única limitação é que não aceita o cartão de memória usado em outro aparelho, a não ser que você faça a formatação do cartão."
522,5,"Produto excelente, possui a comodidade de um portátil com uma biblioteca de jogos bem interessante. O controle analógico é muito confortável e responsivo no que diz respeito a jogos que exigem execução mais precisa como é o caso dos jogos de luta, definitivamente recomendo."
523,5,"É simplesmente perfeito. Se você gostava de jogar no 3ds ou no vita, vai simplesmente se apaixonar pelo switch lite. Recomendo o azul turquesa, que é lindo. Extremamente confortável para jogar. Os jogos do nintendo online ficam sensacionais nele."
524,5,"Muito bom, dá pra jogar todos os jogos e é portátil, só poderia ter uma memória interna melhor."
525,5,"Gostei muitoo! a princípio eu queria o switch normal, mas não me arrependi em nada de ter comprado o lite. Tirando a duração da bateria, é 10/10."
526,4,"Muito. A bateria deixa bastante a desejar, mas já era esperado. Ele é mais resistente do que parece. Algumas semanas não são o suficiente para avaliar este produto, mas essa primeira impressão é bastante positiva."
527,5,"Muito bonito, só os jogos exclusivos que são muito caras, geralmente tem muita promoção na eshop, mas quase sempre os exclusivos não estão incluso, muitas pessoas reclamam dos gráficos, sim eles não são tão realistas, mas não deixam de ser incríveis e bonitos."
528,5,Produto excelente ótima versão para quem não gosta de jogar o switch na tv ou prefere ter uma versão portátil produto de ótima qualidade recomendo a todos os fãs de games é fãs da nintendo.
529,5,"Muito legal ,sempre fã boy nintendo para mim vídeo game raiz é nintendo!."
530,5,O aparelho é muito bom e a sua portabilidade e o que tem de melhor. Só o catálogo de jogos deixa um pouco a desejar.
531,5,"Sem palavras, se tivesse que dar 10 estrelas, eu daria as 10! um dos melhores consoles de todos os tempos em formato ideal para jogatina portátil! leve, ergonômico, jogos incríveis! um ótimo custo benefício!."
532,5,"Um produto de alta qualidade e que lhe oferece uma experiência realmente divertida, eu recomendo para qualquer fã da nintendo que ainda não tem um switch à comprá-lo pois além do custo-benefício quase todos dos jogos são compatíveis à ele."
533,5,"Produto super bem desenhado! confortável na mão a ponto de passar o dia inteiro segurando sem nenhum problema, bateria duradoura (realmente a ponto de durar 7 horas jogando sem parar) e botões super responsivos."
534,5,Excelente. Ja vem com o carregador para o padrão brasileiro. Estou muito feliz.
535,5,"Console muito bom, da pra comprar joycon e jogar jogos de movimento da mesma maneira que o switch tradicional. Super leve ótimo para segurar."
536,5,"É um dos melhores videogames que já tive. Leve, resolução da tela é ótima. Só peca o tamanho do hd de 32gb. De resto, é um portátil excelente."
537,5,"Console fantástico! a tela é do tamanho ideal, o dpad nativo facilita para os jogos de plataforma e realmente pode ser considerado um portátil quando comparado com a versão standard. A cor está muito bonita também, especialmente a turquesa."
538,3,"Pena q a nintendo não está nem aí para os consumidores brasileiros, de resto, o console eh ótimo. Sendo que os grandes jogos exclusivos são disponibilizados em varias linguas, exceto português."
539,5,"Muito bonito, era exatamente o que eu queria, perfeito pra mim."
540,5,Tudo ok com o produto. O único ponto negativo é que a fonte que veio junto é japonesa e não serve em nossas tomadas.
541,4,"Exatamente como o anunciado, rodou as roms sem problemas. A qualidade da imagem é melhor do que esperava, o único problema é que algumas roms rodam bugadas (mas isso acontece em qualquer emulador)."
542,3,"Produto bom emula bem gba gbc  (100%). 
Super nintendo ( 80%). 
Mega driver (80%)."
543,4,"Atende ao que se propõe, dado o baixo custo. Alguns emuladores tem um fps meio inconstante, mas jogos gameboy color e advance, que eram meu objetivo, rodaram todos muito bem. A bateria realmente acaba muito rápido, mas desligar a chave de energia quando não estiver usando ajuda a aumentar a autonomia."
544,5,"Excelente console portátil, cumpre exatamente a promessa de emular games 2d de arcades, jogabilidade bastante fluída, algumas roms precisam ser baixadas compatíveis com neo geo, porque o emulador mame dele, ainda é bem fraquinho, fora isso estou bem satisfeito com o console."
545,3,"Comprei 2 e um veio com problema, para trocarem eu tinha que fazer um vídeo colocar no google etc, achei muito complicado acho que bastava acreditar na palavra do cliente que o produto tinha defeito."
546,5,Produto que atende o que promete. Simples mas vale pelo preco e as lembrancas dos jogos dos. Vídeo games retro.
547,5,"O produto é muito bom, é bem pequeno e compacto, bom pra carregar no bolso."
548,2,"Não foi como eu esperava , porém tá servindo ao meu filho. Mas não compraria novamente."
549,2,Fraco. A maioria dos jogos ficam travando pois o hardware não aguenta as roms.
550,3,"Produto bom. 
Porém, demora para reconhecer a memoria interna dele quando conectado no pc."
551,5,Muito topp recomendo a tds bateria boa recomendo a tds adquirir esse produto.
552,5,Meu filho amo a o brinquedo veio todos os jogos muito legal.
553,4,Boa qualidade. Com um desenho muito atrativo para as crianças.
554,2,"Meu filho gostou, não é aquelas coisas. Mas é bom."
555,5,Gostei muito tem radio game era tudo que eu queria.
556,3,"Meu neto adorou é legal. 
O preço é bom."
557,5,"Meus filhos gostaram muito,tudo ok até o momento."
558,4,Eh bom mais bateria nao funciona muito bem.
559,1,"Produto não durou dois dias, não gostei mesmo."
560,5,"Muito bom, show,top. Parabéns recomendo muuuuuitos jogos."
561,4,Produto adquirido para presente e aparentemente tudo perfeito.
562,5,Gostei demais desse produto muito bom mesmo.
563,5,"Melhor compra até hoje, amei o produto."
564,5,"Um produto bom, só que não carrega."
565,1,"Um lixo, copia barata, trava toda hora."
566,5,O produto  é  bom. Minha irmã  adorou.
567,4,Produto facil de mexer resolução muito boa.
568,4,Top minha filha amou. Muito bom.
569,3,"Aparelho legal, porém de difícil manuseio."
570,5,Super legal! produto funciona certinho.
571,5,"Ótimo produto, recomendo a todos."
572,5,"Otimo, bonito, divertido varios jogos."
573,5,Muito bom. Pelo preço compensa.
574,5,"Produto veio ok, recomendo. :)."
575,5,Perfeito! tudo certinho! recomendo!.
576,4,"Bom, ótimo produto."
577,3,Bom produto. Recomendo.
578,2,Descarrega rapido.
579,3,Muito bom.
580,4,"É um excelente console. Botões macios e precisos, tela e alto-falantes de ótima qualidade, realmente cumpre o que promete, inclusive os 100 jogos são variados e clássicos!. 
A única razão pela qual não dei 5 estrelas, é por que no meu caso, o cabo usb que acompanha com o produto, serviu penas para carregar, meu notebook não reconheceu o aparelho para transferência de dados. Mas resolvi o problema usando um cabo usb do controle ps3. Também acredito que tenha 100% de compatibilidade com cabos de celulares mais antigos, ou outro sistema mp4/mp5 player. Fora isso tudo perfeito. Fones, carregador, manual e cabo para carregar, tudo incluso e funcionando perfeitamente. A bateria também tem uma ótima durabilidade."
581,3,"Muito bom, imaginei que os clássicos estariam presentes como mario word, kart, d. Kong, rei leão e alguns outro. Só achei que os melhores ficaram de fora. Mas tem outros bem bacanas também."
582,3,"Uma boa aquisição, mas tem prós e contras, cumpre oque promete em relação aos jogos, vem com uma variedade imensa de games de vários gêneros, porém a bateria é que decepciona, com o carregador fornecido a carga é extremamente lenta, e a bateria acaba em pouquíssimo tempo, a câmera é péssima, o som também não é muito legal para ouvir músicas, mas se você quer somente para jogos e não tem necessidade da bateria durar horas e horas, é uma boa compra, também não aconselho para crianças muito pequenas porque o aparelho e bem frágil. Na minha opinião se tirassem as funções inúteis e colocassem uma bateria melhor e uma carcaça mais resistente, ficaria excelente."
583,3,Vale o que foi pago. Não gostei da resolução dos jogos. Usei uma vez e na segunda o console parou de funcionar algumas funções.
584,4,"O produto é bom para passar o tempo. 
. 
Roda mega drive, super nintendo, gba, nes, playstation 1 (um pouco lento). 
. 
A parte boa é a portabilidade e a memória interna. Dá para colocar muitos jogos na memória interna. 
A parte ruim fica por canta da jogabilidade: os botões são altos e isso atrapalha um pouco (mais especificamente os botões direcionais). Agora, os analógicos são bons e macios. 
Outra coisa, games muito pesados ele roda com lentidão. 
. 
Fora isso, é um excelente produto custo benefício."
585,5,"Tem um problema na hora de desligar, isso foi corrigido na versão nespi +."
586,5,"Muito superior aos genéricos e inclusive a outros modelos da krikzz. Tem loading super rápido, muitos save states, volta ao menu durante o gameplay, e é capaz de rodar todos os jogos, inclusive hacks e homebrews mais modernos, e tem muita coisa legal hoje em dia que vale a pena mesmo. Caro, mas pra quem quer essas funções, vale;."
587,4,"Muito bom,mas achei jogos realmente fosse do nintendo e não jogos antigo."
588,5,"Ótimo produto. Atende aos requisitos de quem quer algo simples e que relembre a infância com um pouco mais de praticidade. 
Equipamento um pouco frágil, tem que ter um certo cuidado para manusear. 
Sistema de navegação rápido. 
Vale a pena a compra."
589,3,"Funciona bem, mas não é nada ergonômico. Chega a doer as mãos em pouquíssimo tempo. 
Consegui colocar novos jogos, mas não consegui que os 6 botões funcionassem em jogos de snes ou mega drive."
590,4,"Se vc quer jogar jogos de game boy adv e nintendinho, esse lhe servirá bem. Já snes, megadrive,mame e por aí vai. Esquece. Pelo preço o material do game surpreende positivamente."
591,5,"Produto  muito bom , porém tem muito jogos repetidos , mas vale a pena pelo valor do aparelho , poder reviver momentos da infância com jogos  maravilhosos parabéns pelo produto , recomendo vale muito a pena."
592,2,"O aparelho é razoável, funciona, mas é bem frágil, a bateria nao presta, 20 min de jogo no máximo, o carregador que vem junto nao funciona, péssimo custo benefício."
593,2,"Muito bom,nostálgico,me fez lembrar da era nintendo ,só tem um problema veio  com a carcaça quebrada o pino do parafuso que segura a parte traseira."
594,4,"Não substitui um console mas otimo passa tempo , tem boa memoria interna mas pouco tempo de bateria ,já baxei varios jogos bons mutio facil."
595,5,"Gostei bastante. Facil instalar outros jogos, e é facil na hr de querer jogar, pq posso leva-lo a todos os lugares."
596,5,"Produto legal se for para crianças, o único ponto negativo que achei foi em relação ao áudio, mas fora isso, é bom."
597,5,"Ótima qualidade!vale a pena!. 
Design bacana,dá pra salvar e jogar de onde parou,funciona perfeitamente na tv."
598,5,"Só faltou manual em português, , mas o aparelho da para configurar pois pode se escolher instruções em português."
599,3,"Ótimo, mais não tem wifi, pra usar  internet, pecou nessa parti,  os jogos são muitos bons, recomendo."
600,1,"Cara, muito fraco. Bateria dura pouco, assim a criança nao se diverte. Nao compraria novamente."
601,4,Produto otimo muito bom atendeu minhas expectativas a bateria dura bastante  e tem muitos jogos.
602,2,"Jogos repetidos,bateria fraca e estou pensando em devolve-lo. Produto mal elaborado!!!."
603,4,"Muito bom, há se já existice a uns 25 anis a traz,kkk."
604,3,Material bom e esta funcionando muito bem pena que a bateria acaba rapido.
605,4,"O produto é bom, porém não é da marca que vem na descrição!."
606,4,Só não dou nota máxima por que o produto veio um pouco riscado.
607,5,Produto muito bom meu filho adorou vocês estão de parabéns  produto top.
608,5,Muito bom meu filho está amando eu também gostei funciona direitinho.
609,5,"Produto de ótima qualidade, meu filho adorou, superou minhas expectativas! !."
610,4,Mto bom como anunciado recomendo pra quem gosta de nostalgia.
611,1,"Péssimo apenas jogos japoneses, não originais. Errei feio na compra."
612,4,"Muito bom,tem vários jogos, dá pra se divertir bastante!."
613,5,Roda meu jogos posso joga todos os resident evil ps1.
614,4,Bom e bonito gostei muito. Boa jogabilidade muito jogo.
615,5,Top! show de bola! meu filho gostou muito! satisfeito.
616,1,Produto horrível a bateria não presta dinheiro jogado fora.
617,3,"Bom console,  mas a bateria deixou a desejar."
618,5,"Produto excelente, meu neto adorou! superou as expectativas."
619,5,"Muito  legal, adorei, recomendo para todos diversão garantida."
620,3,"Bom produto,mais a bateria descarrega muito rápido."
621,5,Produto contendo tudo o que promete. Perfeito estado.
622,5,"Muito bom, recomendo, meu filho gostou muito."
623,5,"Perfeito, cumpre o anunciado!  meu filho adorou!."
624,5,Ótimo produto cumpre com q foi prometido.
625,5,Ótimo produto !meu sobrinho adoro o presente!.
626,5,Atendeu as minhas expectativas. Gostei do produto.
627,3,"Produto razoável ,atende o que foi anunciado."
628,3,Para uma criança pequena ira gostar sim.
629,5,"É aquilo q o produto oferece,."
630,5,"Cumpriu todas as minhas expectativas, ameeeei."
631,5,"Realmente cumpre o que promete, gostei!!!."
632,5,Ótimo produto funcionando em perfeito estado.
633,5,Muito está de parabéns pode confiar.
634,4,Jogos legais! aparência frágil para crianças.
635,5,"Muito bom produto, excelente qualidade!!!."
636,5,Produto show  recomendo   a tds.
637,5,"Bom. 
Oferece o que promete. ,."
638,5,Baita mini console. Fodaum demais.
639,1,O produto descarrega muito rápido.
640,5,Muito bom alcançou minhas expectativas.
641,3,Muito bom recomendo este produto.
642,4,Amei seu produto obrigado !!!!!.
643,5,Produto de qualidade. Recomendo.
644,4,"Exatamente como o anunciado, rodou as roms sem problemas. A qualidade da imagem é melhor do que esperava, o único problema é que algumas roms rodam bugadas (mas isso acontece em qualquer emulador)."
645,3,"Produto bom emula bem gba gbc  (100%). 
Super nintendo ( 80%). 
Mega driver (80%)."
646,4,"Atende ao que se propõe, dado o baixo custo. Alguns emuladores tem um fps meio inconstante, mas jogos gameboy color e advance, que eram meu objetivo, rodaram todos muito bem. A bateria realmente acaba muito rápido, mas desligar a chave de energia quando não estiver usando ajuda a aumentar a autonomia."
647,5,"Excelente console portátil, cumpre exatamente a promessa de emular games 2d de arcades, jogabilidade bastante fluída, algumas roms precisam ser baixadas compatíveis com neo geo, porque o emulador mame dele, ainda é bem fraquinho, fora isso estou bem satisfeito com o console."
648,3,"Comprei 2 e um veio com problema, para trocarem eu tinha que fazer um vídeo colocar no google etc, achei muito complicado acho que bastava acreditar na palavra do cliente que o produto tinha defeito."
649,5,Produto que atende o que promete. Simples mas vale pelo preco e as lembrancas dos jogos dos. Vídeo games retro.
650,5,"O produto é muito bom, é bem pequeno e compacto, bom pra carregar no bolso."
651,2,"Não foi como eu esperava , porém tá servindo ao meu filho. Mas não compraria novamente."
652,2,Fraco. A maioria dos jogos ficam travando pois o hardware não aguenta as roms.
653,3,"Produto bom. 
Porém, demora para reconhecer a memoria interna dele quando conectado no pc."
654,5,Muito topp recomendo a tds bateria boa recomendo a tds adquirir esse produto.
655,5,Meu filho amo a o brinquedo veio todos os jogos muito legal.
656,4,Boa qualidade. Com um desenho muito atrativo para as crianças.
657,2,"Meu filho gostou, não é aquelas coisas. Mas é bom."
658,5,Gostei muito tem radio game era tudo que eu queria.
659,3,"Meu neto adorou é legal. 
O preço é bom."
660,5,"Meus filhos gostaram muito,tudo ok até o momento."
661,4,Eh bom mais bateria nao funciona muito bem.
662,1,"Produto não durou dois dias, não gostei mesmo."
663,5,"Muito bom, show,top. Parabéns recomendo muuuuuitos jogos."
664,4,Produto adquirido para presente e aparentemente tudo perfeito.
665,5,Gostei demais desse produto muito bom mesmo.
666,5,"Melhor compra até hoje, amei o produto."
667,5,"Um produto bom, só que não carrega."
668,1,"Um lixo, copia barata, trava toda hora."
669,5,O produto  é  bom. Minha irmã  adorou.
670,4,Produto facil de mexer resolução muito boa.
671,4,Top minha filha amou. Muito bom.
672,3,"Aparelho legal, porém de difícil manuseio."
673,5,Super legal! produto funciona certinho.
674,5,"Ótimo produto, recomendo a todos."
675,5,"Otimo, bonito, divertido varios jogos."
676,5,Muito bom. Pelo preço compensa.
677,5,"Produto veio ok, recomendo. :)."
678,5,Perfeito! tudo certinho! recomendo!.
