,score,comment
0,4,"O produto realmente é muito bom, porém notei alguns detalhes que deve ser levado em consideração: ele esquenta muito, recomendaria utiliza-lo em ambiente de clima mais ameno, aqui em belém-pa eu uso ou com o ar condicionado ligado ou ventilador direto. Cansa um pouco a vista, não é bom uso por muitas horas."
1,5,"Os capacitores são maiores e com maior voltagem, mas dá certo 100%, mesmo com voltagem maior, não há problema, só o tamanho mesmo. Com jeitinho dá pra colocar todos. No meu ficou perfeito e a capacitância veio correta. Capacitância que não pode ser diferente. Acho que só tem este kit anunciado no ml."
2,5,Produto show de bola superou minha expectativa top demais.
3,4,"Produto excelente,só não dei 5 estrelas,pois deixa a desejar nos jogos,mais perfeito,o ruim é que eu perdi minha esposa,mas segue o jogo. ????."
4,5,Produto muito bom gostei de boa qualidade ta funcionando normal.
5,5,Produto muito bom só achei o preço acima mais como não foi pra mim e quem estava comprando disse q não tinha problema comprei mais fez a alegria de uma criança.
6,2,"O console não veio com ""pequenas marcas"", veio extremamente arranhado e com a tampa lateral solta. A parte de cima dele não é original, percebi isso quando vi a cor, não é ""black piano"" eh um preto fosco que tá mal encaixado, o que também faz com que a tampa que cobre o leitor não abra completamente e fique travada. O controle veio completamente arranhado e quebrado, os analógicos ruins e travados, ainda tenho dúvidas se é original. Sendo ou não, ele veio super quebrado. E os ""espertinhos"" colocaram um lacre de garantia em uma parte que tava faltando um pedaço, para que ninguém podesse notar, como se alguém fosse idiota de não perceber, assim que peguei no controle notei que tava quebrado. Muito má qualidade. Me garantiram um console e um controle semi-novo e me foi enviado essa porcaria. Tirando isso, os jogos estão todos no hd, jogos originais e não são demos. Mas a integridade do console deixa a desejar."
7,2,"O produto anunciado como novo é na verdade um produto paralelo, vindo com controle e fonte de alimentação genéricos além de não vir com o manual do produto. Caixa de baixa qualidade. Ao menos os jogos originais do ps3 funcionam normalmente no console."
8,5,"Para quem quer presentear ou jogar os jogos da antiga geração tranquilamente, é uma excelente aquisição, apenas uma ressalva de que acima de 800 reais, esse console não vale a compra, exceto se o custo não for relevante para você."
9,5,"Bom produto. O ps3 foi descontinuado. Não é novo, mas está em ótimo estado. Os jogos funcionam, alguns requerem atualização (boa internet sugerida). Já tive o primeiro ps3, o qual estragou depois de 15 anos, tendo jogos com tecnologia 3 d, que é interessante. Testei-os no leitor bluray, tendo funcionado corretamente, bem como os filmes em bluray. Bom saber que é dificil obter jogos diferentes dos que acompanham o video game, somente online da sony (com preços em euros) ou comprando as midias antigas."
10,5,"Excelente!!! vídeo game em excelente estado de conservação, pegou no estalo, e o joystick apesar de ser paralelo também não deixa nada a desejar. Recomendo com empenho!!!."
11,3,"Produto funcional veio com os acessorios informados, apenas foi observado que ja demonstra marcas de uso tanto no console quanto no controle, preço um pouco elevado para o estado. Mais ate então funcionando tudo perfeitamente."
12,1,"Olá!! comprei o console  usei só 4 vezes, quando fui usar na quinta vez não apareceu a imagem , queimou a entrada hdmi levei pra arrumar , eles abriram o vídeo game ,o console estava todo colado , todo cheio de cola!! não posso ficar com um console assim todo cheio de cola por dentro!! presciso de uma ajuda pfv favor paguei 999 reais no game."
13,3,"O aparelho é bom só o controle q logo da defeito, não tem três meses de uso e já não liga mais."
14,5,"A tampa não abre no automático ,o joystick nem sempre liga o aparelho, mesmo com bateria carregada,o joystick não carrega como deveria,. O joystick quebrou um  dos componentes."
15,4,"O produto veio em perfeitas condições sem riscos ou quebrados, os controles parecem remente ser originais, vieram todos os 100 jogos listados assim como o prometido embora 4 deles vieram demo. Porém ainda acho que o valor vale a pena. 
. 
Tive problemas para jogar online mas consegui resolver. Dou nota 4 somente por conta dos demos, mas o resto veio tudo como prometido."
16,5,"Adorei  bom demais  está funcionando perfeitamente, meu neto e meu esposo  estão se divertindo com ele  recomendo. Pode confiar."
17,4,"Muito bom , super novo so o controle que o botao veio meio torto , mas funciona perfeitamente , sem nenhuma marca de uso, eu recomendo , meu irmão amou o presente."
18,1,"Quando adquiri ps3 gostei muito veio com todos os jogos funcionando perfeitamente, mas com 5 meses de uso ele desligou sozinho e não ligou mais, eu não usava ele com muita frequência, levei até uma assistência e não tem mais conserto, eu já sabia que não era um produto novo, mas não esperava que iria estragar em tão pouco tempo, uma decepção."
19,5,"O produto veio em excelente estado de conservação, não deixando nada a desejar!. 
Todo conservado e muito bem cuidado."
20,5,"Ótimo produto, os jogos e o controle estão funcionando perfeitamente além do ps3 estar super novo sem nenhum arranhão, parece q acabou de ser retirado da caixa."
21,4,"Gostamos. Alguns jogos poderiam ser na versao tradicional, como o sonic. Esperava que fosse o jogo tradicional, mas nao é. Alguns jogos temos que obrigatoriamente esperar a historia do jogo no inicio, nao tendo como agente pular essa parte. Isso achei ruim! mas no geral, gostamos do videogame, veio sem arranhoes e sem avarias. Assim sendo, indicaria pra outras pessoas comprarem!."
22,1,Produto não é de boa qualidade controle similar entre outros defeito que veio apresentando.
23,5,"Muito bom, compraria novamente, rodando 100% como não é mais fabricado ainda vale muito apena, tem marcas de uso, tem mas vale muito a pena ! 5 estrelas."
24,5,"Bem depois de 1 ano que eu comprei da pra opinar melhor,  compensa pelo tanto de jogos porém o controlo com pouco tempo de uso não carrega mais e vc mal consegue jogar , comprei até outro cabo e nada o hdmi também é bem fraco mais pode compra que vc vai ter muita diversão abraço."
25,5,"Excelente console em perfeitas condições, valeu muito a pena a compra. Recomendo!!!."
26,5,"O vídeo game é excelente, fiz uma ótima compra, para quem não pode pagar mais caro em ps4 ou ps5 eu recomendo cheggou novinho na caixa."
27,5,"Ótimo produto, excelente para entretenimento adulto e infantil, muitos jogos disponíveis e com preços muito acessíveis, diferente do ps4 que os jogos ainda estão os olhos da cara, e a diferença não é tão gritante em gráfico e jogabilidade como foi do ps2 para ou ps3! vale comprar um ps3 e esperar o ps5 sair!."
28,3,"E um bom produto, exatamente como anunciado, estamos contente com a aquisição."
29,5,"Muito bom, comprem sem medo, console em perfeito estado, impecável, nem aparenta ser usado, recomendo à todos, gostei muito, e principalmente meu sobrinho que ganhou de presente."
30,3,Gostei. Apesar de nenhum dos 2 controles serem originais da sony e de ter visto muita poeira  e ferrugem  no console. Mas eu já  sabia que o produto era seminovo e que poderia ter esses  pequenos detalhes. Mas tudo bem! meu garoto está  jogando com  ele é agora tem um ps3 da sony !!!.
31,5,"Muito bom o produto, estou satisfeito."
32,4,Muito bom mais o cabo hdmi ficou falhando não funcionou muito bem quando foi instalado precisei precionar bem ele na entrada da tv pra tentar pegar.
33,3,"O controle veio carregado e eu usei até descarregar mais quando eu coloquei pra carregar tá dando defeito. Eu começo a jogar ai do nada no meio do jogo, o jogo paralisa e aparece uma mensagem dizendo q o controle está desconectado sendo q ele está conectado. Não carrega de jeito nenhum."
34,5,"Excelente ps3!. 
Recomendo a compra."
35,5,"Tudo funcionando, com exceção do cabo hdmi que veio com mal contato, mas como é algo barato, não diminui a qualidade do produto. Controles ótimos!."
36,1,"Total descaso com nós consumidores, eles estão vendendo produto usado como se fosse algo novo, estou completamente decepcionado com esta compra, fiz varias perguntas, questionei inúmeras vezes se o console era novo mesmo e foram capaz de mentir, me enganaram, o preço sugerido se tratando de algo seminovo é um absurdo. Lamentável."
37,5,Produto em perfeito estado top!.
38,4,"Está funcionando perfeitamente, mas a lateral está solta, tem dois ganchinhos que estão quebrados, mas pode ter cido o correio que deixo bater."
39,5,"Produto funcionando muito bem! inclusive, já vem com o software em português, precisando de pouca atualização na hora de usar. Não tem diferença entre esse modelo e os modelos americanos. A única diferença mesmo está no software. Como já vem em português, precisa de pouco tempo para baixar as atualizações de idioma."
40,5,Muito bom adorei excelentes produto.
41,1,O produto veio com defeito ele não rodava jogos de mídia física e também  o botão de ejetar não estava funcionando.
42,3,"Produto bom porém a caixa veio muito amassada  e o botão de ejetar o tampa do drive de dvd não abre a tampa tenho que abrir manualmente o resto está tudo ok funcionando perfeitamente e aproveitando bastante apesar do que mencionei logo acima pra mim valeu a pena , compraria novamente,  obrigado !."
43,5,Produto de excelente qualidade.
44,4,Otimo produto. Apenas o cabo hdmi que veio com problema e nao pegou! mas o playstation é perfeito!.
45,5,"Já opinei umas 3 vezes sobre esta compra! acho que o mercado livre tá ""bugado"" heheheheh! vamo lá outra vez! muito bom o play 3, porem alguns dos 100 jogos apenas uns poucos), ou  estão incompletos ou são versões de teste. Fora isso, tudo ok. Recomendo a compra sim!."
46,3,"Foi comprado para presente, quem recebeu diz que ficou satisfeito e ficou feliz com o console do ps3."
47,4,"Bom dia o produto eu achei mto bom. Só estou com problema pois canselei a primeira compra e depois fiz novamente só que me cobraram 2x, pois vcs deveriam ter estornado meu dinheiro em 15 dias e ate agora nada. Espero uma soluçao de vcs rapido. Atenciosamente tania."
48,4,"Não veio a nota fiscal, do produto e nem manual de estrução,por isso não dei 5 estrelas."
49,5,"Produto muito bom, por ser usado veio em ótimo estado sem marcas de arranhões, todos os jogos certinhos, só n testei o leitor de dvd ainda mais o resto está funcionando em perfeito estado. Ótimo produto, já faz mais de 2 semanas de uso e tô impressionado."
50,5,"55 jogos com muitas variedades. 
Só faltou um pouco dos jogos mais populares,mas pelo preço tá fantástico."
51,2,"Dos dois controles só um funcionou e o que está funcionando já apresenta problema no direcional esquerdo, fica mexendo sozinho o personagem do jogo. Mandei e-mail pra ver se trocavam o controle mas nada foi respondido. O vídeo game está bom, mas os controles não. Decepcionado."
52,3,"Produto funcionando, mais apresentando alguns pontos de ferrugem e muita poeira, pederia estar um pouo melhor armazenado."
53,3,"O console está funcionando o problema é que todos os jogos que já testei até agora:gta5 tomb raiden far cry 4 call of duty 3. Estão dando algumas travadas enquanto estou jogando principalmente o gta5, já estou até pesquisando no youtube como resolver o problema."
54,1,"Fiquei muito chateada, os dois controles ruins, já pedi a troca dos controles e até agora nada!."
55,2,"Faz semanas que reclamei dos controles e do vídeo game que desliga sozinho, e nada foi feito! os controles não querem pegar sem o cabo usb, e as vezes o vídeo game fica ligando sozinho. Fui procurar ajuda, mal me responderam, e até agora nada!."
56,5,"Produto de boa qualidade, veio tudo ok, ótimos jogos, gostei bastante, recomendo para todos do mercado livre !!!."
57,1,"Produto velho todo cheio de risco com peça  quebradas e colada com tree bond, o controle já estava com as letras todas desbotada de tanto uso. Péssima qualidade por se tratar de uma compra de um produto que estava anunciado como novo. Não  recomendo! !!."
58,4,"Exatamente como o anunciado, rodou as roms sem problemas. A qualidade da imagem é melhor do que esperava, o único problema é que algumas roms rodam bugadas (mas isso acontece em qualquer emulador)."
59,3,"Produto bom emula bem gba gbc  (100%). 
Super nintendo ( 80%). 
Mega driver (80%)."
60,4,"Atende ao que se propõe, dado o baixo custo. Alguns emuladores tem um fps meio inconstante, mas jogos gameboy color e advance, que eram meu objetivo, rodaram todos muito bem. A bateria realmente acaba muito rápido, mas desligar a chave de energia quando não estiver usando ajuda a aumentar a autonomia."
61,5,"Excelente console portátil, cumpre exatamente a promessa de emular games 2d de arcades, jogabilidade bastante fluída, algumas roms precisam ser baixadas compatíveis com neo geo, porque o emulador mame dele, ainda é bem fraquinho, fora isso estou bem satisfeito com o console."
62,3,"Comprei 2 e um veio com problema, para trocarem eu tinha que fazer um vídeo colocar no google etc, achei muito complicado acho que bastava acreditar na palavra do cliente que o produto tinha defeito."
63,5,Produto que atende o que promete. Simples mas vale pelo preco e as lembrancas dos jogos dos. Vídeo games retro.
64,5,"O produto é muito bom, é bem pequeno e compacto, bom pra carregar no bolso."
65,2,"Não foi como eu esperava , porém tá servindo ao meu filho. Mas não compraria novamente."
66,2,Fraco. A maioria dos jogos ficam travando pois o hardware não aguenta as roms.
67,3,"Produto bom. 
Porém, demora para reconhecer a memoria interna dele quando conectado no pc."
68,5,Muito topp recomendo a tds bateria boa recomendo a tds adquirir esse produto.
69,5,Meu filho amo a o brinquedo veio todos os jogos muito legal.
70,4,Boa qualidade. Com um desenho muito atrativo para as crianças.
71,2,"Meu filho gostou, não é aquelas coisas. Mas é bom."
72,5,Gostei muito tem radio game era tudo que eu queria.
73,3,"Meu neto adorou é legal. 
O preço é bom."
74,5,"Meus filhos gostaram muito,tudo ok até o momento."
75,4,Eh bom mais bateria nao funciona muito bem.
76,1,"Produto não durou dois dias, não gostei mesmo."
77,5,"Muito bom, show,top. Parabéns recomendo muuuuuitos jogos."
78,4,Produto adquirido para presente e aparentemente tudo perfeito.
79,5,Gostei demais desse produto muito bom mesmo.
80,5,"Melhor compra até hoje, amei o produto."
81,5,"Um produto bom, só que não carrega."
82,1,"Um lixo, copia barata, trava toda hora."
83,5,O produto  é  bom. Minha irmã  adorou.
84,4,Produto facil de mexer resolução muito boa.
85,4,Top minha filha amou. Muito bom.
86,3,"Aparelho legal, porém de difícil manuseio."
87,5,Super legal! produto funciona certinho.
88,5,"Ótimo produto, recomendo a todos."
89,5,"Otimo, bonito, divertido varios jogos."
90,5,Muito bom. Pelo preço compensa.
91,5,"Produto veio ok, recomendo. :)."
92,5,Perfeito! tudo certinho! recomendo!.
93,4,"Bom, ótimo produto."
94,3,Bom produto. Recomendo.
95,2,Descarrega rapido.
96,3,Muito bom.
97,5,"Amei, era exatamente com o que eu estava contando. 3 jogos clássicos na palma de minha mão, mais 1 ótimo para ver o tempo passar."
98,5,"Um item perfeito pra quem gosta de zelda e de colecionar videogames, gostei muito."
99,5,"Fantástico, para quem é fã de the legend of zelda, é item obrigatório."
100,5,Mais um belo item para a minha coleção. Excelente console portátil.
101,5,Um bom produto pra quem gosta dos jogos.
102,5,Excelente produto para colecionador.
103,5,O brinquedo atendeu a expectativa comprei pata meus sobrinhos mais foram os pai que mais gostaram rs t. Joguei e adorei pois lembra velhos tempo mãos para crianças de hj em. Dia não é interessante eles não. Curte muito!! mais o brinquedo em si tem qualidade da pra brincar.
104,5,"Ótimo produto, voltei no tempo e gostei."
105,1,Veio com defeito não funcionou.
106,5,Muito bom esse minigame e o  joguinho  é muito legal.
107,5,"Lembra o jogo tetris. 
É  um bom entretenimento, de forma a sair um pouco dos jogos do celular. 
Indico."
108,1,"Muito frágil, quebrou no segundo dia de uso."
109,1,Ja era o que eu esperava o problema é que um veio com os botoes sem funcionar eles teriam que testar antes de enviar p cliente não recomendo.
110,5,Ideal para os nostálgicos diversão garantida!.
111,1,"Produto não funciona. Nem consegui ligar. 
Um absurdo."
112,4,Mesmo com material mais frágil funciona perfeitamente e atendeu minha expectativa.
113,1,"Produto de péssima qualidade e com apenas um jogo, nao tem o tetris. São apenas variações do mesmo jogo que mal vc cons guê identificar."
114,5,"Produto somes porém ótimo produto,minha sobrinha adorou."
115,2,Protuto frágil de mais e não vem todos os jogos que está descrito.
116,5,Produto muito bom meus netos adoraram.
117,4,Boa tarde. Um veio com defeito. Mas os outros três vieram bons.
118,5,"Excelente, pura nostalgia produto muito bom."
119,4,"Produto bem feito, com varias opções de cores."
120,5,"Meu sobrinho adorou, qualidade é boaa."
121,5,"Muito bom e divertido, não tenho mais opinião."
122,5,Ótimo muito bom gostei excelente produto.
123,3,Gostei muito do jeito que eu queria.
124,4,Recomendo muito bom serviço.
125,5,Produto veio ok tudo certinho recomendo.
126,5,Excelente produto super indico.
127,5,Satisfeita com o produto comprado.
128,1,"Horrível ,muito inferior , péssima qualidade."
129,4,"Exatamente como o anunciado, rodou as roms sem problemas. A qualidade da imagem é melhor do que esperava, o único problema é que algumas roms rodam bugadas (mas isso acontece em qualquer emulador)."
130,3,"Produto bom emula bem gba gbc  (100%). 
Super nintendo ( 80%). 
Mega driver (80%)."
131,4,"Atende ao que se propõe, dado o baixo custo. Alguns emuladores tem um fps meio inconstante, mas jogos gameboy color e advance, que eram meu objetivo, rodaram todos muito bem. A bateria realmente acaba muito rápido, mas desligar a chave de energia quando não estiver usando ajuda a aumentar a autonomia."
132,5,"Excelente console portátil, cumpre exatamente a promessa de emular games 2d de arcades, jogabilidade bastante fluída, algumas roms precisam ser baixadas compatíveis com neo geo, porque o emulador mame dele, ainda é bem fraquinho, fora isso estou bem satisfeito com o console."
133,3,"Comprei 2 e um veio com problema, para trocarem eu tinha que fazer um vídeo colocar no google etc, achei muito complicado acho que bastava acreditar na palavra do cliente que o produto tinha defeito."
134,5,Produto que atende o que promete. Simples mas vale pelo preco e as lembrancas dos jogos dos. Vídeo games retro.
135,5,"O produto é muito bom, é bem pequeno e compacto, bom pra carregar no bolso."
136,2,"Não foi como eu esperava , porém tá servindo ao meu filho. Mas não compraria novamente."
137,2,Fraco. A maioria dos jogos ficam travando pois o hardware não aguenta as roms.
138,3,"Produto bom. 
Porém, demora para reconhecer a memoria interna dele quando conectado no pc."
139,5,Muito topp recomendo a tds bateria boa recomendo a tds adquirir esse produto.
140,5,Meu filho amo a o brinquedo veio todos os jogos muito legal.
141,4,Boa qualidade. Com um desenho muito atrativo para as crianças.
142,2,"Meu filho gostou, não é aquelas coisas. Mas é bom."
143,5,Gostei muito tem radio game era tudo que eu queria.
144,3,"Meu neto adorou é legal. 
O preço é bom."
145,5,"Meus filhos gostaram muito,tudo ok até o momento."
146,4,Eh bom mais bateria nao funciona muito bem.
147,1,"Produto não durou dois dias, não gostei mesmo."
148,5,"Muito bom, show,top. Parabéns recomendo muuuuuitos jogos."
149,4,Produto adquirido para presente e aparentemente tudo perfeito.
150,5,Gostei demais desse produto muito bom mesmo.
151,5,"Melhor compra até hoje, amei o produto."
152,5,"Um produto bom, só que não carrega."
153,1,"Um lixo, copia barata, trava toda hora."
154,5,O produto  é  bom. Minha irmã  adorou.
155,4,Produto facil de mexer resolução muito boa.
156,4,Top minha filha amou. Muito bom.
157,3,"Aparelho legal, porém de difícil manuseio."
158,5,Super legal! produto funciona certinho.
159,5,"Ótimo produto, recomendo a todos."
160,5,"Otimo, bonito, divertido varios jogos."
161,5,Muito bom. Pelo preço compensa.
162,5,"Produto veio ok, recomendo. :)."
163,5,Perfeito! tudo certinho! recomendo!.
164,4,"Bom, ótimo produto."
165,3,Bom produto. Recomendo.
166,2,Descarrega rapido.
167,3,Muito bom.
168,5,"Ótimo produto, tem os jogos que eu queria, tem como salvar os jogos para continuar de onde parou e o melhor. Não fica travando como os antigos videogames mais antigo de fita que muita das vezes a gente tinha que ficar tirando as fitas para limpar passar uma borracha kk, quem já teve sabe do que estou falando. Pode comprar que não vai se arrepender."
169,5,Produto de boa qualidade mesmo vale a pena.
170,5,"Ótimo produto, cumpre o que promete. A proteção contra arranhões não é boa, recomendo colocar uma película."
171,5,Maravilhoso amei super indico comprei pro meu filho de 5 anos ele tá amando funciona perfeitamente nas tvs de 50 smart.
172,4,O produto tem boa qualidade. Percebi nesse pouco tempo de compra que  foi uma vez que houve travamento de jogo.
173,5,Otimo produto fiquei de boca aberta esta de parabéns podem comprar sem medo pois o produto é bom demais.
174,5,Muito legal!!! nostalgia pura. Tem todos os jogos de fliperama que eu costumava jogar.
175,5,Ótimo vídeo game muitos jogos legais que não via a tempo.
176,5,"Produto perfeito, nostalgia pura. Super prático de ligar com excelentes jogos."
177,5,Adorei os jogos me faz lembrar da infância.
178,2,"Produto de baixa qulalidade, controles muito ruins."
179,5,Ótimo produto atende todas as minhas espectativas.
180,4,"Tirando o memory card paralelo e o analógico direito com famoso defeito de mexer só, o aparelho funciona muito bem o que era que importava !!!."
181,5,Excelente produto. Muito bom.
182,5,Produto de ótima qualidade bem barato.
183,5,Só quero saber voltagem console.
184,4,"Exatamente como o anunciado, rodou as roms sem problemas. A qualidade da imagem é melhor do que esperava, o único problema é que algumas roms rodam bugadas (mas isso acontece em qualquer emulador)."
185,3,"Produto bom emula bem gba gbc  (100%). 
Super nintendo ( 80%). 
Mega driver (80%)."
186,4,"Atende ao que se propõe, dado o baixo custo. Alguns emuladores tem um fps meio inconstante, mas jogos gameboy color e advance, que eram meu objetivo, rodaram todos muito bem. A bateria realmente acaba muito rápido, mas desligar a chave de energia quando não estiver usando ajuda a aumentar a autonomia."
187,5,"Excelente console portátil, cumpre exatamente a promessa de emular games 2d de arcades, jogabilidade bastante fluída, algumas roms precisam ser baixadas compatíveis com neo geo, porque o emulador mame dele, ainda é bem fraquinho, fora isso estou bem satisfeito com o console."
188,3,"Comprei 2 e um veio com problema, para trocarem eu tinha que fazer um vídeo colocar no google etc, achei muito complicado acho que bastava acreditar na palavra do cliente que o produto tinha defeito."
189,5,Produto que atende o que promete. Simples mas vale pelo preco e as lembrancas dos jogos dos. Vídeo games retro.
190,5,"O produto é muito bom, é bem pequeno e compacto, bom pra carregar no bolso."
191,2,"Não foi como eu esperava , porém tá servindo ao meu filho. Mas não compraria novamente."
192,2,Fraco. A maioria dos jogos ficam travando pois o hardware não aguenta as roms.
193,3,"Produto bom. 
Porém, demora para reconhecer a memoria interna dele quando conectado no pc."
194,5,Muito topp recomendo a tds bateria boa recomendo a tds adquirir esse produto.
195,5,Meu filho amo a o brinquedo veio todos os jogos muito legal.
196,4,Boa qualidade. Com um desenho muito atrativo para as crianças.
197,2,"Meu filho gostou, não é aquelas coisas. Mas é bom."
198,5,Gostei muito tem radio game era tudo que eu queria.
199,3,"Meu neto adorou é legal. 
O preço é bom."
200,5,"Meus filhos gostaram muito,tudo ok até o momento."
201,4,Eh bom mais bateria nao funciona muito bem.
202,1,"Produto não durou dois dias, não gostei mesmo."
203,5,"Muito bom, show,top. Parabéns recomendo muuuuuitos jogos."
204,4,Produto adquirido para presente e aparentemente tudo perfeito.
205,5,Gostei demais desse produto muito bom mesmo.
206,5,"Melhor compra até hoje, amei o produto."
207,5,"Um produto bom, só que não carrega."
208,1,"Um lixo, copia barata, trava toda hora."
209,5,O produto  é  bom. Minha irmã  adorou.
210,4,Produto facil de mexer resolução muito boa.
211,4,Top minha filha amou. Muito bom.
212,3,"Aparelho legal, porém de difícil manuseio."
213,5,Super legal! produto funciona certinho.
214,5,"Ótimo produto, recomendo a todos."
215,5,"Otimo, bonito, divertido varios jogos."
216,5,Muito bom. Pelo preço compensa.
217,5,"Produto veio ok, recomendo. :)."
218,5,Perfeito! tudo certinho! recomendo!.
219,4,"Bom, ótimo produto."
220,3,Bom produto. Recomendo.
221,2,Descarrega rapido.
222,3,Muito bom.
223,4,Gostei. Boa imagem. Funciona bem. Recomendo.
224,5,"Excelente, nos remete mesmo às decadas de 80, 90, pena que já me falta visão e não consigo enxergar a tela mas o game é nota 10, meu filho adorou! um clássico!."
225,5,"Produto original,lacrado,quem estava na dúvida podem comprar sem medo."
226,5,Bem nostalgico so que moderno como um celular.
