,score,comment
227,5,"Amei este produto! está versão oficial do super mario bros em forma de mini game está excelente. Este mini game é bem leve, por ser bem pequeno, ele cabe em qualquer lugar. Ele possui uma alta qualidade de som e imagem, os controles funcionam perfeitamente bem. Recomendo pra todos aqueles que realmente gostam de nostalgia, que são fãs do personagem mario. Não a o que se queixar deste produto, produto de alta qualidade e único, recomendo a todos."
228,5,Produto de alta qualidade nota 10.
229,5,"Original nintendo ! o jogo é básico mas com qualidade nintendo tem horas e horas de diversão, fora a durabilidade de um console original. Botões, tela e som. Saudades do game boy. Muito bom recomendo. Eu utilizo e meu filho também adora. Recomendo."
230,5,"É uma item de decoração interativo. Lindo para coleções. No dia a dia é pouco aproveitável e não serve pra ser destravado, já que o desbloqueio exige conhecimento e equipamentos específicos."
231,5,"Fantástico! é muito bonito, a tela tem uma imagem top e o relógio é muito legal. Vale muito a pena comprar."
232,5,A nintendo se superou nessa. Item de colecionador pra comemorar os 35 anos do mario.
233,5,Perfeito muito bom indico para qualquer pessoa que curta um bom game.
234,5,Um verdadeiro clássico! muito bem construído e uma peça de colecionador!.
235,5,"Sensacional, pura nostalgia, viagem no tempo e espaço. Grande sacada!!!."
236,5,"Produto de qualidade nintendo, otimo acabamento e de qualidade alta."
237,5,"Produto muito top, aquele que não pode faltar na coleção."
238,5,"Nintendo game and watch original, lacrado na caixa."
239,5,"Ótimo produto. Perfeito, vale muito a pena."
240,5,Muito bom e nostálgico compraria novamente.
241,5,Recomendo ! um classico para old gamers.
242,5,"Produto original, lacrado. Tudo certinho."
243,5,Produto de excelente quelidade.
244,5,Exatamente como anunciado!!!!!!!.
245,4,"Gostei do produto ! por se tratar de um item ""retrô"" é bom e divertido!!! relembrando os bons tempos de atari."
246,5,"Qualidade incrível, tanto na caixa plástica quanto no label. Botão de menu funciona perfeitamente. Não precisa desligar. Quando estiver jogando e quiser mudar para outro jogo, só apertar e usar o controle para cima e para baixo e selecionar com o botão. Se quiser mudar a página inteira para cima ou para baixo, só usar o controle para os lados. Jogos em ordem alfabética. Jogos adultos separados no final com ""*"" asterisco. Muito bom mesmo. Dá para aposentar todos os cartuchos. Além de ter jogos bem raros que são label dourado e prateado, dá para fazer uma encomenda ao fabricante. Valeu cada real!."
247,4,"Só não classifiquei com 5 estrelas pelo fato de alguns jogos não carregam, ou a tela fica escura, não se vê a imagem, ou somente escuta o audio e não se tem a imagem, ou aparecem a imagem e carregam em parte e não dá para se jogar, mas isso acontece com alguns jogos. Em geral fiquei satisfeito. Um acervo para se guardar com muito carinho e sempre que bater a nostalgia de apreciar os jogos desta geração, é fácil, prático de acessar e jogar."
248,5,"Tudo o que um atari precisa, apesar do preço ser mais alto de dos cartuchos de um jogo, se o usuário pensar que ele possui todos os jogos possíveis, e mais extras incríveis tais como demonstração, telas, intro, músicas,etc vale muito comprar pois o custo de se comprar 7 cartuchos originais paga o preço desse. Fácil de navegar e escolher os jogos, é o cartucho que deve ficar sempre encaixado no atari. Recomendo o investimento fazendo as contas."
249,2,"O papelão é de qualidade. A película adesiva onde é feita a impressão também é boa. A impressão é horrível onde as cabeças de impressão da impressora utilizadas estavam entupidas gerando linhas zebradas por toda a caixa e borrões. Se você quer uma caixa apenas para transporte vai fundo, mas se você é colecionador e quer algo bonito para guardar ou exibir (meu caso), não é a melhor opção. Vai virar caixa de transporte do atari."
250,5,"Flashcart de excelente qualidade - já testei vários flashcarts para vários sistemas e este com certeza é o melhor de todos (os everdrives do krikzz passam vergonha perto do acabamento de primeira deste cartucho) - testei num tv-game (um clone do clone do atari) e funcionou de primeira e perfeitamente, nada de glitches."
251,5,"Gostei muito, todos os jogos funcionam normalmente. Recomendo. 
Bom seria se nos anos 80 tivesse havido uma fita dessas. 
Mas blz, agora serve para brincar de vez em quando e relembrar dos tempos bons q não voltam mais. 
Vale a pena comprar essa fita. Abraço."
252,5,"Fantástico!!!! funcionou 100%, diversão garantida! menu facil de encontrar os jogos e com um botão pra ir para o menu a hora que quiser! não perca tempo! adquira o seu."
253,5,"Ótimo produto, me satisfez com o que eu queria. Praticidade já com o sd card prontinho com os jogos, e bem organizado."
254,4,"Muito bom o produto. Alguns poucos jogos não funcionaram bem, mesmo em consoles diferentes (ambos polivox nacional 2600), mas mesmo assim recomendo."
255,3,Muitos jogos que estão no cartão sd não funcionam. E alguns jogos abrem e quando a gente está jogando ele trava.
256,4,Cartão sd com jogos de atari flashback portátil funcionam são exatamente iguais dos jogos que foram lançadas anos 80.
257,3,Bom produto mas faltaram alguns jogos. Poderia ter colocado mais jogos originais e alguns protótipos e não hacks.
258,5,"Produto de exelente qualidade, porém pelo valor do preço deveria vir com o berço dentro da caixa."
259,5,"Produto muito bom de boa qualidade. 
Mas não é qualquer carcaça de cartucho que serve na placa."
260,5,"Excelente produto, menu de jogos claro e objetivo, e todos os jogos no cartao, bom mesmo."
261,5,"Excelente produto, ótimo custo beneficio, muito bem produzido, funcionou tudo que testei, perfeito."
262,5,"Cumpre o que promete, e funciona muito bem no atari e no cce."
263,3,"Achei que viria com a logo do atari, mas veio cartão sd normal."
264,5,"Perfeito. Exatamente como descrito, fácil de usar, e funciona perfeitamente no meu polivox."
265,5,"Cartucho espetacular, possui todos os jogos com menu interativo, muito bacana recomendo."
266,5,"Ótimo custo benefício, todos os jogos rodando perfeitamente e com muita qualidade."
267,5,"Excelente! praticamente novo, impecável e com jogos fantásticos. Vale cada centavo."
268,3,"Alguns jogos não funcionam, mas no geral da a maioria funcionou."
269,5,"Produto muito bom, muito bem acabado, realmente vale a pena!!."
270,5,"O cartucho atendeu as expectativas, um otimo produto, estou satisfeito."
271,5,Muito bom. Funcionou perfeitamente quando coloquei ele no meu console.
272,5,"Vale cada centavo que foi gasto nele, muito bom."
273,5,"Muito bom, excelente opção para economizar com muitos jogos."
274,3,Gostei da caixa e bem parecida com a original.
275,5,"Produto bem eficiente, fácil de usar e funciona mesmo."
276,5,"Muito bom. 
Agora consigo jogar todos os jogos."
277,5,Muito bom. Funcionou perfeitamente. Tem todos os jogos.
278,4,Bom produto para quem gosta de jogos antigos.
279,5,"Muito bom mesmo, o botão reset é show."
280,5,Otimo produto recomendo a todos do ml.
281,4,"Tudo como na descrição do produto, recomendo!."
282,5,Excelente produto. Funciona tudo. Recomendo a todos.
283,5,"Cartulho excelente, funcionou perfeitamente, acabamento muito bom."
284,5,Produto de qualidade impressionante. Nota 10.
285,5,Muito bom o produto gostei  muito.
286,5,"Tudo certo como anuciado, produto 100%."
287,5,Produto incrível de qualidade impecável! excelente! :).
288,5,Excelente produto. Tudo conforme a descrição.
289,5,Incrivel!! perfeito!! uma viagem no tempo!!.
290,5,Produto em perfeita condicoes de uso.
291,5,"Muito top. 
Gostei muito do produto."
292,5,Incrível. Sensacional. Tudo o que desejava.
293,5,Muito bom estou me divertindo bastante.
294,5,Produto incrível. Parabéns pelo produto.
295,5,"Excelente qualidade, label bem feita."
296,5,Excelente produto. Roda tudo. Recomendo!.
297,5,Perfeito. Tudo certo. Recomendo 100%!!!.
298,5,"Gostei muito, estou jogando bastante,."
299,5,Excelente produto !. Recomendo a todos !.
300,5,Show de bola. Funciona perfeito.
301,4,Fisicamente é um produto frágil.
302,5,Recomendo. Produto de qualidade!!!.
303,5,"Funcionando perfeitamente, muito satisfeito!."
304,5,"Tudo ok, funcionando perfeitamente."
305,5,Muito bom o produto.
306,5,Ótimo. Funciona perfeitamente.
307,5,Ótimo? produto!! adorei.
308,5,"Tudo ok, excelente!."
309,5,Perfeito estado.
310,5,Excelente qualidade.
311,5,Funciona perfeito.
312,3,Bom.
313,4,"Muito bom, estou satisfeito com a compra."
314,1,Acho isso uma covardia vender um produto que não serve pra nada  não fonciona nada  faltando peças  só não devolvi por que não compensa a dor de cabeça  e mandei um técnico consertar e ele falou que não vale a pena  faltando placa do botão pawer completa  a peça fundamental p ligar  como que ele foi testado  antes de enviar    estou decepcionado. Perdi 530 reais atoa.
315,5,"O produto é bom, eu não sei se é eu estando desacostumado com os gráficos (aposto mais nisso) ou se tá com a qualidade baixa, mas não estou nem aí pros gráficos. Quero jogar os jogos que eu passei a minha infância jogando! muito obrigado pelo produto!."
316,5,"Funcionou perfeitamente! está com leves arranhões na parte refratária, mas isso é ínfimo quando comparado com o prazer de estar jogando novamente! não joguei todos os jogos ainda, mas todos que testei funcionam bem."
317,5,Olá bom dia! não gostei muito o controle era pra ser original mandaram um simular. E falar na descrição que o playstation é desbloqueado e nem todos os cds pega.
318,5,"Produto excelente! comprei e superou minhas expectativas, logico que se trata de um prosuto semi-novo, mas esta com otimo estado de conservação! funciona tudo, nada sem funcionar!."
319,3,Comprei o produto para minha irmã e a mesma informou como se algo do aparelho estivesse bloqueado. Comprou um cd colocou e não faz a leitura como deveria.
320,5,Muito bom o ps2! eu ja tinha o playstation 1 e o ps4 agora com este minha coleção está quase completa so falta o ps3 ^^.
321,5,"Produto excelente em perfeito estado, e além de rodar jogos de ps2 também roda jogos de ps1 e dvds. Superou as expectativas. Sensacional."
322,3,"Produto muito bom, porem veio em uma caixa de papelão normal que creio eu não é a caixa original e sem manual nenhum."
323,4,Do 4 estrelas o produto é bom o problema é por que demora muito para começar o jogo fica travando mais gostei.
324,4,O play2 é bom mas teve um pequeno problema o controle não funciona a tecla l1  as outras teclas funciona perfeitamente.
325,5,"Ótimo! apenas os controles que não são originais, porém como são brindes, tá de bom tamanho. Recomendo!."
326,5,Ótimo produto meu filho amou esta funcionando bem n trava é desbloqueado muito bom recomendo.
327,5,Produto bom achamos q estsavv com problema mais não. Estava era só mau contato obg.
328,5,"Muito bommm esqueci de falar. 
Estamos usando otimo eu recomendo mesmoooo. 
Usa muito os gemeos."
329,5,Meu filho está amando playstation joga todos os dias está se divertindo bastante recomendo!.
330,5,"Game excelente. Liga e le o disco com ligeira demora, mas da pra jogar."
331,4,"Muito bom! índico para todos, só acho que deveria ser um pouco mais barato."
332,5,"Superou todas as necessidades, enviou com os jogos que eu pedi tdo certo. Obrigado."
333,5,"Eu comprei pra dar de presente, o playstation é ótimo o jhonatan amou."
334,5,Produto excelente. Meu sobrinho ficou encantado. Exatamente como ele queria e como esperávamos.
335,2,". . . Ele funcionou 1 semana ,agora não roda mais jogo nenhum."
336,5,"Muito bom, até o momento correspondendo ao que foi anunciado."
337,5,O produto é muito bom não tenho nada que reclamar.
338,5,"Muito bom, veio novo. Ate agora nao tive problemas."
339,5,Muito bom o produto bom pra passar o tempo.
340,5,Produto de ótima qualidade e muito  bom mesmo.
341,1,O controle n funciona! tive que comprar outro.
342,4,Muito bom gostei vale apena a pessoa compra.
343,5,"Estava lacrado bem fechado. Por fim, funcionando perfeitamente."
344,5,Cara voçês estam de parabéns aparelho muito gostei.
345,4,"Bom. Tudo nos conformes. 
Bom produto. Tudo legal."
346,5,"Produto muito bom, ótimo para  momentos de distrações."
347,5,"Realmente o produto é novinho, zerado! amei!."
348,5,Produto muito bom funcionando perfeitamente estou satisfeito.
349,4,Meu neto adorou!está usando sem parar!.
350,5,Produto excelente atendeu todas minhas expectativas. Recomendo.
351,5,"Muito bom, ele tá em bom estado."
352,4,"Tudo ok, recomento a todos de ml."
353,5,Produto muito bom eu recomendo o timo.
354,4,Ótimo fincona muito bem como o esperado.
355,5,Veio tudo certinho e funcionando perfeitamente!.
356,5,"Ótimo produtor. 
. Tudo ok gostei muito."
357,5,Peodu[o perfeito de ótima qualidade.
358,5,"Ótima qualidade, amei demais!! super indico."
359,5,"Fiquei surpresa, produto de excelente qualidade."
360,4,Estou satisfeita com minha compra.
361,5,"Excelente aquisição, ótimo custo benefício."
362,5,Produto de excelente qualidade.
363,5,Excelente qualidade. Produto original.
364,5,"Simplismente maravilhoso,impecável."
365,5,Excelente produto! recomendo!.
366,5,Muito bom!!!.
367,4,"O produto realmente é muito bom, porém notei alguns detalhes que deve ser levado em consideração: ele esquenta muito, recomendaria utiliza-lo em ambiente de clima mais ameno, aqui em belém-pa eu uso ou com o ar condicionado ligado ou ventilador direto. Cansa um pouco a vista, não é bom uso por muitas horas."
368,5,"Os capacitores são maiores e com maior voltagem, mas dá certo 100%, mesmo com voltagem maior, não há problema, só o tamanho mesmo. Com jeitinho dá pra colocar todos. No meu ficou perfeito e a capacitância veio correta. Capacitância que não pode ser diferente. Acho que só tem este kit anunciado no ml."
369,5,Produto show de bola superou minha expectativa top demais.
370,4,"Um bom produto ! pelo menos até agora meu garoto está satisfeito com seu desempenho. Não gostei da iluminação de tela ,mas ele me disse que é assim mesmo ,que faz parte da configuração dos game boys  originais. Então ,posso dizer que estamos satisfeitos."
371,5,Produto muito bom esperado pelo preço pago.
372,5,"O que dizer de um dos consoles portáteis mais icônicos que já existiram? bem, é exatamente isso que me foi vendido. Estou com o meu há um mês e ele funciona como esperado. Tinha medo de receber uma emulation box bem decorada ou um aparelho com defeito. Porém, não foi o que aconteceu. 
. 
Faço o aviso: o meu apresenta alguns sintomas da idade do aparelho, que meu outro gba, que já tenho desde o lançamento do console, também apresenta: um pouco de mal contato para leitura dos cartuchos as vezes, o controle do volume é meio louco. (mesmo sendo um aparelho em ótimo estado de conservação, são coisas que comumente ocorrem com a idade do hardware, são todos problemas contornáveis, nada que impeça de se jogar nele). 
. 
Não posso dizer com absoluta certeza, por não ser um especialista, se o aparelho é 100% original ou montado a partir de peças originais/que simulam perfeitamente o original. Como leigo, não achei diferença alguma para o original que possuo e creio que seja sim, um console original, pelo menos num sentido amplo do termo (como desencavaram um lote deles em pleno 2020, aí eu realmente já não sei). Inclusive, ele foi totalmente capaz de se conectar com um aparelho original via cabo link e trocar pokémons entre dois cartuchos originais. 
. 
Resumindo: super recomendo, foi exatamente o anunciado."
373,5,"Exatamente o que você espera sobre um gameboy advance. 
Tanto suas qualidades quanto seus defeitos estão presentes, proporcionando a experiência original que muitas pessoas tiveram em 2001, com o seu lançamento. 
. 
Se você tiver, algum dinheiro no bolso e queira adquirir uma cópia para você para jogar enquanto está fora de casa, para iniciar uma coleção ou até mesmo para fazer um backlit mod, comprem nessa oferta aqui, porque, para um produto original em perfeitas condições, o preço está bem acessível e agradável."
374,1,"Descobri que os 3 game boys que comprei se tratavam de produtos adulterados. A placa-mãe era original, de outro game boy usado, mas as carcaças sequer eram originais. Vendendor colocou lacre de garantia os consoles para evitar que eles fossem abertos, mas é possível identificar por fora que os produtos não eram originais. Ao abrir gameboy color, constatei que foi usado um display paralelo e o auto-falante original também tinha sido trocado por outro."
375,5,"Produto em ótimo estado. Botões funcionam normalmente, caixa de som e tela também. A carcaça não tem arranhões, mas a tela veio com pequenas sujeiras por baixo dela, que não atrapalham. O console parece que foi fabricado esse ano mesmo."
376,5,"Amigo avaliei só agora pq testei bastante o produto,e por ser um mod que vc mesmo fez só tenho a elogiar, ficou perfeito, parabéns continue com o bom trabalho, pretendo comprar outro, espero que seja com vc tbm!."
377,1,"Não são 369 jogos de gba, nem uma dúzia, a esmagadora maioria é de jogos ruins de nintendinho que rodam por emulação interna. Cartucho muito ruim, não recomendo."
378,3,"O preço esta bom, mas a carcaça do console é meio frágil, por exemplo a tampa do compartimento de pilhas fica estalando, como se não encaixasse direito."
379,4,"Um dos jogos não salva, fora isso os outros estão ok. Produto de ótimo custo beneficio."
380,4,"Funcionou perfeitamente. Alguns jogos estão com a descrição errada, mas nada que estrague a diversão."
381,5,"Excelente produto de ótima qualidade, produto para você voltar ao tempo de criança."
382,5,"Perfeito, meu primeiro console da nintendo e definitivamente não será o último."
383,5,Produto perfeito como novo recoemndo para todos que curti esse nostalgia.
384,1,"Só aparece até o 86 de 150 , experimentei em vários aparelhos."
385,5,Prduto otimo perfeito  exatamente como imaginei. Recomendo a todos do ml.
386,5,"Bom e muito bom!. 
Bom. 
Rapido e bom."
387,4,"Pratico,  mas nem todos os jogos salva."
388,5,Muito bom excelentes jogos nostalgia pura.
389,5,Muito bom. Bem construído o equipamento.
390,5,Muito. Bom atendeu as expectativas.
391,5,"Produto em perfeito estado, excelente!!!."
392,5,"Tudo certo, e rapidinho, recomendo !!!."
393,5,"Otimo produto, obrigada! eu adorei!!."
394,5,"Espetacular, atendeu nossas expectativas."
395,5,Nostalgia total. Ótimo console.
396,5,Muito bom.
397,5,Perfeito!.
398,5,"Otimo produto  , sem problemas funcionando perfeitamente , na compra tbm nao tive problemas foi tudo perfeito, recomendo este produto a todos que estao procurando um console para games."
399,5,Produto muito bom. Claro usado mas impecável.
400,5,"Até o momento não tenho o que reclamar, produto de qualidade e, aparentemente, cumpre o prometido!!! recomendo!."
401,1,"Me senti totalmente enganado, recebendo um produto usado, sem manual de instruções e que terminou não funcionando para as crianças que o receberam de presente. 
Minha pior avaliação possível para esses comerciantes. 
Espero nunca mais ter que recorrer a pessoas como estas!."
402,5,Muito bom  tudo certinho  funciona bem.
403,2,Jogo excelente funcionando perfeitamente mas n é novo cx amarelada e rasgada o cd kinet adventure n funcionou e n veio o fone de ouvido q está descrito na descrição do jogo como itens inclusos.
404,4,"Médio. Aceitável por ser usado, mas logo no primeiro mês de uso recorri a assistência técnica duas vezes para troca de peças que quebraram pelo desgaste e eu mesma usei pouquíssimo o produto. Quase devolvi."
405,2,"O console quando abro e coloco  o cd ele abre sozinho, só fecha quando travo com a mão. Imaginei que o produto foi testado antes de encaminhar ao comprador. Desapontado."
406,4,"Pruduto bom demais, estava meio preocupado de comprar console usado mais esse é 100% confiável. Veio tudo certinho quase nem notei marcas de uso no meu. Valeu cada centavo gasto agradeço!!!."
407,5,"Estou muito satisfeita!! ver a alegria dos meus filhos com a chegada de um produto perfeito!!  funciona muito bem, além de ser muito lindo, recomendo!!."
408,4,"Comprei sabendo que era semi novo, produto bacana, funcionou tudo certinho. As crianças adoraram. Tomara que dure bastante tempo. Só faltou a caixa original pra ganhar 5 estrelas."
409,4,Produto em boas condições de uso e com o funcionamento em perfeito estado.
410,5,"O video game é maravilhoso, tudo funcionando perfeitamente, e o melhor que ja vem com uma infinidade de. 
Jogos, estamos nos divertindo muito."
411,5,Muito bom meu filho adoro produto novo e de cualidade super indico.
412,2,"Anunciado como produto de leilão , com pequenas marcas ! mais na verdade e remanufaturado , jogaram uma tinta fosco por cima e pronto."
413,5,Muito bom funcionando perfeitamente veio com 2 jogos e aparente ser novo.
414,5,"Console, kinect e controles em perfeito estado, como novos. Também muito fácil inserir novos jogos baixados e desinstalar os antigos."
415,1,Produto bom porem nao me deram a nota fiscal e nao respondem.
416,4,"Bom. Porem tem algumas coisinhas chatas, como se desligar varias vezes no começo até esquentar. E alguns jogos nao pegam."
417,4,Bom porém não é aparelho novo é sim usado e garantia baixa.
418,1,"O jogo é incompatível com o aparelho, não entendi vc pq o jogo não cabe na gaveta."
419,4,Até o momento estou satisfeito com o desempenho do equipamento.
420,5,Parece ótimo  ainda estou aprendendo a usar mais super recomendo perfeito estado novo. Sem nenhuma avaria.
421,5,"Maravilhoso. Veio direitinho, tudo funcionando. 
Meu filho enlouqueceu de felicidade."
422,5,"Game é game, não tem o que reclamar, só perde para o play no quisito estético."
423,5,"Ótimo de boa qualidade o produto, atende bem seu desempenho."
424,5,"Excelente, nem parece ser seminovo, esta perfeito, sem nenhum risco, funcionando perfeitamente. Amei demais, recomendo!."
425,1,"Não comprei este produto, alguém esta usando minha conta."
426,4,"Por enquanto está tudo ok! assim espero que continue, principalmente tratando-se de produto seminovo!."
427,5,"Muito bom,meu filho amou produto de qualidade."
428,5,"Excelente produto,veio com coisas a mais jogos dhora tbm. . Eu super indico. . Nota 1000."
429,5,"Muito bom, produto original indico a tds!."
430,3,O produto ta danificado. Esta se desligando pq esta esquentando muito. Nao veio nota fiscal.
431,5,"Muito bom produto , estamos nos divertindo bastante."
432,4,"Produtos ótimo, estado de novo, porém onde diz 200 jogos não é tanto assim."
433,4,O produto bem conservado e funciona perfeitamente.
434,5,"Muito bom, por mais que nao seja novo está em otimo estado perecendo novo."
435,5,"Produto bom, de acordo com as discussões."
436,5,Produto atende toda a descrição e o pós venda e excelente. Recomendo sem duvida.
437,4,Material usado mais até agora funciona normalmente.
438,5,Xbox 360 slim é um produto de excelente qualidade muito bom gostei muito.
439,4,"Bom produto,  de acordo com o informado."
440,5,Mais usado do que semi novo mas funcionando melhor que meu outro xbox.
441,4,Gostei produto em bom estado de conservação.
442,5,"O console está completo e muito conservado, parece ter saído agora caixa."
443,5,"Produto novo, dentro do esperado, muito bom!!."
444,1,"Produto enviado não foi o comprado, veio sem manual e parecia usado."
445,4,Gostei do xbox esta muito bom.
446,5,"Excelente produto, funciona muito bem e já vem cheio de jogos."
447,5,Funciona super e atendeu minhas expectativas!.
448,5,Muito bom. Pessoal aqui em casa não conseguem parar de jogar.
449,4,"Bom da pra fazer,algumas coisas."
450,4,"O vídeo game é bom, mas os jogos não são originais."
451,5,"Produto muito bom, dentro das expectativas."
452,4,Produto de acordo com o anunciado e com os jogos.
453,5,"Muito bom, tudo veio funcionando!."
454,4,"Gostei do produto  e até o momento, não causou problermas."
455,5,Muito bom superou as expectativas.
456,5,Ótimo. Minhas meninas amaram !até o momento tudo certo !.
457,5,"Excelente, produto novinho funcionando perfeitamente."
458,5,O produto funciona conforme o esperado e anunciado. Recomendo.
459,5,"Muito bom, produto original, top."
460,5,"Tudo certo com o produto , funcionando perfeitamente, conforme anunciado."
461,5,"Recebeu pedeito com brinte , obrigado."
462,4,"Produto em perfeito estado, todos jogos rodando. Muito bom."
463,5,"Produto na caixa, eu recomendo."
464,2,Funciona mais cai a conecção de vez em quando.
465,4,"Muito bom, ótimo custo benefício."
466,5,"Muito novo, estou apaixonado. 
Tudo perfeito, recomendo dms."
467,5,"Perfeitooooo. Produto em ótima condições ,tudo está funcionando."
468,5,"Excelente produto, funcionamento perfeito, e cheio de jogos."
469,5,"Muito bom, de acordo com as minhas expectativas."
470,5,"Produto usado, porém muito bom, recomendo a todos."
471,5,O produtor é muito  bom atendeu minhas espequitativas.
472,5,"Super bom funcionando perfeitamente, minhas filhas estão realizadas!!!."
473,5,Muito bom. Produto de ótima qualidade.
474,5,"O produto está em excelente estado de conservação, controles respondendo perfeitamente, carcaça parece ser nova, idêntica à original e tela sem nenhum defeito."
475,5,"Gostei muito, perfeito veio tudo certinho da forma como eu queria. 
. 
Muitoooo bommmm ameiii."
476,5,"Um excelente produto, acabamento impecável e original. Recomendo a todos!."
477,5,Um espetáculo! funciona perfeitamente. Uma ótima lembrança da infância.
478,5,"Muito bom, do jeito que eu queria. Nostalgia!."
479,5,Excelente! a tela é realmente muito boa!.
