,score,comment
4030,5,"O produto é saboroso, não enjoa rápido igual os que tem waxy maize, tem uma excelente quantidade de calorias na sua porção e certamente voltarei a comprar."
4031,5,A linha best whey tem os melhores sabores do mercado na minha opinião. O de chocolate também é bastante agradável. Utilizo há um bom tempo e recomendo.
4032,4,"Bem gostoso! só acho que depois de um tempo fica um pouco enjoativo pra tomar, mas da pra fazer outras receitas com ele. Então me atendeu bem."
4033,5,Excelente. Já tinha usado e o produto veio intacto e com a mesma qualidade do adquirido em loja física. É o whey mais saboroso que conheço.
4034,1,"Sem nenhum efeirto, fica empelodado, da gazes demais mano! arrotando e peidando o dia todo! tem vez que da diarréia! tomei 4 vezes e joguei fora."
4035,5,"Ameeeeeeiiiii. 
Eu já usava whey e ele é bom d+++. 
E fiquei mmmmtttoooo feliz pq veio a coqueteleira da cor que eu queria (rosa), liiindaaa. 
Obgda :*."
4036,3,Esse suplemento não ? ruim porém vale mais a pena comprar o premium dessa mesma marca pq contém uma quantidade maior de proteira e o gosto ? melhor.
4037,5,"Ótimo produto, dissolve bem, faz poucos dias que estou usando, ainda não deu resultados significantes, mas o produto atende ao descrito. Recomendo a todos do ml."
4038,5,"O produto é bom pra quem tem q fugir do leite, o gosto nao é dos melhores de fato. Recomendo pra quem faz o treino."
4039,3,"Realmente faz diferença nos treinos porém é horrível para tomar, é até saboroso porém é extremamente picante (contém pimenta), por esse motivo não comprarei novamente."
4040,3,"Só levou um pouco mais de tempo para chegar. Mas, fique feliz com os produtos. Penso em mais para frente comprar mais algumas coisas. Obrigado!."
4041,2,O pior whey que tomei na minha vida o gosto não  é  bom e não  dilui direito sobre o restante do combo é  bom.
4042,2,"Não gostei do produto que veio nos refil bem diferente  do que vem no pode,sem sabor de baunilha coloração branca nos 2 refiils."
4043,3,"O preço é bom mas o whey não é de qualidade, nem perto de um 100 da max titanium, integral medica ou probiotica."
4044,5,"Whey muito saboroso, escolhi de pé de moleque e milkshake de chocolate, super recomendo, ótimo pra receitas e para beber com água mesmo."
4045,5,"O produto é de excelente qualidade, indico a todos que queiram comprar. 
Dissolve muito bem na água, alem de ser de boa qualidade."
4046,5,"Já conhecia o produto. É muito bom e reduz a sensação de estufamento que eu sentia com um whey normal, com lactose."
4047,4,Produto de fácil diluição. Espero que a porcentagem de proteina seja verdadeira. Na próxima compra se cumprirefere oque promete darei 5 estrelas.
4048,5,"Estou gostando do produto, o sabor é bom e o cheiro muito gostoso, uma opção pra quem é intolerante a lactose."
4049,3,"Bacana o produto, gostei, espero que o mercado livre pare de obrigar a gente a ter que ficar opinando sobre produtos."
4050,5,"Parece ser bom. O produto vem lacrado, o que dá segurança ao comprar. Acho que repõe os sais minerais. Estou testando."
4051,5,"Sabor muito bom, o melhor que eu ja provei, otimo custo beneficio visto que não é tao caro como os outros."
4052,4,"Os produtos em si são bons, o q não gostei foi que o whey dissolve muito mal, de resto tudo ok."
4053,3,"Produto bom, porem o gosto é bem enjoativo e o do chocolate da muita espinha! sem tirar que não veio medidor."
4054,1,Achei o produto muito ruim para te com água parece uma gosma e o gosto horrível não compro nunca mais.
4055,2,"Produto de qualidade ruim, nao disolve horrivel, ja iso esse whey a lguns meses mais esse tava ruim de verdade."
4056,5,"O sabor deste whey é muito  bom, lembra a massa de bolo, qdo a gente  acaba dr bater  o bolo."
4057,5,"Muito bom. Assim que toma,ja fica um gosto de sal na boca por um bom tempo,é gostoso rsrs."
4058,5,Já usei várias vezes. E uma ótimo opção pra quem não quer ou não pode pré treino com muito estimulante.
4059,5,Adorei o sabor. Vms ver agora como age no corpo. Mas super indico pois só comprei pq li os comentários.
4060,3,"Pelo preço vale a pena, o gosto não é muito bom, mas é de se esperar, mas vale a pena!."
4061,5,"Ótimo produto cumpre o esperado, aumentei meu ritmo nos treinos, e por consequência emagreci 8 kg, sem perder massa muscular."
4062,5,Ótimoa qualidade. Sabor doce de leite muito gostoso. Ainda não experimentei dissolver com leite desnatado mas deve ficar melhor ainda.
4063,4,"O produto é bom mais n às vezes da umas empelotadas. 
O meu da muita espuma n sei com os outros."
4064,4,"Gostoso como o restante da linha. 
Deveriam comercializar somente o refil e diminuir os impactos ambientais utilizando menos plástico."
4065,5,"Ótimo sabor,produto original, obs o produto veio com a variação, mas acho que foi ao decorrer do transporte."
4066,1,"Pedi sabores variados, não veio. Caixa de papel quando abri, saiu uma barata. Produto em si, ainda não experimentei."
4067,5,Este produto é realmente muito gostoso e fácil de preparar. Já comprei duas vezes e vou continuar comprando. Recomendo!.
4068,2,"É até gostoso porém parece que vc está tomando garapa de açúcar,só sinto mais o gosto do açúcar."
4069,3,"Produto bom, conforme o esperado. Demora mais para dissolver que outra marca mais cara. Mas eu optei pelo preço."
4070,2,Medio. Ele engrossa diferente dos whey q ja tomei na minha vida. E olha que ja tomei varios.
4071,5,"De ótima qualidade, só não me atentei a validade, pela quantidade deveria ser mais longa, termina em abril!."
4072,3,Achei o produto muito fino diferente dos que já usei e não deu os resultados ue eu esperava.
4073,4,O produto é bom por não ser muito doce. Vale a pena pra quem está firme na dieta!!.
4074,5,"Comprei o de baunilha, achei que seria enjoativo mas não. Gostei muito e o preço está ótimo."
4075,5,"O produto é otimo. Bom sabor, boa textura e dissolve bem (não ficando empelotado). Custo/benefício excelente."
4076,3,Eu gostei da hipermacia é bom os dois meses três meses começa a fazer o efeito gostei.
4077,5,Alimento melhora sensivelmente o desempenho nas atividades contribuindo para um resultado mais satisfatório no ganho de massa.
4078,5,O de doce de leite é o melhor whay até agora até meu filho quer beber. Rs.
4079,5,"Barrinha excelente, muito saborosa, ajuda na vontade de comer doce, dica, coco e brigadeiro são as melhores."
4080,5,"Produto muito bom, sabor um tanto forte, apesar de preferir um sabor menos adocicado, eu gostei bastante."
4081,5,"Excelente mesmo,parece que vem com açucar de tão gostoso. Recomendo super. Da conta do treino tranquilamente."
4082,5,"Adorei, muito bom vale a pena comprar. Delícia. Pra quem gosta de maracuja. Esse é ideal. Recomendo."
4083,5,"Muito, muito, muito bom. Confeccionados com precisão altíssima. Fiquei muitíssimo satisfeito com a qualidade ofertada. Poucos produtos chegam perto da qualidade destes. Parabéns. Acho que devia ser obrigação de todos os demais prestarem como este. Sem palavras. Altíssimo nível. Recomendo."
4084,4,Muito boa porém pra jogar airsoft você tem que fazer uma redução de fps pq ela deu 516 a 520 fps com 2. 4 de joule mais forte que uma sniper upada ai vc tem que tira a mola cortar 2 gomos grudados no youtube mostra é facil de fazer até pelas regras dos campos que nao vai aceitar esse fps alto tanto como se vc usar ela no campo com 025  ou 028 de longe ela vai variar bastante(isso pq eu joguei em cqb grande feichado com cobertura) dai msm assim vc nao vai acertar o alvo porque ela nao tem hopup dai ela vai variar bastante e vc nao vai acertar o inimigo quando vc encaixar o magazine tem que da mais uma verificada pra ver se encaixou completamente so da uma batida no mag e ja era ela é muito forde varou uns mdf de perto kkk  mais pra jogar airsoft nao vira ou vc vai usar ela pra pegar highlander porem tem que comprar bbs de 048 pra ela ir reta mais fazendo a reduçãp de fps fica ok pra jogar airsoft agora se for so tiro ao alvo nem precisa cortar a mola so comprar bbs de gramatura alta.
4085,1,"De péssima qualidade. Se for preciso de desparafusar, feito em material muito ruim, os parafusos espanam, não dá mais aperto, muito detalhes  minúsculos, como por exemplo a trava do magazine se quebrar o suporte da molinha você perde a arma. Outro detalhe é a trava do gatilho, suporte do botão f press s  plástico muito fraco que segura a molinha, pra mim isso não tem nada haver com polímero é um plástico mesmo e de má qualidade."
4086,5,"É um ótimo produto, levando em consideração o custo-benefício. Bastante potente nos primeiros 90 tiros por cilindro, a precisão com bbs de 0,25g é bem aceitável. O material ao mesmo tempo que parece resistente, as vezes pode ser um pouco duvidoso, já que não é metal é bom ter mais cuidado. O acabamento não é dos mais realistas, mas ainda assim é bonita. Então por esses motivos trás um bom custo-benefício."
4087,4,"A pistola não possui muita precisão, a repetição é lenta e é muito forte. É necessário colocar bolinhas 0,25g. É bom pra atirar em distâncias bem curtas e pra quem está começando. Os pontos positivos são: a arma é fácil de operar. Pra colocar o cilindro não necessita de chave; o pente tem uma trava que facilita colocar as bb's, é leve e é barata pra uma airsoft a gás."
4088,1,"O produto tem bom acabamento, boa empunhadura porém nas especificações  conta 492 fps com bb' 0. 20 nos testes que fiz (30 tiros cronados) acusaram entre 750 a 800 fps, o que pode ser um perigo até mesmo para o usuário, creio que seja defeito de fábrica contudo irei solicitar a devolução, quem sabe uma possível troca desde que a mesma esteja dentro dos padrões especificados."
4089,5,"Produto muito bom, pressão muito boa, aparência dela a primeira vista e muito bonita, mas ao ver melhor faltam alguns detalhes, o barulho dela e bem alto e marcante para uma pistola airsoft. Ponto negativo fica pela precisão bem limitada, sendo desfavorável para treino de mira para tiro de precisão. Para cadência de tiro e muito boa, as vezes engasga, mas não tira diversão."
4090,4,"Que eu achei do produto? então é bao, mas a qualidade da fábricao não é das melhores, fala que é polímero, mas é plástico mesmo, não parece ser muito resistente, mas gostei do tamanho, do formato. O tiro é bem forte, a curta distância, não muito prescisa depois de 5 metros, pelo preço cumpre o que promete!."
4091,5,"Muito bom!. 
A pressão é tão forte que as bbs cravaram no tronco da arvore numa distancia de 10 metros. 
Muito precisa, e sempre use óculos de proteção, pois com a força do disparo fizeram algumas voltarem ao acertar o alvo com uma certa força. 
Excelente pra treinar em alvos, muito potente e de fácil manuseio."
4092,5,"Pistola ótima pelo preço, tive que fazer redução de fps nela para poder usar em treinos e jogos porque original ela é quase uma sniper em miniatura. Satisfeito, embora ela engasgue as vezes, basta uma leve batida no carregador (magazine) que ela volta. Ah, muito mais resistente que pistolas mais caras que tem por aí."
4093,5,"Muito bom produto, só não se consegue uma boa precisão no disparo, mesmo com ela presa na mesa (sem movimento) os disparos atingem lugares diferentes, então fica ruim para a prática de tiro,porém, ótima pra quem está começando, muito boa pressão, muito forte,efetua muito mais disparos por cilindro de co2 que à maioria."
4094,1,"A pistola já deu defeito,funcionou bem nos primeiros 200 disparos,agora ela dispara e as vezes trava,não sai tiro nenhum,tem que soltar o magazine , recolocar aí sai o tiro e depois de algum tempo para de novo,tenho outra pistola aqui de 4,5mm nunca deu defeito."
4095,3,"Produto tem uma qualidade até legal a única coisa que não gostei é a variação que tem no tiro a esfera 0,88 grms até melhora um pouco a precisão mas ainda varia bastante o alvo, pra quem gosta de atirar com precisão não recomendo este produto."
4096,5,"Pistola ótima , funciona perfeitamente além de possuir uma potência que espanta qualquer um , consegui atravessar uma lata de tinner com bb de 0. 20, no começo estava dando disparos em seco , foi quando percebi que não estava encaixando totalmente o magazine."
4097,5,"Apesar de ainda não te-la usado muito, por falta de tempo, já posso afirmar que é um equipemento super potente e de fácil manuseio. ! gostei muito do produto e ser for indagado por alguém, recomendaria sem problemas. !."
4098,4,"Ótima pistola o único defeito q eu detectei foi que o reten do magazine por ser de plástico, pode quebrar com uma certa facilidade, então é recomendado colocar o pente com um certo cuidado. O resto é excelente!."
4099,5,"Apesar dessa ter sido projetada pra usar esferas de plástico  , tó usando esfera de aço 6 mm  ta atirando liso )                                   esferas de 4,5 nao dao certo com a minha só 6 msm  vai ver dei sort."
4100,5,"Excelente custo benefício. Serve para treinamento pois uma vez iniciado, o cilindro de co2 deverá ser utilizado até o fim. Cerca de 100 disparos. Um disparo a 10m de distância quebra um tijolo de 6 furos."
4101,5,"Uma ótima compra, uso para ""brincar"" de tiro ao alvo em casa, tem uma força de penetração enorme, pena os projeteis serem leves, o vento age facil neles, porem a pistola é muito boa!."
4102,5,"Ótimo produto, excelente custo x benefício, muito forte e precisa para uma pistola de cano de alma lisa. Uma excelente autonomia, fazendo mais de 100 disparos com apenas uma ampola de co2. Super recomendada."
4103,4,O produto e muito legel !m llas fiquei desapontado por que na descrição fala e ela pega munição de esfera de aço mas fui em 6 lojas e falaria que ele só pega bbs !!!!!!!.
4104,4,"Pistola com muito potente, mas com um magazine de esperas um tanto fraco, pois derrubei na hora de recarregar, e estragou. Sei que fui o culpado, mas o produto deveria ser mais resistente."
4105,5,"Ótima qualidade. Por ser de polimero exige atenção no manuseio para evitar situaçoes que possam danificar o produto. Mas a potencia é boa. Por ser de polimero é um pouco leve. 
Recomendo."
4106,4,"Pistolinha muito boa pra começar. Mira bem precisa, pressão boa. O barulho, por ser de co2, é alto. Uma pena que o kit nao veio com bolinhas para teste."
4107,5,"Otimo produto, é possivel quebrar vidros, atravessar latinhas de cerveja com bbs 0. 25gr, potencia de uma sniper airsoft em uma pistola, media de 460fps com bbs 0. 20."
4108,1,"A estética bonita, porém muito fraca , não tem impacto como esperado , pensei que fosse o mesmo impacto que a carabina 5. 5 nitro , acabamentos da empilhadeira é frágil."
4109,5,"Excelente precisão, muito forte quando co2 ainda está com toda carga. 
Recomendo o uso de óculos, pois as esferas se batem em material duro, voltam com força."
4110,3,"Atende as especificações porém tem um acabamento frágil e as bb's as vezes travam e não saem como numa gbb de qualidade, fora isso é boa."
4111,5,"Produto de excelente qualidade. Kit muito bom, só faltou o lubrificante para o refil. Pistola muito, muito bonita. Se os elementos fossem de metal seria perfeita."
4112,4,"A pistola é ótima no disparo, na precisão e material resistente. O que faltou foi o manual de instrução, por esse motivo avaliei com 4 estrelas."
4113,4,"Dei 4 estrelas pq ainda não experimentei, assim que o fizer volto aqui pra falar. A arma é linda, boa empunhadura de fácil manuseio. Perfeita."
4114,5,"Muito boa compra. So faltou o coldre, e já pedi e estou no aguardo. Indiquei para minha filha que fará compra de uma igual."
4115,5,"Por ser minha primeira pistola de airsoft eu gostei, não tem pornto negativo, a mira é boa e muito forte! recomendo pelo custo beneficio!."
4116,5,Pessoal essa c11 é excelente muito forte mesmo e tem uma zuada incrível o tiro dela pode comprar vc não vai se arrepender excelente.
4117,5,"Pistola muito bonita , tem um peso bacana e uma boa potência! achei as esperas muito leve ! dispara muito rápido , semi automático funciona perfeito."
4118,5,"Produto ótimo para iniciar no airsoft. Porém precisa tomar alguns cuidados, tendo em vista que a arma tem uma potência muito alta."
4119,1,O funcionalmente bom mas as esferas se atingir em um local duro ela volta sendo assim perigosa podendo causar assistente.
4120,5,"Galera, o produto é excelente! recomendadíssimo! pode comprar. A c11 é muitoooo potente. Boa precisão. Realmente uma compra acertada."
4121,5,"Muito bom, testei a atendeu todas as minhas expectativas. Recomendo pra quem quer começar a brincar, ótimo custo benefício."
4122,5,Maravilhosa. Arma 100%. Forte e ótimo de impacto. Derruba mesmo atirando na cabeça do individui o dano é grande.
4123,5,"Muito bom. Acabamento perfeito, fácil de utilizar e com precisão suficiente para uma arma secundária de curta distância. Recomendo."
4124,5,"Boa pistola, mas as esferas de pvc às vezes trancam, o que não acontece com as esferas de metal."
4125,4,Bom poderia de 2:raias  para que o tiro tivesse mais precisão  com mais de 10 metrôs.
4126,5,"Ótimo produto, proporciona uma boa prática de tiro e uma boa diversão com responsabilidade é claro."
4127,1,"Produto estragou em menos de 5 tiros! super fragil! é mt potente , porem nao compraria denovo."
4128,5,"Potente, econômica e tem boa precisão (até uns 10 metros ). Recomendo um ou dois magazines extras."
4129,5,"Top! excelente produto, recomendo. Só precisava ter magazine avulso pra vender. Tirando isso é extremamente top."
4130,4,Muito bom produto bem acabado. Um pouco frágil e sem precisão. Mas boa de  brincar.
4131,5,"Estou bem contente com ela. Atendeu as minhas expectativas. Eu recomendo comprar, vale a pena."
4132,5,"Muito bom, conforme o esperado, com as esferas de aço a mira é muito precisa."
4133,5,"Pistola muito boa. Muita força, não tive tempo de testar mui mas achei muito boa."
4134,5,"Pistola excelente para atirar forte ,parece ate de verdade muito pesada igual a verdadeira adorei!!!!!."
4135,5,Produto de alta qualidade e funcionamento impecável. Arma precisa e boa força de tiro.
4136,5,"Otima arma, boa precisão e custo benefício para quem está começando o tiro esportivo."
4137,5,"Top! super indico, porem para jogar no cqb é preciso fazer modificações na c11."
4138,5,"Muito bom! preciso, forte, material muito bom, excelente qualidade. Supera o que foi proposto."
4139,5,Produto excelente top de mais satisfeito. Bem preciso melhor q a glock eu achei.
4140,4,"Produto muito bom, bem leve e com uma precisão de ótima qualidade, recomendo!!."
4141,5,"Esse foi otimo , comprei uma antena q nao funciona 109,90 oq fasso."
4142,5,Excelente qualidade recomendo a todos do mercado livre otima pistola forte e robusta.
4143,1,"Bolinha de ma qualidade, travaram no cano por ser maior que 4,5mm."
4144,5,Dá prá impressiona muito pela força que tem! e a quantidade de disparos.
4145,4,"Algumas falhas no momento do disparo apenas ""cuspindo"" a esferas de aço."
4146,5,"Estou muito satisfeito, com minha pistola co2. Compraria de novo sem dúvidas!."
4147,4,Muito boa gostei mesmo parabéns pra rossi ótimo arma show de bola.
4148,5,Produto com excelente custo benefício. Estou muito satisfeito com a aquisição. Recomendo.
4149,5,Produto muito bom mesmo. Estou muito satisfeito com a precisão do produto.
4150,5,"Produto bom, apesar que comprei errado achando que pegava esferas de aço."
4151,5,Otimo custo beneficio. Boa arma para quem esta iniciando no esporte. Recomendo.
4152,5,Melhor pistola de airsoft que eu já comprei. Estão de parabéns.
4153,1,O produto não corresponde com  o que e mostrado no vídeo.
4154,2,"Mira muito desregulada, não gostei. Já a 4. 5mm mira excelente."
4155,5,"Produto muito bom eu recomendo. 
Para quem gosta de tiro alvo."
4156,5,"Acabei de comprar e dei alguns disparos,teve um bom desempenho."
4157,4,Muito boa essa pistola vale apena comprar muito boa. Muito boa.
4158,5,"Muito top. Adorei ,pistola muito boa de manuseio e muito porente."
4159,5,Muito boa. Comprei duas e não tive problema com nenhuma delas.
4160,5,Muito boa só achei que seria mais forte mas muito boa.
4161,5,Nossa a melhor pistola de co2 que eu já vi.
4162,5,Muito bom gostei muito boa pistola vou mim divertir muito.
4163,5,"Produto muito bom. Pesado,bela empunhadura. Uma pressão muito boa."
4164,5,"Produto top. 
Surpreendi com a potência da pistola. 
Muito boa!!!."
4165,5,Excelente eu recomendo para os amantes de airsoft vão gostar.
4166,5,É minha primeira arma de airsoft e eu gostei muitoooo.
4167,5,"Excelente custo beneficio, boa precisão a 10m. Vale a pena."
4168,5,"Muito bom, achei potente a arma e veio tudo certinho."
4169,5,"Excelente o produto, superou minhas expectativas, com certeza absoluta indico."
4170,4,Muito boa gostei muito a rossi estar de parabéns.
4171,5,Produto excelente! muito forte e dura muito o co2.
4172,5,Embora seja de plástico é bem resistente a princípio.
4173,5,Correspondeu todas as minhas expectativas!. Mto bom de verdade !.
4174,5,Muito muito muito bom! top muito forte e bonita.
4175,5,"Pistola surpreendente forte, muito bem acabada e ajustada, recomendo."
4176,5,"Material de qualidade! ótimo custo benefício, vale a pena!."
4177,2,Não gostei muito minha opinião sinceramente fiquei insatisfeito ok.
4178,2,Cara é fraca! pouca potência! não fiquei satisfeito.
4179,2,"Produto diferente,as esferas não são da rossi."
4180,5,"Ainda não testei, mas creio que tudo certo."
4181,5,"Superou minhas expectativas,arma muito boa, ótima pressão."
4182,5,"Muito bom o produto, e de boa qualidade."
4183,5,"Ótimas para pistolas spring por serem mais fracas. 
. 
Como foi a primeira vez que usei 0,12g , só não gostei de usar em pistolas co2 mais rápidas pois o tiro desvia."
4184,5,"Munição para airsoft em plástico resistente, amarelo, que permite visualizar mais facilmente. Acondicionadas em dispenser bem prático, com fácil manuseio."
4185,5,"Bom de mais da conta so, chega da vontade comprar mais, de tão boa que é kkkk."
4186,4,"Engancha um pouco as bolinhas no bico do pote, mas no geral é um bom produto."
4187,5,"Melhor bbs que ja comprei, super calibrada e resistente, excelente custo/beneficio, recomendo !."
4188,5,"Muito bom estar brincando com a família, uma de minhas melhores escolhas."
4189,5,Muita qualidade no produto muito bom irei realizar outra compra futuramente.
4190,5,Atendeu ao que esperava e estou aproveitando para praticar.
4191,5,"Muito bom, nao vareia muito, da p brincar muito."
4192,5,"Muito bom, produto de qualidade totalmente satisfeito 100 % recomendado."
4193,4,Muito boas. Gostei. Estavam todas em bom estado.
4194,5,"Otimas cumpriu com o esperado,chegaram bem rápido."
4195,5,Muito bom e facilita na hora de carregar.
4196,5,"Otimo, amei o produto e de otima qualidade."
4197,5,"Bolinha munição airsoft 0,12 pistola airsoft."
4198,5,"Perfeito, vem muitas munições, adorei o produto."
4199,5,"Muitas bolinhas, o pote é muito bom."
4200,5,"Produto de boa qualidade , não usei ainda."
4201,5,"Muito top! recomendo, quando acabar compro novamente!!!!."
4202,5,"Produto bom, recomendo. Dentro do que esperava."
4203,5,Produto muito bom. Com excelente qualidade.
4204,5,"Atendeu às expectativas, só achei muito leve."
4205,5,"Produto de excelente qualidade, muito bom."
4206,5,Produto de muito boa qualidade! recomendo.
4207,5,Excelente qualidade. Recomendo. Superou as expectativas.
4208,5,"Indico a todos ml ,otimo produto."
4209,5,O produto e de excelente qualidade.
4210,5,"Produto muito bom, este eu recomendo."
4211,5,"Muito bom, gostei bastante da resistencia."
4212,5,"Produto top, dentro das expectativas."
4213,4,Excelente produto gostei muito recomendo!.
4214,4,Ótimo produto recomendo a todos.
4215,5,Produto de ótima qualidade. Aconselho.
4216,5,Ótima qualidade. Gostei muito. Recomendo.
4217,5,"Ótimo produto , recomendo a todos."
4218,5,Muito bom parabens pelo produto.
4219,5,"Muito eficiente, resistência 100 %."
4220,5,Produto muito bom. Recomendo.
4221,1,Jdhdjdjjdjsjsjsnnss sisb dycbw. Xud.
4222,1,Jdhdjdjjdjsjsjsnnss sisb dycbw. Xud.
4223,5,"Excelente qualidade, muito satisfeito."
4224,5,"Produto otimo, otima qualidade."
4225,5,Ótimo. Resistente. Como esperado.
4226,5,"Excelente bolinhas. 
Bem pesadas."
4227,5,Produto de excelente qualidade.
4228,5,Boa qualidade.
4229,1,"Acho q é melhor ir na feira rip , essa q veio é mal costurada ,eles colocou um menino pra costurar kk  , mais se eles colocar a pessoa q sabe costura vai melhorar a qualidade do produto."
4230,5,"Eu queria sem nenhum desenho, queria camisa limpa, mas veio com símbolo da nike e ainda do lado errado. Triste, mas fazer o que."
4231,5,"Na imagem não da para ver o símbolo da nike, mas pra quem vai comprar saiba que tem, mas veste bem."
4232,5,"Produto muito bom, vale a pena pelo custo beneficio, vieram exatamente como pedi, cores e tamanho, recomendo!."
4233,3,O material tem pouca qualidade desbota fácil em três lavagem saiu a cor.
4234,5,Ficou perfeito no meus filhos. Vai pra todo lugar com as camisetas.
4235,4,Produto bom para uso casual ou seja no dia a dia.
4236,5,"Muito bom o produto correspondeu minhas expectativas , recomendo sem duvida."
4237,5,Produto de qualidade recomendo quem comprar vai amar.
4238,5,Gostei bastante do produto custo benefício muito bom.
4239,5,"Atendeu bem as minhas expectativas, recomendo demais."
4240,5,O produto é exelente pelo custo beneficio.
4241,5,"Muito bom, tamanho perfeito. 
Chegs de escrever."
4242,2,Um g. Muito pequeno. Me enganou.
4243,3,"Bonitas, mas  dá  ceser  no sovaco."
4244,5,Produtos de otima qualidade. Recomendo.
4245,5,Ótimo produto e muito confortável.
4246,5,Deveria fazer um acabamento melhor.
4247,5,"Camisas são lindas , acabamento perfeito."
