,score,comment
1329,5,"Nunca peguei muito peso na academia. Comecei a fazer crossfit e a nutricionista me passou (já que também consumo baixa proteína por não comer carne), tenho sentido bastante evolução nos exercícios de perna e barra com anilha, vou começar a estimular mais o peso corporal (em rope climb por exemplo) e ver se realmente há evolução. Quanto ao produto, bebo bastante água, senti inchaço ( principalmente no meu rosto que é redondo), mas nada além do normal. Não conheço outras creatinas, então com certeza voltaria a comprar a da integral."
1330,5,"Bizarramente em 1 semana de uso eu ja vejo resultados. Aumentei peso, aguento mais nas séries. Tava tomando um mais barato de outra marca e nao sentia nada (inclusive fui saber depois que nao era 100% creatina - aquela velha historia do barato sai caro) mas enfim essa creatina é boa mesmo!."
1331,5,"Produto de qualidade, recomendo!."
1332,4,Produto bom nota-se que há uma absorção de água nos músculos. No meu casa utilizo de pré e pós treino. Apesar de sr de sabor neutro o preço que se paga nos dias de hoje por 150 gr da um toque salgado kkkkkk.
1333,5,"Sentir diferença no meu treino, mais energia e disposição, visto que tenho uma rotina de trabalho cansativa e estressante e precisava de mais energia para os treinos de musculação e natação, valeu a pena comprar esse produto e já estou programa a próxima compra. Comprei para testar se era bom e de procedência e valeu a pena, aumentei meu ritmo na academia, mas não vivo viciado a ele é só um complemento."
1334,4,"Não dá pra dizer que é um pó, mas sim, grãos. Ela não dissolve e acumula no fundo. Para conseguir tomar toda a dose, precisa adicionar mais líquido. Nunca tomei uma dose de areia, mas se não for essa a sensação, deve ser bem parecida."
1335,5,"Excelente, no primeiro treino após eu começar a usar ja tive um resultado muito boomm. 
Ao contrário do que disseram o produto é original e no meu treino de muay thai e de força eu senti a diferença com a creatina."
1336,5,"Excelente produto, estou utilizando e em pouco tempo já vejo uma grande diferença no aumento de força e resistência nos treinos recomendo muito ótima qualidade um exemplo nos treino de rosca direta eu consegui mudar os pesos de 5 kg cada para 10 kg cada em três dias e não tive dificuldade em realizar os movimentos de execução do exercício em questão por isto recomendo este produto. Muito bom mesmo."
1337,5,Bem bom. Ele da um gas no treino. Da um forca a mais. E ta com valor muito bom e o pote e bem grandaoo dura uns 3 meses. To tomando 2 x por dia  to virando um monstro.
1338,1,Creatina veio com cheiro estranho parece ser falsificada. Tomei por uma semana nao tive rendimento nos treinos. Comprei um outro pote  em uma farmacia percebei diferenca no primeiro dia que tomei. Nunca mais vera meu dinheiro.
1339,5,"Quem utiliza creatina sabe que não adiante mexer porque ela fica toda no fundo em questão de segundos, mas esta não, ela é tão fina que se mistura completamente na água, tem ótima solubilidade que eu nunca vi em uma creatina, e mantendo seus benefícios como ganho de força e resistência principalmente na musculação que é o que eu faço."
1340,1,"Produto veio adulterado, a parte de fora está lacrada porém o lacre de dentro já estava aberto e não tem nada do produto e tem um cheiro forte não tem nada haver com creatina."
1341,5,"Excelente custo benefício:. 
- não tem um gosto forte, se misturado com outra coisa;. 
- sinto claramente mais energia enquanto estou fazendo os exercícios;. 
- vem um dosador dentro de 3g, bem conveniente pra medir."
1342,5,"Com 5 gramas por dia, creio que me deu uma melhora de uns 20 % na força e uns 25 % a mais na resistência de exercícios de musculação, mesmo na esteira ajuda também, porém ajuda menos, com 3g pra mim não deu quase diferença porque peso 87 kg, seus efeitos são  percebidos depois de umas 3 semanas de uso contínuo."
1343,5,"Muito boa, primeira vez usando e pude perceber grandes resultados, além de ajudar na formação dos músculos,  auxilia na redução da fadiga, onde contribui consideravelmente para um treino de alta intensidade. Comprarei novamente."
1344,5,"Apesar de dizerem que é tudo a ''mesma coisa'', meus resultados são melhores e mais visíveis quando uso a creatina da linha hardcore, das marcas nacionais pra mim ela é a melhor."
1345,1,"Infelizmente  o pote veio com um furo, tinha pouca coisa no pote,pote adulterado da para ver o furo no fundo. Fui no shopping  pedi um da mesma marca  e pote estava quase cheio. Agora vou ter o transtorno de devolver, não vou consumir pois não sei se o que tem no pote é creatina. Uma vergonha."
1346,3,"Acredito que não seja creatina pura, a última creatina que consumi da integral tinha a textura diferente e todas tinham o scoop com a logo da integral, este era um scoop diferente."
1347,4,"Estou usando o produto à apenas uma semana dissolvido em bebidas quentes, observei que não dissolve totalmente ficando no fundo pequenos grãos tipo areia. Não tem sabor nem odor!."
1348,5,"Produto excelente!!!. Usava de uma outra marca mas está de longe está sendo a melhor,te dá um gás a mais nos treinos,estou obtendo ótimos resultados,meus músculos estão mais aparente,tenho mais energia,não fico mais com fadiga durante os treinos,é a melhor aquisição pra quem treina hardocore e quer resultados,recomendo demais!!!."
1349,5,"Eu não sou especialistas e não sei dizer muito bem se o produto é bom ou não. 
Mas no meu caso, percebi uma diferença notável na disposição enquanto prático qualquer atividade física."
1350,5,O produto é de boa qualidade sim pois ja tomei outras vezes. Agora to tomando novamente e so aguardar o resultado. Mais é de boa qualidade. Sim recomendo.
1351,4,"Pelo custo beneficio está ótimo, porém na questão da qualidade não é nem metade do que uma creatina micronizada, fica sempre um restinho no fundo do copo, não importa o quanto bata sempre precipita, a última golada é sempre a pior. No mais se estiver apertado de grana vale a pena sim!."
1352,5,"Não tenho do que reclamar, pelo menos a que veio pra mim foi de ótima qualidade, o pessoal que diz que não vê resultado, deve estar achando que creatina é bomba."
1353,1,"Achei ele com gosto modificado, diferente do anterior que eu tomava da mesma marca!!  e com a textura muito fina tipo farinha. Não confiei. Descartei o produto."
1354,1,"Uma porcaria. Veio contaminada. Com fiapos pretos, em uma delas ate bicho pulando. Tenho so videos para quek interessar. Estou com telcamacao no reclame aqui e tratando diretamente com a integral medica, porque é problema de producao e pessima qualidade de producao pelo menos do lote l051560b."
1355,5,Ta de parabéns eu já treino a 6 meses e nunca senti tanta força em dois dias tomando essa creatina já tô com muita força a intermédica tá de parabéns.
1356,2,Nossa que cheiro forte que ela tem! sempre comprei em outros lugares e nao tinha esse cheiro forte igual a de vcs. Nao tem como tomar nao.
1357,5,"Integral médica é qualidade garantida! sou cliente há muito tempo, gosto e recomendo os produtos! a creatina é um suplemento bastante estudado e de eficácia comprovada! a ingestão do suplemento aliada a uma dieta adequada + treino otimizam a produção de atp o que faz melhorar a performance!."
1358,1,"O lacre da tampa estava fechado,porem o lacre de dentro,aquele de papel colado estava aberto,muito estranho ficou com cara de produto adulterado."
1359,1,"Não gostei não vem o produto de acordo,não supriu minhas expectativas, virtualmente não compro mas esse produto, via online. 
Só propaganda!!!!. 
Não aconselho ninguém a comprar."
1360,5,"Ótimo produto. Primeira vez que estou fazendo o uso de creatina. O produto não contém gosto e é bem estranho quando se ingere. Produto é original pode comprar sem medo, consultei pelo sac da integralmedica e me confirmaram pelo número do lote. Ótimo produto, comprarei novamente."
1361,5,"Estou satisfeito, pois valeu a pena pagar um pouco mais e ter um suplemento de qualidade. Tem cretinas por aí que são só maizena."
1362,3,"Não gostei mto do produto pois o gosto é horrivel, não sei se tem de sabor mas se tivesse acho q seria um gosto melhor."
1363,5,"Gostei da creatina da integral, apesar de não possuir o selo creapure, possui a mesma textura e consistência da creatina da growth com selo, tenho as 2 em casa e comparei até o odor, ambas praticamente iguais. Recomendadíssima, será a marca que comprarei pelo custo-benefício!."
1364,5,"Excelente suplemento! já faço uso a algum tempo, produto muito bom para dar um up nos treinos, como aumentar a força e disposição. Recomendo!."
1365,5,"Muito bom. Surpreendeu o resultado, em menos de 10 dias vc sente uma grande diferença em força e resistencia. Recomendo."
1366,5,"Produto muito bom, em duas semanas tomando 10g diaria ja sinto a diferença no treino, e também no volume muscular, vou usalo por três meses e volto opinar como foi o resultado final, sendo que so estou supplementando com a creatina, sem nenhum outro suplemento mais."
1367,5,"Excelente produto. Umas das melhores creatinas no mercado. Não é tão fina quanto as outras, porém é 100 por cento pura. Legítima. Recomendo."
1368,5,"Recomendo mesmo. Top demais. Dá energia, força e vc vê resultados em 2 semanas, fazendo tudo certinho. Alimentação & treino."
1369,5,"Quem utiliza o produto e o meu filho que ao receber comparou imediatamente com a dos amigos que ainda não confiam nos produtos do mercado e automaticamente viram que a composição, sabor e aroma são os mesmos comprovando a autenticidade e eficiência do produto super recomendo."
1370,4,"O produto cumpre o que promete, a marca em si é boa, não esperava menos. Só o preço que é um pouco salgado."
1371,4,Muito bom. Só não é melhor do que saber que esse é o último ano do bolsonaro no governo.
1372,4,"Rende muito,ótimo custo benefício para quem faz uso constante. 
Ajuda nos treinamentos de força. 
O curioso é que as vezes esqueço de tomar e continuo treinando forte do msm jeito. 
Mas confio na marca,uso a bastante tempo e recomendo a todos do ml."
1373,4,"Atendeu as expectativas, mas dentro do produto eu amacabei encontrando varios pedacos minusculos de algo preto. Aparentemente pareciam uns micro pedacos de plastico."
1374,5,"Estou usando o produto praticamente há 2 semanas e estou tendo resultados, tanto na força, como no corpo."
1375,5,"Creatina é o melhor suplemento, e sempre será. Com o passar do tempo da pra ver os efeitos. Muito eficiente!. 
Porém digo, depende de 6 a 8 semanas pra sentir o efeito no corpo, mais durante os treinos da pra notar mudanças nos músculos."
1376,2,"Sabor muito doce pra quantidade água recomendada, qualidade de processamento da whey protein muito inferior e pode-se notar pela sua textura. Tenho minhas dúvidas sobre produto."
1377,5,"O sabor é incrível e dilui super fácil. É um dos melhores wheys que já consumi e olha que já experimentei diversas marcas, inclusive importadas."
1378,5,"Ótima qualidade. Minha esposa amou. Veste muito bem, o tecido é grosso e possui forro. Vi um comentário q dizia q era fino; não é fino."
1379,5,"O produto é muito bom, comprei um tamanho maior porque melhor grande que dê pra apertar do que pequeno que não teria jeito, até aí ok veio e ficou de fato um pouco grande a parte de cima ""nem da pra perceber direito só quem tá usando"" e a parte de baixo ficou um pouco apertado aí como consequência estica mais e fica um pouco mais fino mais nada que fique transparente também, enfim eu já sabia porque o tamanho das roupas seguem um padrão então só pra dizer que se você for um pouco mais ""avantajada"" nos glúteos pode ser que aconteça isso mais nada que seja impossível de usar."
1380,3,"Comprei 2 tamanhos m e g, pela segunda vez, achei que seria bermuda e não shorts! visto 44 e 46 e mesmo assim o g veio largo na parte do ombro e o m pegou na perna! repassei este m pra minha mãe e fiquei com o g! e como precisava muito, nem devolvi o meu e usei assim mesmo. Mas, preferia bermuda e no tamanho correto! no mais, gostei do tecido e desta costura lateral rosa!."
1381,4,"O maquaquinho vestiu muito bem, mas a costura entrepernas é um pouco rustica, o overlok é assim mesmo, mas isso faz com que raspe e agrida a parte interna da virilha. Se vcs colocassem um forro, mesmo pequeno, só na região do delta já resolveria muuuuito esse problema. O material usado na confecção é muito bom e as costuras são muito seguras. Minha unica observação é realmente com relação ao delta que poderia ter um forro."
1382,3,"O material é bom, porém uso g mas pedi gg por conta do comprimento e mesmo assim ficou no limite, tenho 1,68 de altura. Daí como pedi um número a mais que o meu tive que mandar apertar pra poder usar, e as pernas tbm são super curtas, não é comprida igual da foto! mas com os ajuste que fiz tá dando pra usar, mas não voltaria a compra outro não!!!."
1383,5,"Excelente! material muito bom, bem feito, tamanho tbem ficou ótimo, visto 46, comprei o gg, não ficou muito agarrado, ficou no tamanho certo, e o tamanho das pernas tbem gostei muito nem muito grande e nem curto de mais, super indico. Vou comprar mais 1 para mim e outro menor para minha filha."
1384,5,"Eu amei, de todos os jeitos. Fiquei impressionada com a lycra dele, de otima qualidade! sou ustomizada e ele nao marcou minha bolsinha. O shorts do macaquinho é meia coxa, no tamanho certo. Gostei muito e vou recomendar. Obs: tenho ombro pequeno e quadril grande, embaixo perfeito, em cima pouca coisa larga. :)."
1385,4,"Achei otimo o material, é uma lycra daquelas nao tao macias, mas da muita cobertura, tem qualidade muito boa. 
Sou alta, tenho 1,70 e visyto 40 e comprei o m e ficou um pouco grande, se você tiver medidas parecidas compre o p. 
Achei um otimo custo beneficio."
1386,5,"Adorei, uma otima malha, resistente, forro no busto, ficou com o tamanho da perna perfeito, igualzinho na foto. O único probleminha é que marcou a parte íntima, talvez se tivesse um forrinho isso não aconteceria. Mas nada que uma calcinha sem costura nao resolva. Adorei mesmo!."
1387,5,Eu uso g1 mais ao ler os comentários peguei um pouco maior g2 ficou perfeito não é transparente tecido bem forte adorei o brinde ótimo tbm adorei recomendo comprem não irá se arrepender  mais pegue um número maior pq é melhor sobrar do que apertado.
1388,5,"Confesso que fiquei  em duvida de ver o produto, por aquele  preço em comparação a outros estava muito barato, e pra minha surpresa, é melhor do que os mais caros que vi. Estou super satisfeita e recomendei pra todos que conheço."
1389,5,"Amei o maiô, o tecido é de ótima qualidade, veste super bem no corpo, é muito confortável , e o tamanho ficou ideal. Estou muito satisfeita com a compra. Compraria novamente! super indico este produto pra quem está com medo de comprar!!!."
1390,5,"Amei , ótima qualidade , e ficou na medida perfeita , faço aqui uma observação , sempre peço gg mesmo sabendo que uso g mas sempre atentem para as medidas antes de fazer o seu pedido , pois sempre há uma diferença de fabricação."
1391,4,"A parte de baixo é o tamanho ideal, mas a de cima ficou um tanto grande. Dei uma costurada na parte de trás e nas alças e ts tudo bem. O tecido é grosso e bom!."
1392,5,"Parabéns pelo produto. Minha mãe adorou. Segundo ela, que procura por maiô assim há muito tempo, o produto tem muita qualidade. Não atoa, pretende comprar mais e já está divulgando o produto. Muito obrigado!."
1393,4,"O produto é muito bonito e de ótima qualidade, porém as pernas não são cumpridas como na foto, é bem curtinho, mas de qualquer forma ficou bom, só deveriam tomar cuidado com comprimento mesmo."
1394,3,"Malha de boa qualidade, não fica transparente, porém o acabamento não é bom. A costura  lateral na perna está franzida e o forro por não ser do tamanho ideal deixou o busto enrugado."
1395,5,Top dos tops. Eu tenho maiô de marca aqui. Mas nunca tive um que caiu como uma luva. Parabens !!! podem comprar sem susto. Em cima e nas pernas tudo perfeito. Amei.
1396,4,"Produto parece ter qualidade. Comprei gg mais achei que ficou grande, mandei na costureira para apertar e deu super certo. Tecido confortável, vamos ver se vai durar. Igualzinho a foto."
1397,5,"Tenho 1,70 peso 80 kg estou gravida de 5 meses comprei o g para fazer hidroginastica e ficou otimo , a touca tambem é muito boa valeu a pena."
1398,4,"Bom dia! a peça incomoda um pouco, o cumprimento nas coxas é um pouco menor do que na internet, fica subindo, à medida em que pratica os exercícios."
1399,5,"Mravilhosoooo. 
Amei o maio,ficou perfeito,compraria sem sombra de dúvidas outra vez. Comprem sem medo de errar,é bom e veste muito bem. Obrigada me surpreendeu."
1400,3,"O produto é bom, tecido bom e bem feito, o único problema é que achei as pernas muito curtas. Não ficam como na foto e aí encomodam."
1401,5,"O produto em si é excelente, eu pedi uma numeração que achava que ainda me servia, mas o maiô é lindo e perfeito, veio como esperado. Recomendo!."
1402,5,"Otimo produto. Tecido grosso. Comprei um número maior que o meu. Sou alta e fiquei com medo de ficar curto, porém ficou ótimo. Comprei número xg."
1403,5,Gostei do da roupa mais a touca não e do que pensei que não molhava o cabelo só a touca que não foi o que esperava.
1404,5,"O maiô se ajusta muito bem no corpo. No início pareceu que estava pequeno, mas com paciência, fui ajustando e ficou 10! recomendo a compra."
1405,5,"Coube certinho, ele é muito confortável, não marca e é excelente para hidroginástica. Dá certo também para academia, basta colocar uma blusa maior por cima."
1406,4,"Gostei bastante, so veio com um descosturado na perna que pode acontecer mesmo. Material muito bom e bem costurado. Forma boa, ficou grande em mim."
1407,5,"Apesar de um pouquinho só pequeno, amei e agora depois de 4 idas já esta quase no ponto certo. Amei, em breve comprarei outro."
1408,5,"Comprei um tamanho maior e só ficou um pouquinho largo em cima, no quadril ficou perfeito. O material é ótimo e ele é lindo."
1409,5,"Muito bom tecido grosso, toquei  comedo de focar muito apertado pedir o g mais para mim têm que ser  o m, mais super recomendo."
1410,4,Produto ótimo ficou um pouco grande pq eu pedi. Material aparece ser bem resistente. Não usei ainda. A touca um pouco pequena mas recomendo.
1411,3,O produto dizia vir com uma toca para natação. A touca não veio. Tentei entrar em contato com a loja mas não me responderam.
1412,5,"Tecido com boa qualidade, bem forrado e confortavel, uso g mas comprei gg e serviu legal!. 
Achei a touca um pouco pequena, mas serviu."
1413,2,"Preço bom, a touca molha o cabelo, e o macacão, na parte de baixo fica transparente, pra usar na hidroginástica preciso colocar um biquíni."
1414,5,"O maio é lindo, fica certinho no corpo e muito bem feito. O tecido é bom e fácil de vestir. Pretendo comprar mais."
1415,5,"O material é bom, mas espera-se que a mulher tenha seios grandes. No caso ficou um pouco grande na parte de cima."
1416,5,"A primeira vez que comprei foi pra mim,  agora indiquei e comprei para uma amiga ela disse que ficou ótimo perfeito. Gostamos muito."
1417,5,"Muito bom esse macaquinho de hidroginastica. Ficou perfeito,material muito bom. Recomendo. Para nós  que somos gordinhas,achar um que fique bom."
1418,5,"Muito bom , ficou um pouquinho grande mas nada de mais,  o material é muito bom adorei a touca que veio de brinde."
1419,5,"Muito bonito, veste muito bem. Só não gostei muito da toca, mas como é brinde kkkkkkkk, mas de resto amei tudo."
1420,4,"Gostei do tecido, só achei grande a abertura das costas, mas nada que atrapalhe. Peso 70 kg e peguei tam. G."
1421,5,"Muito bom. Tecido bom, grosso. Gostei muito. 
Ficou um pouco grande na altura do busto,mas mesmo assim gostei muito. Recomendo!!!."
1422,4,"Produto atende as expectativas. 
Pelo preço tem uma qualidade muito boa. 
Bonitos. 
Brindes enviados: varias tocas de suplex um pouco justas."
1423,5,"Produto de ótima qualidade, bem feito, bem costurado, forrado, tecido grosso. Serviu perfeitamente. Já usei várias vezes. Ótimo custo/benefício. Recomendo!!."
1424,5,"Eu amei esse maiô, ele me deixa bem a vontade alem de ser uma otima microfibra ficou sertinho na medida!."
1425,3,"A alça fica larga na lateral, deveria ter uma pinça ao lado do busto, em cada lado para melhor caimento."
1426,2,Ficou un pocou grand más eu qui se trocar mas ninguém me responder a tudos os message que eu mandei.
1427,1,"Achei que a qualidade seria melhor, usei menos de 1 mês e saiu às costuras da lateral do estampado rosa."
1428,5,"Amei a qualidade do tecido e tamanho deu certinho. 
Tem foro na parte do seio!. 
Muito bom mesmo, recomendo."
1429,4,"Eu gostei do tecido, mas a cava do braço ficou um pouco grande, e o tamanho do corpo pequeno."
1430,5,"Bom produto. 
Só achei um pouco grande o tamanho. 
Recomendo atenção no tamanho. 
Mais adorei o material e designer."
1431,4,"Comprei tamanho g peso 80 k altura 1,56 ficou um pouco grande. A qualidade muito boa. Recomendo."
1432,4,Bom. Tecido grosso. Só o elástico da parte do peito q ficou logo largo mas da pra usar.
1433,5,Perfeito lindo bem acabado amei deu certinho em mim o tecido é  grosso  não  tem transparência ótimo recomendo.
1434,5,"O tecido é super confortável e fácil de se colocar. Não deixa o corpo tão marcado, achei perfeito!."
1435,4,Gostei do produto ficou um pouco grande pq nao sabia exatamente como era a forma mas ta bom.
1436,5,Ficou grande para mim mas o material é de ótima qualidade e o modelo é como a descrição.
1437,5,"Eu amei o produto,ótimo e ficou perfeito no meu corpo super recomendo nota 1000, estou muito feliz."
1438,3,"Muito fino nos seios, marca bem os bicos. Precisa de outra camada de tecido na região ou bojo."
1439,5,"Tecido bom, encorpado. Na verdade não estou usando para hidroginástica e sim para academia. Atendeu perfeitamente às expectativas."
1440,4,"Produto muito bom, tecido grosso dentro do esperado, marca um pouco mas no geral gostei e recomendo."
1441,5,"Maravilhoso, podem comprar sem dúvida, o material é ótimo, coisa muito boa mesmo, muito barato pelo material."
1442,2,Gostei mt do produto. Mt bonito. Só embaixo q é transparente. Mas. Vou colocar um biquíni. Amei.
1443,5,"Apesar de ter ficado um pouco grande, ele é exatamente como na descrição! um excelente material. 
Recomendo."
1444,5,O produto muito bom qualidade material excelente. Vou comprar de novo só que um número menor recomendado.
1445,3,"Ele não  é todo forrado então a parte debaixo marca bastante, e não é  de laycra."
1446,5,"Tecido bom, costura ok. Visto 48 e gg ficou grande na parte das costas, mas amei."
1447,5,Òtima qualidade. Sou pequena e as alças são um pouco grandes. Nada que atrapalhe o uso.
1448,4,Pano e bom grosso. No quadril e barriga foi perfeito. No busto ficou um pouco grande.
1449,5,Otimo custo beneficio. Só  o gancho do comprimento poderia ser um pouco maior. Mas ótima qualidade.
1450,3,"Na vdd eu compre pra minha irmã ela gostou muito. 
O produto e maravilhoso eu recomendo."
1451,5,Adorei material bem grosso resistente. Só no busto que ficou um pouquinho grande mas tudo ok.
1452,5,"De acordo com senhora ,para quem comprei o maiô , disse que é de material muito bom."
1453,5,"Adorei,veste muito bem não é muito curto e modela o corpo e muito confortável."
1454,5,"Adorei, quero comprar mais um. 
Ficou perfeito no corpo, ótimo tecido. 
Irei comprar outro logo."
1455,4,"Bom custo beneficio, atende as expectativas pelo preço. O tecido é bom e bem grosso."
1456,4,"Um pouco pequeno, apesar comprei meu tamanho gg nos seios a costura ficou bem embaixo."
1457,4,A qualidade do produto é boa e o preço também!! valeu a pena a compra.
1458,5,"Comprei pra minha sogra, ela amou, material de ótima qualidade, tamanho ela amou tudo. Parabéns."
1459,5,"Se pudesse ter um pouco mais de elasticidade seria melhor, mas gostei muito do produto."
1460,5,"Muito bem costurado,a touca poderia ser um pouquinho maior. Mas é um ótimo produto."
1461,4,Para agregar valor ainda mais seria interessante ter bojo ou similar para segurança nos seios.
1462,4,"Maio ficou bom no corpo, mas conforme fui usando laceou um pouco nas alcas."
1463,5,"Exelente qualidade ótimo, tentei comprar outro mas comprei de outra loja e não gostei."
1464,5,"O maio ficou bom, te em um tecido confortável, só ficou um pouco largo."
1465,5,"A pessoa que ganhou de presente adorou, disse que o material é muito bom."
1466,1,"O p veio enorme, não consegui nem usar, parecia g, as costas muito grande."
1467,5,"O produto é muito bom, exatamente como na imagem, inclusive pretendo comprar mais um."
1468,5,Pano é muito bom porém o maiô e pequeno nas perna ele é curto.
1469,5,"Ficou bem no corpo, pretendo comprar outro. Super confortável para fazer aula de natação."
1470,5,Perfeito caimento no corpo tecido de qualidade não fica transparente na parte de baixo.
1471,5,Perfeito tam g 3 para quem veste ate n 60 pode comprar sem medo.
1472,5,Comprei para a minha vizinha ela está satisfeita com o produto recomendo a todos.
1473,5,Produto ótimo ficou perfeito gostei e recomendo estou satisfeita obrigada  tecido é excelente.
1474,5,Estou amando. Ficou perfeito no meu corpo. E não é transparente. Super recomendo.
1475,5,"Eu ameiii, super indico!!! compre sem medo, tecido ótimo, ajusta legal ao corpo."
1476,5,Gostei muito! a elanca é bem resistente e o produto com ótimo acabamento!.
1477,5,Foi um presente pra uma amiga ela adorou o presente tecido muito bom.
