,score,comment
2859,2,"Pessimo, na composicao tem malto junto com creatina, malto! ou seja, a cada 300g de creatina, receba 150 de carboidratos simples, logo por conta do malto, a dissolucao do produto é pessima, primeira vez que compro da marca e ultima tambem, não recomendo."
2860,3,"O kit é muito bom. Porem comprei especificamente este kit por conta do brinde que seria a mochilinha (saco) mas me mandaram uma coqueteleira. Como sou cliente da loja e sempre compro kits, ja tinha mais de 2 coqueteleiras e o saquinho que eu queria tanto fiquei sem :/ entao caso compre o kit pensando no saquinho, é bem provavel que receba outro brinde. Fiquei chateada."
2861,5,"De confiança, conhecido, renomado e boa aceitação. Gostei muito, tomar e vê os resultados. Breve mais feedback,  obrigado a todos valeu equipe."
2862,1,"Senhores, faço uso de creatina há mtos anos e nunca vi uma com sabor adocicado e q, msm mexendo com a colher, a msm fica embolada. Aspectos inéditos, haja visto, q a creatina não tem qq sabor e q a msm se dissolve e interage de imediato com a água. Pra finalizar, observei q o produto tbm é diferente na textura no interior da boca e, quem faz uso regular, sabe do q falo. Concluo q, a meu ver, o produto tem ""comportamento"" similar à glutamina."
2863,1,"Meus produtos veio violados tanto. A queratina,pela metade  quanto  o wheycom furos e o lacre violados não recomendo pra ninguém quero meu dinheiro de volta ou outros produtos minha 1compra e essa má impressão da loja lamentável."
2864,4,"Não usei ainda por isso não vou falar sobre o produto se e bom ou não. Mais o produto chego na data tudo certinho , aparenta ser excelente , mais o lacre de todos eles em pó, veio com o lacre violado aberto , e infelizmente vazo o pó e ta com menos , não sei o que fazer mais ok , que isso não aconteça com mais ninguém."
2865,1,Produto feito pra enganar o consumidor metade do conteúdo é maltodextrina carboidrato barato. Não comprem que é cilada.
2866,2,"Não é 100% creatina. Dos 300g metade é maltodextrina!. 
Vão argunentar que a ingestao de carbo ajuda no efeito, mas estamos falando de 3g de carbo. Isso nao faz a menor diferença para este fim. A ideia é baratear o custo de produção mesmo e vender como se fosse 300g de creatina para os menos observadores. Por 40 reais (metade do valor do pote) você levaria 1-2kg de malto se quisesse. 
Recomendo buscarem creatinas 100%."
2867,2,Sem dúvidas a creatina black skull é uma das piores do mercado. A única do mercado com sabor adocicado. Não parece creatina de verdade. É a opinião de quem usa este suplemento há 15 anos.
2868,1,"Creatina blackskull metade do pote é carboidrato, pq 6 gramas de porção para 3 gramas de creatina. O correto seria 3 gramas de porção para 3 gramas de creatina. Ou seja vc está pagando o dobro do preço na vdd. Pq só tem metade de creatina no pote. Enganação para os desavisados. Meu conselho: analise esta informação antes de comprar qualquer creatina."
2869,4,"Gosto é razoável, mas como não é pra ser gostoso. 
Veio tudo certo como o exibido!."
2870,5,"Prós: pistola muito boa e potente, recomendo. 
. 
Contras: não é muito precisa, alinha a alça com a massa de mira e o tiro sai levemente pro lado. (deve ser porque o cano é de plástico, sendo impossível o alinhamento perfeito. ). 
. 
Obs: o problema pode ser amenizado apenas colocando uma caneta no cano e fazendo os ajustes, exemplo: se o tiro sai pra ""baixo e pra esquerda, coloque a caneta no cano e empurre levemente pra diagonal ""cima direita"", atire de novo e veja se o problema foi corrigido."
2871,5,"Muito boa, comprei e não me arrependo, já estou derrubando latinhas de refrigerante a horas e não me canso, alias muito forte também!."
2872,3,Bom devido o valor é bom mais poderia ter um pouco mais de pressão.
2873,5,"Ótima!!! suporta esferas de aço e chumbinhos leves finos, recomendo o chumbinho hammer 4. 5mm marca lobo, foi o melhor até agora. 
Carregador com ponta magnética que facilita a inserção das esferas, recomento as rossi, consigo reaproveitar todas que encontro. 
Para utilizar chumbinhos somente nos primeiros disparos, depois ela fica fraca e deve-se usar somente esferas. 
Possui ponta rosqueada 12mm passo 1mm para silenciadores, acho que o mesmo da rossi r8. 
Peso e tranco bem realísticos, precisão não é o forte deste tipo de arma, então curta sem minimalismos."
2874,5,"Tem muita opinião diferente sobre produto diferente aqui. Neste caso o produto é a versão original fabricada pela própria sig sauer e não uma versão licenciada ou réplica, tem 480 fps, dispara somente chumbinhos de 4,5mm, utiliza co2 e é de metal (inclusive o cano). Fura latas, quebra garrafas e tem um blowback igual a arma de fogo com a sensação real do tiro e por isso é ideal para treinamento de tiro esportivo. Tanto que essa mesma pistola de co2 é utilizada pela polícia americana para treinamento, assim como por vários atiradores pelo mundo. A sig investiu muito no desenvolvimento dessa pistola que foi adaptada da p226 (arma de fogo), é tão boa que se tornou uma opção  mais econômica para os proprietários que tem a versão de arma de fogo treinarem, pois atira de forma semelhante. Além disso, é inovadora pelo sistema de inserção do cilindro de co2, pois fica pronta para disparar em apenas um segundo. Isso faz muita diferença e a torna ideal para atiradores esportivos, pois essa versão fabricada pela sig permite que isso seja feito rapidamente sem a necessidade de ferramentas extras como a chave allen por exemplo. Originalmente foi desenvolvida para uso das forças armadas dos eua e hj utilizada pelos seals da marinha. Com a crescente popularidade da  p226, a sig a escolheu para ser adaptada para o mercado de armas de pressão, por isso ela é o que tem de melhor no mercado atual. Mas não confunda o modelo original fabricado pela sig com outros que existem, pois não são iguais."
2875,3,"Um detalhe é que ao colocar o chumbinho com o gás baixo corre o risco de emperrar. No primeiro dia eu coloquei chumbinho e o gás já estava fraco e acabou emperrando o chumbinho no cano deu um trabalho danado mas consegui resolver. 
A minha tem um problema de soltar o pente nos primeiros tiros depois que troco o gas. 
A pistola é bonita e bem pesada. Se assemelha demais com uma real e é bem forte."
2876,5,"Essa uma das pistolas spring mais perfeita que existe, como um produto pode ser tão perfeito? pistola muito pesada, tem uma pegada muito ótima e o peso é muito realista, para quem ta começando como eu vai se surpreender pra caramba com a qualidade (tentem não tirar a pontinha laranja). 
Amei o slide metal, é até geladinho (rsrs) desmonta como uma arma real, para manutenção caso for necessário. Trava funcional muito eficaz, amei demais. Cão articulado, que dá mais realismo, dá pra surpreender qualquer um, bom para mostrar pros amigos e causar inveja. A primeira impressão é sempre ""nossa é muito real!"". 
Se quer começar na airsoft com o melhor custo x benefício, não escolha outra! vá de sig sauer p226, ou sig sauer sp2022 que também está no mesmo patamar de qualidade ;). 
Vai fazer uma semana que estou utilizando essa pistola, e eu nunca me diverti tanto na minha vida, a pressão é muito forte, atravessa latinhas (caramba! qual spring atravessa uma latinha?). 
Tenho até vontade de comprar outra só pra ter duas hahaha. 
Feliz natal a todos, e um próspero ano novo."
2877,1,"Ola boa tarde,entao achei  a pistola muito inferior,frágil  demais e muito leve nao e uma crítica  pra denegrir  o produto  gostaria de saber  se posso devolver e pegar uma mais  cara mais pesada que nao seja se polímero  e como faco pra devolver a caixa rasguei so ficou o isopor agradeço."
2878,4,"Ela é muito boa, poréééém tem algumas coisas que eu não gostei: a cápsula do slide não abre quando puxada pra trás igual a de verdade. O magazine (pente) tem uma folga que faz um barulho muito ruim quando chacoalha. Quando se tira o pente pra verificar quantas bolinhas ainda tem, sempre caem duas bolinhas. A arma não para aberta quando acaba as bolinhas, então temos que ficar contando quantos tiros ainda temos ou ficar verificando o pente (o que não convém, pois cada vez que tiramos o pente cai duas bolinhas) ou podemos esperar pra ver quando damos um tiro seco, mas isso não é recomendado. Mas não vou falar só dos aspectos negativos. A arma tem um visual perfeitamente realista, é pesada, o slide é de metal, o que deixa a arma muito mais atraente e resistente, e ela é bastante forte."
2879,2,"Não gostei até porque eu achava que era as esferas e o co2 e me paresse que  não se usa o co2 eu tentei fazer um teste mais não conseguí nada, posso até não ter sabido como é as funções da mesma, se possível me mande algum prossedimento dando alguma dica, obrigado."
2880,3,"Razoável! o slide em metal é bacana, mas o corpo da arma é de um plástico que se ""retorce"" fácil ao ser apertado. As talas da empunhadura também não são firmes, se movendo ao apertar a mão. O sistema baxs faz com que a bb saia pra cima ao ser disparada, ela não segue uma trajetória reta, fazendo necessário mirar uns 30 centímetros mais abaixo do alvo que a gente quer acertar a uns sete metros de distância. No geral, na minha opinião é uma pistola mais pra decoração do que pra prática de tiro, pois eu tenho outra pistola toda de polímero, que custou bem mais barato e é muito superior a essa p226 em construção, potência e precisão. 
Recomendo como peça decorativa, ou apenas como ítem de coleção."
2881,5,"Pistola muito bonita, pegada excelente!. 
O slide é bem flexível, o que facilita a rapidez nos disparos. 
Peso da arma é bem legal. 
A mira não é tão precisa, sobe um pouco, pra acertar o alvo é necessário baixar um pouco a mira, com o tempo você se acostuma."
2882,5,"Uma das melhores spring, alto nível de realismo. Prós: ferrolho bem robusto, feito em uma única peça de metal. Guia de ferrolho com mola própria, pistão com mola extensa, pino de desmontagem funcional, cão móvel, trava de gatilho funcional (onde seria a trava decock). Contras: todas as peças móveis plásticas, com exceção das molas e cano interno. Marcações pintadas, ao invés de baixo-relevo. Corpo muito leve, mesmo com o carregador, causando um desbalanceamento ao empunhá-la. Pretendo customizá-la, adicionando cano e gia em inox e aplicar durepoxi como peso extra interno na empunhadura. No geral, muito boa para colecionar. Fujam das galaxy."
2883,5,"Me surpreendeu positivamente. Só tenho uma ressalva, a posição do botão de soltar o pente pra recarregar podia ser mais pra cima, pois se não tomar cuidado quando engatilhamos sem querer aperto o botão e o pente sai. Mas como disse fiquei contente com a potencia dela."
2884,5,"Eu gostei muito. Tem uma precisão até considerável, bem forte. 
Esta minha de vez em quando estava falhando. Ai comecei a pesquisar esse tipo de problema no youtube ai consegui arrumar a minha. Era o a molinha do magazine. Eu tenho uma outra que e airsof, foi bem mais barata que essa que comprei e ela nunca falhou. Mais agora depois que eu arrumei o magazine dela, ela superou as minha expectativas. Tô muito satisfeito com a minha. 
Galera no youtube tem muito vídeos bons  ensinando como aumentar a pressão dela, arrumar o magazine pra não falhar mais."
2885,5,"Perfeito, boa pegada, só o que fiquei chateado foi que quando recarrega sempre cai 2 bbs, e o carregador fica como se estivesse solta. Mas fora isso é incrível , ja vi reclamações da msm que a minha o que é muito chato. Mas é incrível a arma."
2886,5,"Ótimo. É preciso falar tbm que quem reclama não sabe o que está comprando. É uma pistola monitoro para brincar no quintal. Se vc vai iniciar no esporte do airsoft ela não atende. Se for jogar com uma dessas só vai ser um alvo móvel para os competidores. Agora p brincar em casa ou como decoração é perfeita. Até me admirei com a força dela, da p usar bb's 0. 20 tranquilo. Tem uma boa precisão p uma arma sem hop up. Eu aconselho p quem quer uma arma de pressão mais fraca p brincar em casa!!."
2887,5,"O produto é fantástico, exatamente como o anunciado, excelente acabamento, ela é toda em metal, sistema interno, externo, gatilho e cão, somente as laterais da coronha é em polímero, o peso é igual a arma real, sistema blow back com recuo muito forte, superou minhas expectativas."
2888,3,"O produto atendi, mais não surpreende, o acabamento geral é bem acabado. Porém o que faz ficar só com 3 estrelas é que, como na maioria dos comentários vai 2 esferas, após retirar o magazine ou trava. Mais é um brinquedo. Se colocassem um magazine semelhante ao da c11, onde carrega só o número de esferas certo, sem aquele monte de esferas chacoalhando. Procurei outro tipo de magazine e não tem. Sugestao para quem importa o produto, mudar o magazine. Aí vai ser bem avaliada, e vai vender o dobro do vende hoje. Otimo dia a todos."
2889,5,"Gostei muito da aparência, da praticidade. Me divirto muito com meus filhos brincando de tiro ao alvo. Tem uma potência excelente. À 10 metros a precisão é perfeira com bolinhas de 0. 12. Com bolinhas de 0. 20 tem precisão com distâncias maiores."
2890,5,"Resumo:. 
+melhor custo benefício. 
+bom peso e detalhes, inclusive trava funcional do gatilho. 
+o slide em metal ajuda a dar resistência à arma. 
-capacidade apenas 12, mas não me incomoda tanto. 
Excelente produto, funciona bem, peso considerável, o slide em metal parece robusto e aguenta bem vários tiros. 
A capacidade poderia ser maior, mas por ser spring, 12 tiros dá para se divertir, não é uma pistola profissional, mas é uma boa réplica, bonita, detalhes bem feitos e trava funcional do gatilho, mas a empunhadura pode ser um pouco áspera para mulheres de mãos mais delicadas."
2891,3,"Um pouco caro o produto. É bem detalhado até, porém a necessidade de puxar o ferrolho toda vez que vai atirar, quebra um pouco a diversão. Além disso, não é forte o suficiente para airsoft. Apenas brincar em alvos."
2892,4,"Produto de extrema qualidade, muito parecida com a real, pegada muito boa, realismo nota 8,5. Só não recebe 10 pois a trava de gatilho é em um lugar diferente da original. 
Aspecto negativo deste modelo na minha opinião esta exclusivamente no magazine e se divide em duas questões:. 
1 - magazine tem folga, quando chacoalha a arma, sente-se uma folga e faz barulho. 
2 - quando se coloca o magazine carregado, se não tomar cuidado, a trava bate no trilho e acaba soltando todas as bbs. 
Fora isso excelente produto."
2893,3,"Uma pistola muito realista, bem acabada e potente. 
Baixa autonomia, como toda gbb, uma carga de co2 dispara apenas uma média de 50 bbs se não forem sequenciais. A média cai para 30 disparos se forem em sequência."
2894,3,"Não pode ser considerada uma airsoft não pelo material que é muito fraco mais mais sim pelo baixo desempenho no que deveria fazer, não podemos reclama pelo valor que é bem inferior as de mais, porém a arma não tem pressão nem uma,não dispara se quer 3 metros em linha reta, éla tbm é bem pequena só serve para crianças mesmo, se for para criança está de bom tamanho, não me arrependi de compra o produto  achei ela bonitinha e vou guarda :) obrigado."
2895,3,"Produto enviado em perfeito estado, qualidade razoável,  ótima pra enfeite ou coleção, porém a funcionalidade da arma não muito boa, as bolinha ficam presa internamente, disparos com 2 ou mais bolinhas ao mesmo tempo as vezes."
2896,5,"Estava receoso de comprar, pois é a primeira airsoft que compro. Pesquisei bastante e gostei muito da sig. Uma das mais bonitas. Pela mínima diferença de preço entre a toda de polímero e a slide metal, optei pela slide metal. O peso é muito bacana, próximo a real, a aparência é impecável. Potência muito boa! brinco a uns 10 metros do alvo e a bb chega com força. Atinge 20m tranquilo. 
Podem comprar sem medo. É primeira airsoft perfeita pra todos!."
2897,2,"O produto é exatamente como o descrito, porém enjoa fácil e é muito leve. Eu investiria um pouco mais e compraria uma elétrica full metal. Fica a dica pra quem está pensando em ter uma."
2898,4,"Arma muito bonita porem com alguns detalhes,em comparação com a pt 92 que eu ja tive  a 226 perde muito no quesito precisão, mas a 226 tem bem mais pressão, a minha 226 veio com um pequeno detalhe no pente que agarrava as bbs e o tiro saía seco, mas nem foi preciso reportar, pois eu mesmo consegui solucionar, resumindo gostei muito da minha compra, mas acima de 5 a 7 metros é  muito difícil acertar um alvo preciso."
2899,4,"E muito boa sua potencia e satisfatoria sua mira e boa ,porem de vez em quando engasga e manda duas esferas ao mesmo tempo porem em comparaçao as outras eu recomendo otimo custo beneficio."
2900,3,"A pistola tem um bom peso,se parece muito com uma original. Porém toda vez que vc carrega ela p executar um tiro outras esferas saim do carregador. Tendo que retirar o carregador e as esferas. Sem contar que toda vez que vc dar um disparo o carregador sai. Sendo assim em termos estética muito bom mais em termos funcional deixa muito a desejar. Ainda mais ao preço de r$450,00. Não recomendo."
2901,5,"Ótimo custo benefício, é bem potente e precisa para uma spring, se vc quer brincar de tiro ao alvo ou quer um modelo mais barato para sua primeira airsoft pode comprar essa sem medo."
2902,3,"Olá minha primeira impressão sobre o produto foi boa, porém passando alguns dias a mesma começou a apresentar alguns defeitos, como o magazine fica folgado quando você encaixa o fora que também os dois parafusos que segura o cabo começaram a se soltar do nada tentei apertar e não da aperto então para ressumir o produto vale o que se paga só achei que iria durar mais estou decepcionado com o produto."
2903,2,Produto fraco/leve !!! atrasou dois dias ! não vale o preço que pedem estou pensando até em devolver !!! o lado bom que ela é bem forte a dísparar mais parece que não vai aguentar muito.
2904,4,"Bom produto, replica fiel,  bom peso, boa empunhadura e precisão mas não serve par ir para o  combate por ser spring, se estiver comprando com esse intuído procure uma pistola a gás ou elétrica, no meu caso comprei para iniciar meu filho no tiro esportivo, então procurei uma pistola que fosse baratinha, tivesse peso e que fosse feita de um material próximo a arma real, nisso ela está de parabéns."
2905,4,"Boa, satisfeito pelo produto, mas eu esperava mais, pelo valor pensei que fosse mais realística, tem muito aspecto plastico, e a distâncias curtas a bbs desvia de mais! mas pra uma spring ok."
2906,5,"Alguns atiradores esportivos não gostam muito da p226 porque e uma arma que pode tambem servir para caça de animais de pequeno porte. Tem uma pressão violenta por ser de ação de mola e munição 4. 5 esfera metálica. Obs:não é airsoft então não se engane ,não é um brinquedo e é uma excelente armas. Quanto se ela serve para proteção pessoal,fica a critério do usuário."
2907,5,"Pistola feita em plástico super resistente, excelente custo benefício para quem está iniciando ou apenas quer praticar um pouco de tiro ao alvo (meu caso). Recomendo se sombra de dúvidas esse brinquedo."
2908,5,"Excelente para tiro ao alvo,é bem precisa mas tem disparo em que a bb muda a trajetória para cima ou para o lado assim que sai do cano,acredito que seja imperfeição em algumas bbs pois entre os 12 disparo apenas 2 ou 3 acontece isso. Nao recomendo o uso das bbs amarelas que vem junto a arma pois elas tem rebabas que podem danificar a arma."
2909,5,"Não entendo muito da área, mas pra mim é uma boa arma, gostei bastante, a bolinha vai uns 15mt mais ou menos com força e sem perder altitude. Gostei bastante!."
2910,5,"A sig sauer p226 spring da cybergun é uma pistola de treino de tiro ao alvo, não para jogo, porém é excelente, bem forte, alcança 30 metros, é resistente, leve, precisa e talvez seja a melhor das pistolas spring, que são pistolas de ação por mola, ou seja, precisa engatilhar a cada tiro, por isso não serve para jogos, mas para tiro ao alvo é perfeita. Recomendo."
2911,5,"Muito bom! superou minhas espectativas. Só as bb's que estavam travando no magazine, mas coloquei um pouco do óleo que vem junto e as bb's não travam mais."
2912,5,"É uma arma muito boa. Empunhadura é excelente, dá pra sentir um pouco a arma, tem uma boa pressão, a precisão dela também é alta até 10 m do alvo. O custo benefício é elevadíssimo, pois ela cumpre o que se propõe. Como ponto negativo ressalta-se que caem duas bbs quando abre o magazine, fora isso ela é ótima, uma das melhores spring e bem baratinha."
2913,5,"Gostei, já dei mais de 500 tiro e até agr não quebrou, ela é forte porém não tem muita precisão, não tem muito a que reclamar dela, podem comprar."
2914,4,"É resistente, tem uma boa pegada, mira é boa tbm, quem diz que a mira é ruim não sabe atirar. 
10 metros de distância da pra acertar tranquilo na boca de uma lata de refrigerante ou garrafa long neck. 
Quanto a potência não posso dizer nada exato porquê ainda não comparei com outras pistolas da mesma categoria, mas é boazinha, não quebra e nem fura vidro."
2915,1,Produto descartável. Você coloca as bolinhas a maioria delas caem quando vai atirar. Pior que não devolveram meu dinheiro. Tive que ficar com essa porcaria quebrada. Não comprem.
2916,4,"Exelente produto !. 
Um ótimo acabamento , uma mira muito precisa e uma ótima empunhadura. 
Porém deixou um pouco a desejar no peso , e também apresentou um pequeno defeito que pode ser corrigido. 
Algumas vezes na hora do disparo , o tiro falha e ficam duas bolinhas soltas na arma. Tirando isso uma excelente arma com um ótimo custo beneficio , ideal para quem está iniciando. 
Recomendo o produto !."
2917,5,"Bem real ótimo material e praticidade só deixou uma coisa a desejar a pressão não é tão boa pela qualidade do produto. Mas deixo minha nota 9,5."
2918,1,"Muito muito ruim pois as bbs sai todas sem rumo você mira no alvo a distância a 5 metros e as bbs desvia um palmo de alvo mas que droga essa pistola foi a compra mais frustrante que já comprei preciso de uma pra treinar tiro ao alvo essa é muito ruim perdi meu dinheiro não cumpriu com as promessas, sou cliente do mercado livre."
2919,5,"Ótimo custo benefício! é feita de um polímero de ótima qualidade, chega a parecer de que é de metal. Também é muito forte. Produto está de parabéns!."
2920,1,"O material da arminha é muito frágil e as molas internas não dão pressão alguma no disparo da bb. 
Tive de abrir a minha, desmontar o cano, lixar, lixar e lixar com uma vareta para alargar o cano, trocar as molas por molas mais rígidas, remontar tudo, e agora sim eu tenho uma airsoft de péssima qualidade. Mas pelo menos eu consigo 4metros de precisão."
2921,5,"Produto muito bom para iniciantes do airsoft. Bom alcance e precisão. Tem uma leve folga no magazine, mas todas que compramos apresentam essa característica (não é defeito)."
2922,2,"Muito bonita. Porém fraca. Em ambiente aberto, da pra ver claramente a esfera perdendo trajetória, a esfera vai caindo. Pra uma pressão boa, derrubar algo mais pesado que uma lata vazia, tem que ser numa distância de 10m. E mesmo assim mirar mais a cima do alvo pra compensar a queda da esfera na hora do disparo. E faltou um manual em português."
2923,5,"Essa é a minha primeira airsoft,n me arrependo nem um pouco,mt boa,a potencia é incrivel,a beleza é satisfatoria,e o peso mt bom."
2924,4,"Pistola muito boa, gostei da desenvoltura e precisão dos disparos; preço excelente e material compatível com o preço; usei várias vezes como teste e foi bem sucedido, algumas bolinhas costumam cair mas, depende da forma como vc a utiliza. A loja me deu suporte e entramos em acordo caso a pistola apresentasse defeito, porém, até o momento esteve tudo certo sem problemas."
2925,5,"Deveria aparecer no globo rural de tão maravilhoso. 
. 
Pes é um jogo excepcional em termos de qualidade gráfica e habilidades especiais dos jogadores. 
. 
O handicap atrapalha, e para enfrenta-lo é necessário estudos de cada time e cada jogador passo a passo. 
. 
Vida longa!."
2926,5,"Na verdade eu, a mae, fiz um péssimo negocio comprando isso p marido e filho. Nao consigo mais assistir tv. Vejo futebol o tempo todo qdo eles estao em casa, e ainda me chamam p torcer e ver os lances????."
2927,1,"O produto nao e atualizado para 2021. 
Pois ele e 2020 cm jogadores d 2010 e 2020. 
Nao recomendo alem d colarem durex na nota fiscal fui tirar arrancou tdos os dados da nota."
2928,3,"Não gostei muito. 
A konami peça muito nos gráficos e na praticidade dos acessos do jogo , como exemplo : se vc quiser acelerar a partida vc não consegue ele é muito lento."
2929,4,"Boa tarde! tirando a equipe do palmeiras que está genérico,o e os jogadores lendários do flamengo não são os principais nomes que fizeram história no clube! no demais tudo certo!."
2930,5,Não lê no meu xbox 360 e por que ele é  xbox one por que o meu aparelho não é one. Tem como trocar.
2931,5,"Gostei muito! pra quem gosta de jogos desse estilo ""futebol"" igual eu, nao tem o que reclamar. Bom de mais."
2932,5,"Sem comentários super recomendo muita diversão garantida , sou fan do pes. Muita diferença do fifa que e muito ruim!!!!."
2933,5,"Ainda não joguei, pretendo jogar domingo, mas eu tenho o 20 o 21 deve ser melhor e atualizado."
2934,5,"Top melhor que o fifa 21 ,pela metade do preço e não tem nome de jogadores estranhos."
2935,5,Melhor jogo de futebol! vem com os times atualizados e ainda dá pra jogar on-line.
