,score,comment
579,5,"O produto é excelente. Só tem uma coisa que se tornou um incomodo pra mim, que é a quebra do fio. Se vc comprar e substituir o fio que vem de fábrica por um fio mais grosso, fica ótimo."
580,3,Usei uma vez. Saiu cheiro forte do motor e fumaça. Mas aguentou. Apesar de ser grama bem rasteira. Produto queimou no segundo uso. Grama rasteira sem exigir da maquina. Procurei a loja. Simplesmente desconsiderou. Vou acionar o procon.
581,1,Muito frágil. A entrada para o parafuso não estava em paralelo com a outra em uma das bases. Enfim. Tenho o vídeo onde meu marido mostra que não conseguia encaixar a base. A qualidade não é boa.
582,5,"É muito bom o produto eu tenho um quintal de mais ou menos 100m² e me atende super bem, ele é muito potente, o nylon realmente desenrola automatico (nunca tinha visto isso funcionar em nenhuma outra marca)."
583,3,"A máquina em si até que é boa, atende se vc tem um gramado de até uns 50 metros quadrados. Mas o carretel de nylon que vem no aparador é mto fragil e quebrou no primeiro uso."
584,2,A maquina é forte porem na primeira vez q usei e n era tanta grama rachou a negocinho que arodeia e o de segura n firmou nd e tbm quebrou pois é um plastico muito fraco.
585,1,"Péssimo, não comprem. Eu uso em uma pequena área de grama do meu quintal, e na segunda vez de uso já deu problema, produto muito ruim. As partes plásticas também são de qualidade ruim."
586,5,Bom para minha nessecidade é suficiente mas se fosse para algo mair teria que ser algo mais potente mas como meu jardim tem apenas 10mts2 é suficiente e muito boa.
587,5,"Produto bom, porém o segundo cabo manual é fragil, fica desencaixando, no meu caso quebrou um dos suportes de plastico de um dos parafusos, no mais o aparador é perfeito."
588,5,"Gostei bastante. Fez exatamente oq propôs. 
Fiquem bem. Satisfeita. Meu jardim não é grande. Mas essa máquina da conta tranquilo de fazer um jardim maior. Bem forte. Eu compraria denovo."
589,5,"Muito bom. Usei por 3 horas e o fio não arrebentou nenhuma vez. Não esquenta o motor. E o melhor, tem duas saída de fios. 
Ótimo produto, reccomendo."
590,1,"O produto è uma verdadeira porcaria, jà foi duas vezes para a assistencia tecnica e só tem um mès de comprado, quanto a uso menos de 30 minutos."
591,2,Infelizmente na primeira hora de uso o pino plástico que segura o gatilho amarelo quebrou e para continuar usando tive que fazer uma adaptação com um parafuso.
592,5,"Amei o produto atendeu minhas espectativas rocei 300 quadrados de moto a fita deu e sobrou um pouquinho,mas estamos falando de roçar mato capim duro."
593,5,"Excelente produto custo x benefício, 2 x eu corta minha grama já paga essa compra, boa de potência e área que corta em uma passada."
594,5,"Ótimo! superou minhas expectativas, minha grama estava super alta com muito mato e o aparador deu conta do recado, agora é fazer só a manutenção."
595,1,Não presta comprei uma usei a primeira vez achei fraca na segunda  vez de uso a máquina pifou não resolveram nada a respeito.
596,5,"Corta bem, só o nylon precisa ser substituido por linha de pesca pois quebra menos. Fora isso está cumprindo com as necessidades."
597,4,"Bom, atende para pouco uso, corta mas não tem força para folhas mais grossas. Eficiente se a grama não cresceu muito ainda."
598,5,O produto é bom deu pra o que eu queria ranquei o fio de nilon e coloquei uma navalha deu ótimo.
599,5,"Muito fácil o uso, e só recomendo aparamento de pequenos jardins,aparar onde a máquina de cortar grama não chega, recomendo."
600,4,Nada além da expectativa. Único porem que o protetor não encaixa direito na maquina. Mas nada que afete o desempenho.
601,1,Eu só usei uma vez e não funcionou mais eu estou muito triste com o produto  quero saber como devolver.
602,5,"Produto atendeu as minhas expectativas, potência boa , usei em área com mato grande ,a máquina deu conta do serviço, recomendo."
603,1,"Produto de qualidade muito ruim,o pegador quebrou no primeiro uso,usei três vezes e queimou,aconselho que não comprem."
604,5,"Muito bom, comprei pra fazer acabamento no gramado em torno de árvores, cimentados, etc. Ja usei e funcionou muito bem!."
605,1,"Produto não funcionou. Precisando do produto não devolvi. Mandei arrumar. Co. 
Mecei trabalhar , quebrou o carretel. Falar o  que ????."
606,5,Ótimo produto. Para quem quer aparar a grama e não tem um quintal muito grande serve muito bem.
607,1,Porcaria usei meia hora parou fui abrir o motor derreteu e minha rede e 110 nao tem desculpa.
608,5,"Achei um produto de excelente qualidade e bem potente, já fiz um serviço com ele e aguentou tranquilamente."
609,5,"Excelente custo beneficio, bom motor com potencia na medida certa. Não precisa pagar mais nas marcas famosas."
610,5,Muito bom estou muito feliz com a compra que eu fiz ótima quem compra não se arrepende.
611,5,"O produto é excelente, funciona perfeitamente se usado corretamente. 
Eu afirmo que fiz uma excelente compra."
612,5,"Muito bom. Eu já tinha outro da mesma marca e é muito bom, durável e econfiável."
613,1,O meu aparelho quebrou na primeira ocasião. Estou tentando contato para repor o produto ou conserto.
614,2,"A alça de manejo é de péssima qualidade, quebrou assim que comecei a aparar a grama."
615,5,"Aparador top , potente, quase uma roçadeira, o sistema de fio duplo agiliza o corte, aprovada !!!."
616,5,Achei muito bom para uso doméstico. Atendeu bem ao primeiro teste sem quebrar o nylon.
617,4,"O aparador é ótimo, só o fio dele que poderia ser um pouco mais comprido."
618,5,Muito boa para fazer os cantos e cortar pequenas áreas de grama! superou minhas expectativas!.
619,5,Excelente aparelho ideal para o meu final de semana para cortar as gramas de casa.
620,1,"O produto já veio usado, com grama, enferrujado e faltando 1 parafuso. Não recomendo."
621,5,"Excelente ,otimo produto. Recomendo vale a pena cuato e beneficio que cabe no bolso."
622,4,Se a área a ser cortada for de pequeno e médio porte. Pode comprar.
623,5,"Produto de primeira linha, estão de parabéns. Atende todas as necessidades em minha casa."
624,2,"Bom, mas tem que se mais resistente aquece e derrete a base das tariscas."
625,5,Cortador de grama um top e barato bom demais mesmo vale a pena investimento.
626,5,Muito bom o produto além de ser leve o serviço ficou muito bom.
627,3,Nem bom e nem ruim apesar de ser um produto com menas potência.
628,5,Muito prático de usar não cansa você apara a grama sem esforço algum.
629,1,Nao aguentou primeira  vez que fui usar queimou induzido  do motor. Nao gostei.
630,5,"É excelente para limpeza doméstica, para limpar grama de pátio em casa."
631,5,"Gostei, cumpre o que promete, facil manuseio e pratica um pouco barulhenta !!!."
632,5,"So usei uma vez ,funcionou direitinho,acredito q nao vou ter problemas."
633,5,"Produto de qualidade, ainda não usei, mas acredito que atenderá minhas expectativas."
634,4,"Produto bom, e muito prático, fácil de manusear, atende o meu uso."
635,5,"Excelente produto ,com duas saídas de nylon,acabamento do serviço fica profissional."
636,4,O produto funcionou muito bem. Meu marido gostou de seu novo brinquedo.
637,5,"Muito bom corte perfeito. 
. 
Compraria novamente e super boa pra fazer acabamentos."
638,5,"Aparador muito bom, superou minhas expectativas, leve, prático, ótimo para trabalhos residenciais."
639,5,"Gostei, e uma maquina leve de fácil manuseio para fazer acabamentos;."
640,5,"Muito eficiente, recomendo, já é minha segunda compra dessa mesma marca."
641,5,"O produto é muito bom, ficou de acordo com minhas expectativas."
642,5,Achei o produto bom pelo menos por enquanto  usei duas vezes.
643,3,"Esperava algo um pouco melhor , mas ta bom pelo valor pago."
644,1,Nem funcionou ainda quando fui ligar a pouco dia  não funciona.
645,1,Simplesmente parou de funcionar na segunda vez que fui usar.
646,1,Nao funcinou dez minutos e queimo o induzido da maquina.
647,1,Não durou nada e já queimou usei treze vezes moderado.
648,5,"Muito bom , motor forte porém o fio é bem fraquinho."
649,4,Boa moito boa so q tem q troca o fiut.
650,5,Muito bom. Prático e bem de acordo com as informações.
651,3,E bom o produto fácil uso e fácil de estalar.
652,2,Não gostei por que já deu problema ela esta esquentando.
653,5,É ótima o roçadeira atendeu. Bem a minha minha espequitativa.
654,5,"Produto de otima qualidade ,veio do jeito que eu pedi."
655,5,Muito bom um ótimo preço e funciona muito bem.
656,5,"Bom, usei e até o momento está funcionando perfeitamente."
657,4,Gostei muito perfeito para gramados bom custo e benefício.
658,1,"Pessimo, queimou no 2 uso! prejuizo total nao recomendo!."
659,5,"Ótima qualidade, superou as minhas espectativa, potência muito boa."
660,5,Produto muito bom já usamos bastante sem defeito recomendo.
661,5,Muito bom atendeu minha espectativa gostei bastante do resultado!.
662,5,"Pela potência desse modelo, digo que trabalha muito bem !."
663,5,"Produto adequado ao que se propõe, leve para operação."
664,5,"Produto bom , até o momento cumpre todas as expectativa,."
665,5,"Produto de alta qualidade,  recomendo, fácil manuseio. Nota 1000."
666,5,"Ótimo produto! recomendo, forte e cumpre o que promete."
667,4,Ele é o que eu esperava um bom produto.
668,5,"Excelente. Corta muito bem, potência ideal pra jardim caseiro."
669,1,Usei 3 vezes e ela parou de funcionar.
670,4,"Muito bom, só o fio que quebra rápido."
671,3,Força bem razoável e qualidade de construção boa.
672,5,Muito bom excelente prático e fácil de usar.
673,5,"O motosserra é muito forte, de ótima qualidade. Me surpreendeu."
674,5,"Parece muito boa, até agora não tive problema nenhum."
675,2,"A princípio foi até boa, com 2 meses de uso, começou aparecer uns problemas como: demora na hora de pegar, e qdo ligava morria logo, tive que mandar pro concerto,  e agora está bem acelerada. 
Várias pessoas disseram que essa marca costuma dar problema. Uma pena  pois o valor foi razoável."
676,5,"O produto é bom para o trabalho leve é medio, é só sequir todos os procedimentos de utilização, que ela vai durar muito. Faça as misturas corretas é sempre reapertar todos os parafusos depois da utilização, pq folga devido a vibração do motor."
677,5,"Muito boa, já usei 3 vezes, funcionou tudo certinho, essa maquina o motor dela e um pouco grande, pensei que ia ser pesada, mais não e ela e super leve, valeu a pena paga barato, estou satisfeita com a minha compra."
678,1,"O produto é muito frágil, quebrou na terceira vez de uso não consigo peça de reposição, pediram pra levar em são paulo não é viável não recomendo."
679,1,"Não presta com um mês de uso já estragou, parou de funcionar."
680,5,"Ótimo produto, já usei, aguenta tranco, uito resistente e potente."
681,2,"Muito frágil solta tudo os parafusos, quebrou a partida."
682,5,Eu gostei não tenho que reclamar excelente recomendo.
683,5,Otima e forte e tem baixa manutenção.
684,5,Excelente produto muito bom funcionando em perfeito estado estão de parabéns.
685,5,"Muito boa, já vem regulada e bem ajustada. Adianta muito o serviço. Boa qualidade e bom acabamento. O que senti falta foi de uma lima, que poderia acompanhar. Fora isso, excelente ferramenta. Sabendo usar direito, não tem o que reclamar!."
686,4,"Máquina  boa. 
Aguenta  bem sim. 
Trabalha meia  hora com um tanque. 
Só  acho que joga muito óleo  na corrente, ou é  falta de regulagem sei lá. 
Mais é  boa sim."
687,1,O produto e muito bom gostei muito demorou pra pegar mas quando pegou fiz um teste com ele gostei e potente fácil de manusear.
688,5,"Estou muito feliz com ela, comprei por recomendação de meu amigo mecânico de 2 tempos, excelente máquina, vale muito mais que custa. Recomendo."
689,3,"Gostei, mas vaza óleo de lubrificação da corrente e fica cega com pouco tempo de uso."
690,5,"Ótima ferramenta, boa rotação leve e macia na hora do corte se continuar assim está ótimo."
691,5,Uma máquina perfeita. Ja conhecia a marca comprei sem medo. Nao perde pra nenhuma marca famosa.
692,4,Aparentemente muito bom usei duas vezes ainda mais funcionou perfeitamente estou satisfeito com o produto.
693,5,Tô impressionado com tamanha potencia dessa maquina superou todas as minhas expectativas nota 10.
694,5,Muito boa ferramenta ótimo custo benefício super indico para serviço doméstico e cotar lenha.
695,5,"Show de bola, é exatamente o que eu esperava, recomendo sem exitar, muito bom."
696,5,"Produto de ótima qualidade, bem resistente, faz o que promete, ótimo custo benefício."
697,4,"Bom produto, ainda não  usei,mais já conheço  a marca da tekna."
698,5,"Potente e fácil de montar, já usei e ela atendeu bem. 
Recomendo."
699,3,"Produto bom,porém demora a funcionar. Depois que funciona,fica ótimo."
700,5,"Excelente motossera,muito boa mesmo,valeu obrigado,super indico,satisfeito."
701,5,"Produto de boa qualidade, resistente, fácil montagem, recomendo a todos !!!."
702,5,Ferramenta muito boa supriu todos as espectativa eu recomendo.
703,5,Produto muito bom de fácil manuseio sem dúvida  excelente!.
704,4,Até agora. Um bom produto (2 meses de uso.
705,5,Produto ótima qualidade pode comprar sem medo top.
706,4,"Muito bom, moto serra excelente amei eu recomendo."
707,5,"Muito bom, potente e forte, funciona muito bem!."
708,5,"Motor cerra muito bom, funciona direitinho,  muito potente."
709,4,Muito bom estou satisfeito com minha  compra.
710,4,"Muito boa, fácil de montar e manusear."
711,5,"Motosserra prática, robusta vale cada centavo."
712,4,Muito bom recomendo  excelente para trabalhar.
713,5,"Ainda não testei,mas parece boa."
714,5,Ótima motosserra de ótima qualidade índico.
715,5,Muito bom para minhas necessidades.
716,4,Bom produto atendeu as expectativas.
717,5,Muito bom atendeu minhas ewpectativas.
718,5,Ótimo produto recomendo custo benefício.
719,5,Muito bom       de excelente qualidade.
720,5,Excelente qualidade e custo/benefício.
721,5,Gostei muito dessa motosserra.
722,4,"Atendeu minha necessidade, recomendo."
723,5,Muito bom para o preço que paguei850.
724,4,"Produto é muito bom , para o que escolhi , atendeu a minha expectativa, serve para triturar pequenas quantidades. Tritura  bem, ainda não testei o moedor. 
O que eu acho que é falho no produto é o cabo de energia é muito curto , se precisar ligar em tomada mais alta por exemplo não alcança acho que o fabricante deveria melhorar este item, estou usando extensão e isso não é recomendado."
725,4,"Excelente produto,funciona super bem ,muito pratica ,dei 4 estrelas porque ficou a desejar a pineira para fuba aquela que faz o fuba bem fininho tipo fuba para fazer angu. Ela não vem com está peneira fina não, mais se tivesse vindo eu daria 5 estrelas ,eu amei essa picadeira."
726,5,Triturador. Extraordinário. Super ótimo. Sabe que falto. A altura da onde cai a mirela e muito baixo. Deveria ter pelo menos 1 metrô de altura no lugar que cai a kirela vou ter quer que aspirar pelo menos 20 centímetro erguendo o triturador. No mais não falto nada além disso.
727,3,"Tenho 2 avaliações, primeiro comprei ele pra triturar cana, motor potente,  porem no uso da saida lateral não funciona pra cana, embucha e tranca o motor, lateral só uso de capim, mudei o sistema e funcionou perfeitamente, porem com a saida embaixo!."
728,4,"Ótimo produto. Poderia ter o cabo de energia maior. Tb o parafuso que abre o compartimento poderia ser tipo borboleta para facilitar a operação. No mais excelente,  motor bem forte. Recomendo   usar protetor de ouvido e óculos de proteção."
729,5,Otimo produto pra pouco uso. Motor e bom equipamento é ótimo dentro das suas limitações. Pro que eu comprei esta otimo. Mais se quer pra algo mais bruto vai em um maior.
730,4,"Produto muito bom no geral,  fica um pouco a desejar quando se quer triturar cana ou napie,  para grão ele é muito bom,  mas no geral custo benefício  ele é excelente."
731,5,Gente minha vida ficou mais fácil agora ñ preciso fica moendo milho de pouco em pouco mói tudo de uma vez e muito prático e rápido e excelente amei meu produto.
732,3,"Produto eficiente, motor fortee de fácil  montagem. Porém  apresentou alguns orifícios  de escape do pó  ao triturar os grãos  na sua carcaça, o que deve ser corrigido. Contudo , me agradou."
733,3,"Ela divulga um motor de 2,5 hp porém ele parece que tem só 1 estou trabalhando com ela mais tenho que modera muito. 
O capim animal é potência."
734,5,"Excelente. Triture até legumes para uma sopa para humanos. Ficou muito bom. Vai me ajudar com as plantas, com a forragem da égua e com minha comida tb kkkkk."
735,4,"Produto muito bom,não dei cinco estrelas ainda porque quase não usei o produto,só atestei e não usei mais,esperando a capoeira crescer pra usa-lo com frequência."
736,5,"Excelente triturador. Atende ""quase todas"" expectativas. Digo ""quase todas"" por faltar mais opções de peneiras. Fica uma dica para o fabricante. Porém, estou satisfeito com a excelência do produto."
737,4,"Bom produto, atende bem as expectativas, só não dou nota 5 pelo pouco tempo de uso(durabilidade) e por não ter usado ainda todos os recursos."
738,5,"Muito bom. Quem quiser comprar,não tenha dúvida de que o produto é de boa qualidade. Atende perfeitamente a finalidade a que se destina."
739,5,"Eu comprei para meu esposo ele amou ele é potente tritura uma beleza, rapidinho ele moeu o milho e a quirela fica bem fininha."
740,5,"Muito bom. Cumpre seu papel,pelo custo benefício é excelente,estou satisfeito. E oriento a usá-los 220 volts o desempenho e muito melhor."
741,4,"Muito bom, tem algum lugar q vaza pó e as lâminas não são d aço logo deu dentes mas funciona q uma blza!!."
742,4,"Para serviços caseiros e com paciência cumpre  muito bem seu objetivo. 
Tritura bem cana, galhos finos e médio de arvores e capins. 
Recomendo."
743,4,"Gostei muito. Bem forte, simples de montar e eficiente. Uso para galhos, folhas e forragens. Para mim, foi uma mão na roda. Recomendo!!."
744,4,"Para o preço muito bom ! porem as faças são fracas, no primeiro saco de milho que foi moído nela feis muitos dentes !!."
745,5,"Ótima forrageira. Muito boa mesmo. Se podesse dava mil estrelas. Quem quizer comprar nao tenha medo, pois estará fazendo um ótimo negócio."
746,1,Tudo que tentei triturar tipo cana e galhos de mandioca utilizando as peneiras acabou embuchando e travando o funcionamento do motor.
747,4,Ele está atendendo a nosa nesecidade com ótimo rendimento que e fazer quirele para as aves aqui do noso sitio.
748,3,As pineiras sao muito parecida e a pineira grossa nao tritura grosso passa muito fuba queria uma quirela sem fuba.
749,4,Não tive ainda oportunidade de abrir e verificar o funcionamento do produto. Razão porque não coloquei a nota máxima.
750,5,"Eu gostei muito, e uma excelente maquina atende a minha necessidade e potente  e potente recomendo e excelente."
751,5,Muito bom. Tem potencia e vc pode escolher entre jogar de lado ou para baixo a forrageira.
752,5,Muito bom. Superou minhas expectativas ótimo preço daria pra comprar duas outra com diferença das lojas aqui.
753,5,Muito bom gostei bastante único fator negativo e que faltou um parafuso mas a restante muito bom.
754,5,Produto muito bom. Eu recomendo. Meu esposo está usando na nossa chácara. E esta gostando muito.
755,5,Adquiri este modelo baseado nas opiniões de outros compradores. Produto excelente e supre perfeitamente minhas necessidades.
756,4,"Muito bom, fácil e prático, ótimo para quem tem uma roça pequena, gostei muito do equipamento."
757,5,Muinto bom perfeita pra servisso pequeno otimo recomendo acredito que embreve comprarei outra muinto boa.
758,5,O produto é ótimo de fácil montagem e atende muito bem em tudo que precisamos.
759,5,O produto é de ótima qualidade e muito prático. Funciona perfeitamente para o que preciso.
760,4,O produto é bom e cumpre perfeitamente seu papel e  recomendo a todos do ml.
761,4,"Produto bom, ate o momento esta mim suspendendo com o seu desempenho, gostei do produtor!."
762,5,Muito bom  bom desempenho e eficiência e qualidade no trabalho do dia a dia.
763,5,Ótimo produto. Estava precisando muito de uma forrageira para fazer ração para minhas criações.
764,3,Os pés ou apoiadores vinherao os 2 esquerdo ou seja de um lado só.
765,5,"Gostei muito do produto, veio tudo certinho, cumpre o que promete, super recomendo."
766,4,Produto tramontina ter25 cor laranja dois cv achei um produto muito bom exelente.
767,5,"O produto é muito eficiente, cumpriu com minhas necessidades e é bem potente."
768,5,"Amarelo e preto, produto robusto, muito bom para ser utilizado no que precisei."
769,4,"Muito bom,bastante potente ja´usei varias vezes estou satisfeito com a compra."
770,3,Boa para quem usa pouco e achei que véi com pouca peneira.
771,5,Muito boa adotei recomendo a todos  estou muito contente com o produto.
772,5,Muito boa e forte e  potent para tritura a racão de bichos.
773,1,Bom ainda não fiz funcionar mas de minha opinião e dez.
774,4,"O produto atendeu minha expectativa , máquina excelente e de fácil manuseio."
775,5,"Produto muito bom, pelo menos até agora não deu problema. Recomendo!!!."
776,4,"Ótimo produto, estamos testando mas indica que servirá para nossa demanda."
777,5,"Triturador perfeito pra tudo que eu quero, desempenha bem o trabalho."
778,5,Eu gostei o acabamento muito bom e cumpre o que promete.
779,5,Muito bom. Gostei atende muito além do que eu esperava.
780,5,Muito bom o produto ele e muito resistente eu amei.
781,5,"Produto ótimo, ótima qualidade, fácil de montar e de operar."
782,5,Muito boa. Ja fiz meu silo e ja triturei milho.
783,5,"Ótimo produto, atendeu até mais do que o esperado, recomendo."
784,4,"Gostei parece ser bom, espero que dure por muito tempo."
785,5,O equipamento obteve o êxodo pretendido e ficamos muito contentes.
786,5,"Gostei do produto, estar funcionando perfeitamente perfeitamente fico muito agradecido."
787,5,"O produto é excelente é de ótima qualidade, recomendo à todos."
788,4,O produto é de boa qualidade e atendeu minhas necessidades.
789,5,Muito bom trabalhar super bem o motor  é forte gostei.
790,5,Muito bom. Fácil de montar e silencioso. Para pequena quantidade.
791,4,Bom e mesmo o que eu procurava e ótimo ok.
792,5,"Otimo produto foi como eu esperava. 
Fiquei muito satisfeita."
793,5,Produto muito bom recomendo a todos do mercado livre.
794,5,Excelente para o dia a dia para pouco serviço.
795,4,Por. Enquanto usei pouco mas me parece muito bom.
796,5,Produto muito bom otima qualidade atendeu as minhas espectativas.
797,5,"Produto de excelente qualidade, funciona perfeitamente, superou as expectativas."
798,5,Bom produto. Bem acabado e atende a pequenos trabalhos.
799,5,"Otimo  ,super recomendo  esse produto essa marca é otima."
800,4,Muito bom porem poderia ter vindo com mais peneiras.
801,5,"Ótimo custo beneficio, excelente para uso em média escala."
802,5,"Tá ótimo o triturado, tá me atendo bem."
803,5,"Ainda não usei muito, mais parece muito bom."
804,4,Máquina muito boa não veio com nenhum defeito.
805,4,Bom na categoria dese produto é muito bom.
806,5,Gostei muito do triturador produto excelente e reforçado.
807,5,"Muito bom, gostei bastante do produto. Super indico."
808,5,"Muito bom, produto de qualidade atendeu minhas necessidades."
809,5,Muito bom perfeito  recomendo produto de excelente qualidade.
810,5,"Ola produto muito bom,era oq esperava mesmo."
811,5,Exelente!!!  já vou comprar novamente para um vizinho.
812,4,"Otimo produto, estou satisfeita com a compra recomendo."
813,5,"Atende as expectativas, um produto de boa  qualidade."
814,5,"Produto realmente top, atende tranquilamente a minha demanda."
815,5,"Otimo produto, material muito reforçado, adorei e recomendo."
816,5,"Muito satisfeito,atendeu  super bem a nossa demanda."
817,5,"Excelente, robusto, até o momento atendendo o propósito."
818,5,"Excelente, muito bom, até aqui ta funcionando perfeitamente."
819,4,Bom para uso a que se propõe rrrrrrrrrrrrrr.
820,4,"Produto bom, de fácil montagem, atendeu minhas expectativas."
821,5,"Muito bom. , pra poucos animais é top."
822,5,É um produto muito bom super indico.
823,5,"Ótimo produto, veio com uma rebarba de plástico no buraco do bico fazendo ele jogar água pro lado mais com uma agulha foi fácil removê-lo! recomendo."
824,5,"Tenho certeza que fiz uma excelente compra,amei esse pulverizador,vou cuidar para que dure muito todas as peças."
825,5,"Excelente, produto de ótima qualidade, resistente e o melhor, funciona bem, excepcional."
826,5,"Muito bom, com destaque para a resistência do material,  recomendo."
827,5,Material resistente e tem um pulverização uniforme. Gostei muito!.
828,5,Muito bom recomendo a todos do ml.
829,5,"Simplesmente o melhor borrifador, sem comparações!!!."
830,5,"Muito bom, produto de qualidade."
831,5,"Otimo produto , atendeu minhas expectativas."
832,5,Excelente muito prático e funcional.
833,5,"Otmo pulverizador ,bem resistente!."
834,5,Excelente!.
835,5,Gostei.
