,score,comment
405,4,"Mesmo sendo a primeira que comprei, foi relativamente fácil de montar. Funcionou muito bem e logo me acostumei com o peso e manobrabilidade. 
Minha crítica não vai para a serra, mas para o manual. Ele tem a ferramenta explodida e peças numeradas, porém não tem a lista com os nomes das peças. 
Também as instruções para a montagem não são claras nem didáticas. Precisa uma urgente revisão e reformulação. Se eu não tivesse alguma experiência com máquinas, ela estaria na caixa até hoje."
406,5,"Eletrosserra muito bem construída, potente e corta muito bem. Cortei galhos de 10 a 12cm de diâmetro com facilidade. Consome bastante óleo, mas acho q é característica de todas as serras. A corrente não afrouxa e não é muito barulhenta. Gostei muito da compra, está sendo muito útil na minha chácara. Quanto a construção e a qualidade do material, recomendo a marca. Quanto a durabilidade, não posso opinar, pois comprei recentemente, mas acho q vai durar bastante pela qualidade apresentada."
407,3,"A serra tem bom acabamento e parece bem construida. Já montei lubrifiquei e testei o funcionamento, porém não serrei nada ainda com ela. 
Um ponto muito desfavorável que compromete o produto é o manual que o acompanha que é extremamente pobre de informações essenciais, por exemplo, não tem nenhuma explicação nem figuras mostrando como fazer a montagem da serra, tem que ir na base da tentativa e erro. Não há nenhuma informação sobre o tipo de óleo a ser usado na lubrificação no manual. Entrei em contato com a assistência técnica e fui mal atendido. Eles simplesmente não sabiam me dizer qual óleo eu deveria utilizar. Tive que apelar para o google!."
408,5,"Mais do que esperado, máquina muito boa na mão de que sabe manusear. Só manter ajustado que não cai a corrente e afiar regularmente, manter bem lubrificada com óleo próprio. 
Cortei eucalipto seco de 15-25cm de diâmetro fácil, podei uma pitangueira muito rápido, tem que saber usar pra não tem problemas. 
Comprei com medo pois pensava que era fraca mas me surpreendeu muito ótima máquina pra quem quer usar próximo de casa(precisa de extensão grande). Faz barulho como uma circular, nada de mais. Melhor que o barulho das a gasolina sem contar q apertou liga não é o sofrimento de ficar puxando a corda pra ligar."
409,5,"Espetacular,atendeu todas as necessidades,apenas um detalhe que faltou ,qual o óleo pra usar na lubrificação da corrente? se é de motor de carro,se é 2 t, se é sintético ou não,se é de máquina de costura,ficou a desejar no manual, depois que consultei a internet foi que descobri que tem óleo específico para lubrificação da corrente, porém já havia colocado no reservatório óleo novo de motor de carro."
410,3,"Ainda não utilizei, parece ser bom. Porém não vem com o óleo de lubrificação, inadmissível. Ainda mais por ser um óleo especifico e difícil de acha, para saber qual o óleo usar tive que entrar em contato com o fabricante pois no manual não consta a especificação. 
. 
Produto com garantia de apenas 3 meses, outro fator ruim."
411,5,"Está me servindo muito bem nas podas e corte de lenha, não recomendo cortar galhos muito grossos e de toras muito rígidas, mas para manga, goiaba, e demais frutíferas aqui da chácara está me servindo muito bem. É leve, de fácil manuseio, acabamento bonito e aparenta ser constituída com material de qualidade. Quanto a durabilidade não sei informar pois comprei recentemente, somente o manual que deixa muito a desejar pois falta informações. 
De modo geral, um produto satisfatório e com ótimo custo beneficio."
412,2,"Até corta, mais te hora tem q regular a corrente pois a vibração solta o regulador. E o ponto mais crítico dela é que não tem freio motor de segurança, qndo tira a mão do acelerador a corrente continua girando. Se der o rebote e n conseguir segurar, adeus rostinho bonito."
413,5,"Excelente custo-benefício. Cumpre o que promete. É fácil de usar, mas é preciso aprender a montar e usar corretamente. Não esquecer de verificar o óleo e desmontar e limpar ao final do serviço. É para uso residencial em pequenas árvores."
414,4,"É uma boa serra, cortei troncos de até 25cm de diâmetro, mas sempre desbastando dos 2 lados. O motor tem força suficiente. 
Ponto negativo é o alto consumo de óleo e a frequente necessidade de esticar a corrente. O conjunto de fixação do sabre me parece meio frágil, melhor não arrochar muito a porca e ir regulando mais vezes do que espanar a porca ou parafuso. 
No geral é uma boa compra e vale o preço que está sendo cobrado."
415,5,"Gostei muito. É silenciosa (comparada com a gasolina) funciona muito bem, cortei galhos de uns 15cm de diâmetro facilmente. Pra uso doméstico, eu recomendo sem dúvidas. Mas observem o manual, não é indicada pra trabalho constante, então ela não deve aguentar trabalhar horas direto."
416,4,Produto bom. Não sei se é só o meu que o óleo do reservatório não veda. Fica derramando quando não estou usando. Mas mesmo assim recomendo o produto. Se não fosso por esse probleminha daria as 5 estrelas.
417,4,"Prós: :bom produto, leve, parece ser bem resistente, a corrente novinha corta só com o peso da serra é muito afiada, já usei ela mais de 1h e ainda esta afiadinha, o cabo tem uma bom comprimento e é bem resistente. 
Contras: não tem trava de seguranca da corrente, o unico dispositivo de seguranca que tem é do botao de ligar, e tbm não tem regulagem de vazao de óleo e a chave de regular a corrente é muito curta."
418,2,"A lamina tem um pininho de apoio que solta a corrente a toda hora, tem q ficar de olho p não correr riscos, o motor é forte mas a corrente da pepino a todo momento, naum gostamos naum. , apenas corte galinho."
419,4,"Ainda não testei o produto, mas, o fato de vir sem um refil de óleo, me impediu de usar. Apenas por isso meu 4 estrelas. No mais, acabamento muito bom e excelente custo benefício."
420,4,"Ela faz cortes com bom acabamento, porém para podas de galhos pequenos. O acabamento é a diferencial. Um corte com facão agiliza o trabalho mas não traz esse corte preciso que essa eletroserra faz. Ao meu ver faltou um botão de segurança para que a pessoa nunca fique com uma das mãos livres. Isso garantiria que o operador nunca tente fazer a poda e a mão livre bata na corrente."
421,4,"Só  não  dou 5 estrelas porque  a lubrificação  não  é  automática conforme o descrito tem que deixar sem óleo  para guardar pois vaza, do resto  exelente máquina robusta e funciona  muito bem, exelente  custo  benefício."
422,4,"Muito boa, só tem um probleminha ela trepida muito na hora que ta cortando a lenha me parece porque ela é leve talvez se ela fosse um ppuco mai pesada não trepidaria tanto."
423,5,"Máquina excelente!. 
Trabalhei muito com uma motoserra makita, claro, muito boa, mas esta daqui não deve muito e é muito mais barata!. 
O único inconveniente é o consumo de óleo da lubrificação da corrente. 
Pinga muito, o que acaba sujando até a roupa. 
Mas prefiro ela bem lubrificada do que quebrando a corrente por falta de lubrificação. 
Excelente compra!."
424,1,"Só corta no começo,depois de uns 5 a 6 galhos não corta mais ,não recomendo vou ter que comprar outra,se trocar acorrente,vai ser igual só vai cortar uma meia duzia de galhos."
425,5,"Vei tudo sertinho,  produto bom, bom acabamento, corta muito bem. 
Só poderia ter dois parafusos  de fixação  do sabre, só com um dificulta a regulagem da corrente."
426,1,"O livro de orientacões é muito incompleto. Falta informacões sobre a montagem , por ser um produto perigoso no seu manuseio a montagem é essencial. Não tem um desenho explicativo e falta informação de um parafuso que auxilia na correta instalação da corrente. E tambem nao diz nada sobre o tipo de oleo utilizar na lubrificação. Estiu decepcionado."
427,5,"Achei ótimo, pratico, seguro, excelente para serviços como, cortes em madeiras, mesmo sendo de diâmetros maiores. 
Sugiro para os clientes do mercado livre."
428,4,"Boa para serviços leves, como podar galhos, cortar lenha, serviços de carpintaria e tal. Mas é bem robusta. Me surprendi. Muito boa. Vale cada centavo."
429,4,"Otimo equipamento gostei do desempenho. 
,para mim que trabalho com coisas leves ela e perfeita fiz o teste cortando uns galhos de arvore para lenha e ela atingiu minhas espectativas. Só achei que o oleo de lubrificaçao acaba muito rapido mas ja dei uma olhada e resolvi isso. Pra mim valeu apena adiquirir ela."
430,5,Muito bom. Top. Tem potencia e força. Corta madeiras grossas e duras. Eu uso muito para cortar lenha. Pode comprar sem medo.
431,5,"Produto atende bem as minhas necessidades,. 
Para serviços de pequeno porte,. 
Podas de arvores e cortes de lenhas no sitio. 
Estou satisfeito com a compra."
432,5,"Melhor compra do ano pra mim, sou mulher e o produto e fácil pra utilizar seguindo todas as recomendações, adorei pois já trabalho com motoserra de gasolina. Essa é perfeita pra artesanato de madeira com menos peso e mais segurança. Na dúvida procure um profissional pra orientar, o produto é excelente."
433,5,"Excelente produto, com um bom acabamento e bastante potente, muito bom para uso doméstico como: pequenas podas e cortes de troncos."
434,4,Só não dá pra falar si e bom por q não usei ainda mandaram com votaje 127 aqui onde eu moro só têm 220.
435,4,"Bom tamanho, leve e pratica para o corte de lenha em casa. Aguentou até mesmo toras maiores com 40cm de diâmetro, mas deve ser manuseada com cuidado visto que não possui freio na corrente, girando muito após o dedo ser removido do gatilho, fora isso, é uma boa ferramenta."
436,3,"A corrente sai com muita facilidade. Já tentei apertar ao máximo o parafuso, mas quando pega uma madeira mais grossa, sai."
437,5,"Ótimo produto. Valente, leve, fácil de usar, funcionamento perfeito pra o uso em podas, corte de pequenos e médios troncos. Recomendo!."
438,5,Eletroserra robusta e potente. Ótima aquisição. Cortei árvores e troncos de diâmetros entre 30~35cm. Trabalhei de forma contínua por todo o período da manhã por 4 dias seguidos. Importante realizar a manutenção de limpeza ao final de cada dia de trabalho e sempre verificar a tensão da corrente.
439,5,"Único defeito q afroxa a corrente constantemente. Muito boa de força, corta muito bem. Excelente custo benefício."
440,4,"Para poda de árvores boa,. 
Não gostei da lubrificação da corrente, desperdiça muito e vira uma meleca misturada com a serragem."
441,5,"O produto é excelente, funciona muito bem. O manual é bem explicativo e em português. Não vaza óleo do reservatório quando bem  armazenado. Achei o consumo de óleo um pouco elevado. A corrente perde a tensão com pouco tempo de uso mas é super fácil de regular. Recomendo."
442,5,"Produto com excelente custo beneficio , encontrei dificuldade para regular a corrente , mas depois funcionou muito brm."
443,3,O manual e as instruções de montagem são precárias. Não tem i firme de assistência técnica nem de de peças.
444,5,"Excelente, corta fácil fácil, é leve e tem corte perfeito. Tem que tomar cuidado como toda motoserra,senão ela dá golpe por ser leve e a corrente não para de imediato. A lubrificação é boa consome óleo como todas. Fácil de ser manuseada. Bom acabamento."
445,5,"Materia de boa qualidade. É um tanto pesada, mas normal pela potência. 
Prática e segura."
446,4,"Gostei ,atendeu o que eu esperava , o que achei fraco foi o parafuso de apertar a corrente. Banbeia com facilidade."
447,4,"O produto e bom porem vaza um pouco de oleo as vezes a correia solta quando a lamina da uma trancada, mas no mais recomendo, crta muito bem e bem potente, claro nao e uma maquina profissional, mas para servicinho, domesticos e muito boa."
448,4,"Produto parece ter muita qualidade  usei uma vez pra teste. 
Só o manusldeixa a desejar."
449,5,"Muito boa, achei o tamanho e pesos ideais. Ainda não trabalhei com a serra, mas já testei e gostei."
450,4,"Não usei ainda a eletroserra, mas aparenta ser útil no que se propõe, achei o manual de instruções bem fraco, vou ter que pesquisar mais sobre a montagem e segurança do produto, e tambén não indica qual  óleo a ser usado  no equipamento  ??????."
451,4,"Produto mt bom. 
Gostei demais da potencia e do tamanho do sabre. 
Bom dmais!."
452,4,"Vale a pena ter , fácil de montar e pode usar óleo de cozinha msm pra lubrificar a corrente."
453,4,A eletrosserra é muito forte. As únicas observações que faço: a corrente acaba criando muita rebarba no corte (acredito que seja pq o corte ainda não esteja alinhado)  e também a corrente acaba folgando com certa facilidade. No mais tudo ok.
454,5,"Ótima serra, boa potencia, perfeita para serviços pequenos, tipo cortar lenha, podar arvores, etc."
455,5,Muito boa me ajudou e vai ajudar muito mais ainda é melhor do que eu esperava recomendo.
456,5,Muito bom msm meu sogro gostou muito pra fazer servico que ele queria nao precisa de outra serra essa compriu o que ele precisava a unica coisa que oleo acaba muito rapido mais acho que e normal pra trabalhar lubrificada.
457,4,"Muito bom, meu uso não é profissional, apenas poda de arvores, produto funcionou perfeitamente!!!."
458,5,Excelente o que eu esperava só gasta óleo para lubrificação não estava acostumado mas estou satisfeito.
459,4,"Muito boa, para podas e trabalhos ""leves"" ela se desempenha bem, o único problema é o parafuso para ajusar o sabre, é de difícil acesso e é bem chato de parafusar ele, mas tirando isso, é uma ótima ferramenta."
460,5,"Produto bem dimensionado, fácil manejo e adequado para trabalhos que necessitem corte, poda."
461,5,"Até o momento nada a reclamar,  ótimo produto , corta muito bem, oleo de corrente gasta razoavelmente."
462,5,"Boa motosserra trabalhos pequenos podas de arvores é excelente ,a lubrificação da corrente que é um pouco escessiva, mas o ruim é quando lubrifica pouco, por isso recomendo eu compraria outra se fosse preciso."
463,5,"Motosserra muito leve, de fácil manuseio e com bom desempenho. Estou muito satisfeito."
464,4,Produto com preço de baixo custo e que e bem útil no uso pequenos serviço. Gostei.
465,3,"Muito boa, não é barulhenta, tem muita força. Pena que consome bastante óleo. Tem que limpar bem após o uso, pois acumula muito pó de serra onde sai o óleo para lubrificar a corrente."
466,4,"Produto muito bom para serviços leves, excelente custo beneficio, atende as especificações."
467,5,"Aparelho muito bom, estou satisfeito com a serra, prática de fácil manuseio e corta bem."
468,4,"Atende aquilo que se propõe. Não é equipamento pelo seu porte para corte de ""árvores"" e sim para uso em pomar com podas e desbastes, e foi com essa finalidade que eu comprei!."
469,5,"Perfeito,,serra pau sem barulho,,no tamanho certa pra por na churrasqueira."
470,2,Enxada pesada e muito grande. Mas tá valendo.
471,5,Muito bom atendeu as expectativas.
472,5,Gostei muito  recomendo o produto.
473,5,"Usei pela primeira vez. A montagem é super fácil. Muito potente. Usei quase todos os acessórios que acompanham a roçadeira e todos se mostraram eficiente e de boa qualidade. Veio ainda um óculos de proteção e protetor auricular de brinde. O galão misturador vem com as marcas que facilitam na hora de preparar o combustível. A roçadeira é muito boa de funcionar. Tendo os cuidados necessários e o uso consciente, ela deve durar muito!."
474,5,"Roçadeira top de linha, recomendo a todos,,estou super satisfeito."
475,5,Ótimo produto consegui fazer tudo e mais um pouco.
476,5,Produto de ótima qualidade e funcional.
477,5,"Já tive 2 de 2 tempos estou na esperança que a de 4 tempos não me cause os aborrecimentos e manutenção que a as 2 causaram. A primeira impressão foi muito boa, vamos ver com o passar do tempo."
478,5,"Produto tem me atendido de forma satisfatória, gostei muito, motor bem silencioso. 
Facil de ser usado e é motor 4 tempos ajuda muito,."
479,5,Tenho uma menor agora mais essa mais forte mesmo naipi silenciosa muito excelente.
480,5,"Excelente produto, funcionou perfeitamente, ótima qualidade. Máquina muito forte corta muito."
481,4,Bom produto. Achei um pouco pesada. Mas roça muito bem.
482,5,"Muito silencioso pelo fato de ser motor 4 tempos. 
Recomendo."
483,5,Produto muito bom. Realizou o serviço como esperado.
484,5,Gostei e muito nem faz muito barulho.
485,5,Excelente. Recomendo o produto ao novos clientes.
486,5,"Máquina valente, menos barulhenta e econômica."
487,3,O cesto de recolhimento da grama é muito frágil é deveria ter um sistema de encaixe pra colocar e tirar bem mais prático pois cada vez que preciso colocar é muito difícil o encaixe do mesmo estou pensando até em retirar de vez e fazer uma adaptação mais simples pois comprei a máquina com recolhimento pra não ter trabalho pra ajuntar a grama mais perco muito tempo pra colocar o cesto minha mãe então conseguiu tirar mais pra colocar novamente não tinha jeito de encaixar ficou decepcionada com o sistema muito ruim.
488,4,"Ótimo cortador de grama, pela qualidade de construção e dos materiais. Potência adequada a um uso doméstico ou pouco moderado. Alguns pontos fracos são: encaixe do cesto não é muito prático; e poderia ter uma alavanca de regulagem de altura de corte ou outra solução, ao invés de ter que deslocar os eixos das rodas dentre as 3 posições possíveis na carcaça, que também não é tão prática."
489,5,Melhor do que eu esperava! apesar do coletor ser pequeno nem se compara ao trabalho q era ter q ciscar e apanhar toda grama cortada. É so deixar o carro de mão ou cesto do lado e ir descarregando a grama. Vale a pena demais! recomendo!.
490,4,"Produto muito bom! única coisa que poderia melhorar é cesto de recolhimento, principalmente o encaixe na máquina: o cesto veio ""empenado"" dentro da caixa, dificultando o encaixe que já não eh muito bom, fica soltando muitas vezes."
491,5,Excelente máquina. Leve prática e eficaz. Compramos pra cortar/ limpar  grama de vasta área de condomínio e laterais da piscina. Ficamos mto satisfeitos.
492,5,"Funciona muito bem , bom para utilizar em areas de ate 300 m2."
493,5,"Excelente produto: produto de melhor qualidade, pratico  para usar, não quer força."
494,5,"Trapp como sempre né. Ótima,vale a pena o investimento."
495,5,"A máquina é muito boa. 
Leve, eficiente e bem resistente."
496,5,"Bom produto, recomendo. 
Ja tive um, um dos melhores."
497,5,"Muito boa maquina, corta sem esforço e recolhe tudo."
498,5,Produto de qualidade que atendeu as minhas expectativas.
499,5,Muito top produto de otima qualidade.
500,5,"Condiz com produto oferecido, excelente qualidade."
501,5,"Excelente,  superou minha expectativa."
502,4,"Produto de boa qualidade, de início parece ser mais flexível do quê o que usava antes, mas é muito resistente, excelente para mato baixo e não quebra."
503,5,Super indico produto de ótima qualidade.
504,5,Ótimo produto estou muito satisfeito.
505,5,Ótimo produto. Recomendo aos amigos.
506,5,De boa qualidade.
507,1,"A maquina veio com a parte da serra com outro nome,q o certo seria pra vim com o nome toyama assim como mostra na caixa dela,toda de plastico parece mas ser descartavel. Resulmindo nao gostei e devolvi pq nao veio do jeito q vi q o certo seria com o nome toyama."
508,1,"Não veio manual de montagem, apenas de usuário. 
Varias peças vem desmontada e não tem nada para consulta para montar."
509,4,"Equipamento de boa qualidade, só não vem regulada. Mas os assistência regulou e tive outros custos."
510,4,"Bom, pra ser melhor só faltou a nota fiscal."
511,5,Exelente aguenta o trabalho que queria fazer.
512,5,Muito bom super leve  pratico e economico.
513,5,Otimo muito bom. Eu recomendo !!.
514,5,Produto muito bom econômico recomendo.
515,5,Muito boa e super resistente.
516,4,Estou satisfeita com o produto.
517,5,",produto ideal para pequenos afazeres."
518,5,"Excelente produto, recomendo a todos."
519,5,Muito bom! falta prática.
520,5,Muito bom.
521,5,"Todo certo,."
522,4,Polidoro simplesmente o melhor tira ferrugem e polidor de metais.
523,5,Máquina excelente para quem tem um jardim de detalhes ! outra recomendação importante é que não a deixe esquentar muito. Dê um tempo até ela esfriar e depois pode voltar a usar ela normalmente. Recomendo ela demais !.
524,5,"Produto muito bom, de acordo com a descrição. Recomendo."
525,5,"Excelente equipamento, inaugurei a uma semana por cerca de 30 minutos, me atendeu perfeitamente, no meu caso cerca viva em muros, facilitou muito a vida, na tesoura era desgastante e levava muito tempo."
526,5,Ótimo atende às expectativas  gfuffgg hfthgggg hfjjjj jgghhhhh kmhrsxgg.
527,5,"Muito bom produto de alta qualidade ,silencioso e faz o serviço direitinho ,sem nenhum problema ,da conta do recado , eu recomendo."
528,5,"Ótimo produto, estou satisfeito com a compra."
529,5,Muito bom como imaginei único detalhe que eu e os outros clientes encontraram foi o cabo que é curto.
530,5,Muito bom pois facilita muito o trabalho.
531,5,"Eu comprei porque já conhecia, ótima ferramenta, só que não uso profissinalmente, só para serviços esporádicos."
532,5,"Excelente produto, atendeu todas as minhas expectativas."
533,5,Ainda não utilizei. Porém pesquisei muito sobre o produto em questão e vi excelente reviews.
534,5,"Ótimo custo benefício, prática e muito funcional,."
535,4,"Produto bom, somente o cabo que é muito curto, como outros consumidores já opinaram."
536,5,"Muito bom, atende a expectativa."
537,5,"O aparador é bom, um pouco pesado por ser bem residente, mas eu recomendo!."
538,5,Ótimo produto muito eficiente.
539,5,Muito  bom  fácil  de usar  valeu a pena comprar  terminei  rápido  o serviço.
540,5,Produto muito bom para pode de era então nem se fala eu recomendo.
541,5,"Produto muito bom, bem projetado, o operador maneja com facilidade consegue boa produtividade."
542,5,Excelente para cerca viva a potência é muito boa valeu a pena.
543,5,"Produto muito bom, desculpe a demora em responder estava de licença médica."
544,5,Produto muito bom. De fácil manuseio. Atendeu minhas necessidades. Recomendo.
545,5,"Responde a minha necessidade, espero que dure bom tempo."
546,5,"Excelente produto, ótimo no trabalho e no manuseio."
547,5,"Muito bom produto, pra jardins pequenos ele serve."
548,4,Produto muito bom. Atende ao que se destina.
549,5,Ótimo atendeu as minhas expectativas produto excelente.
550,5,"Ótimo produto , fácil de usar , compraria novamente."
551,4,Produto muito bom porém um pouco fraquinho.
552,5,"Ótimo produto, muito bom custo e benefício."
553,5,Produto muito bom superou minhas expectativas.
554,5,Tal como publicado no mercado livre.
555,5,"Prático, leve, útil para trabalhos domésticos."
556,4,Muito bom. Aparelho pratico de usar.
557,5,"Muito bom, felizmente produzido no brasil!."
558,4,Excelente. Fácil manuseio e muito seguro!.
559,5,Produto de ótima qualidade muito eficaz.
560,5,"Bom produto, superou as expectativas."
561,5,"Excelente produto, esse ? meu segundo."
562,5,"Excelente, a compra que fiz."
563,5,"Excelente produto, postagem rápida, recomendo."
564,5,Excelente produto bonito e eficaz.
565,5,"Ótimo produto, gostei muito, recomendo."
566,5,Excelente produto! cumpre o prometido.
567,5,Muito bom  o produto excelente.
568,5,Ótimo produto superou as expectativas.
569,5,"Muito bom cortador, recomendo!."
570,4,"Bom produto, corresponde às espectativas."
571,5,"Bom produto, recomendo."
572,5,Muito bom recomendo.
573,5,"Funciona muito bem, corta bem, não fica desligando. A linha de pescar é hiper resistente, pois até apenas gastou e não quebrou uma única vez. Funciona com fiações antigas também."
574,1,Bom dia. Venho com essa mensagem falar sobre o cortador aparador de grama que comprei dia 29/09/2021. O aparelho foi usado por meia hora e começou a sair fumaça e parou de funcionar. Gostaria de saber oque posso fazer. Se posso mandar pra garantia ou não. Se o problema foi mal uso blz. Que eu acho que não foi isso que aconteceu. Pois o aparador não pode contar grama por meia hora. ? podia estar especificado. Agora se o problema é do produto gostaria que resolvessem isso pra mim. Aguardo retorno obrigado.
575,1,"Só estou tendo prejuízo,  comprei em setembro pra limpar meu quintal que por sinal não é grande,  usei uma vez deu problema levei na assistência arrumaram , fui usar consegui cortar só a metade da grama , ficou parada por algumas semanas ,olhei essa semana ligou mas quando comecei a cortar parou de novo , vou levar na assistência de novo e vou tentar pedir outra , provavelmente é defeito deles. Uma vez o rapaz disse q era o carvão, mas q carvão vagabundo q não aguenta nem sem usada 3 ou 4 vez. Decepcionada com esse produto."
576,1,"Frágil, parou de funcionar depois de utilizar 8 vezes em um quintal pequeno 5x3m em 3 meses, achei que poderia ser apenas as escovas (carvão) que é normal gastar, porém o problema é que derreteu o alojamento das escovas e o valor de uma bobina nova é praticamente o preço de outro cortador , então é realmente descartável."
577,5,"Muito bom, potente. A parte de grama em casa é até grande e aguentou super bem. Aparamos grama baixa. Faz acabamento, ficou muito bom!!! adoramos e está aprovado. 
Pelo preço então, valeu muito. Já usamos 2x e está em ótimo estado. Acredito que durará mto tempo."
578,5,"Muito boa, ótima para residência e uso moderado. Só precisa tomar cuidado no uso para não deixar entrar mato no eixo do motor pois pode sobrecarregar. Usando com cuidado e sempre prestando atenção nisso deve durar uns bons anos. Recomendo 100%."
