,score,comment
218,5,"Muito bom, vale a pena adquirir. O que deixa a desejar um pouco é o fio que o liga. Mesmo colocando na extensão o pugle sai da tomada da extensão, por conta dos movimentos que se faz com o soprador. Sugestão a garthen: poderia ser maior o fio. Fora isso, o produto é ótimo, vale a pena comprar."
219,5,"Material leve, fácil manuseio vento direcionado, controle de velocidade. 
Sopra folhas secas e molhadas. Retira muita poeira e areia da area externa da casa, uso também para secar o carro e soprar o interior. 
. 
Dois probleminhas fácies de resolver, a chave liga/desliga/seletora. 
E o comprimento do cabo, realmente é muito pequeno, poderia ter no mínimo 50 cm. 
Claro que isto não impede o funcionamento, mas é chatinho estes incoveniêntes."
220,5,"Soprador barato e muito potente, me impressionou!. 
. 
Comprei para realizar limpeza no meu computador (tirar pó do teclado e da parte interna do gabinete) já que os outros sopradores que vi para esse fim eram bem fraquinhos. 
. 
Esse é tão forte que tenho que tomar certo cuidado 'kk. 
. 
O cabo é realmente muito curto, ainda bem que me atentei a descrição e aos comentários do produto e comprei uma extensão elétrica. 
. 
Recomento!."
221,5,"Leve, eficiente, potente. Atendeu minhas expectativas. Tem que usar óculos de proteção, pois seu jato de ar é forte e vai lançar materiais menores entre as folhas ou que você esteja limpando. Não direcione o jato de ar em direção a outras pessoas. Não use para acender churrasqueiras, seu jato é muito forte mesmo na posição 1."
222,5,"Excelente, custo e benefícios são ótimos. Comprei para meu padastro usar, ele é idosos e tem 1. 90 de altura e usava ratelo na chácara, fazia a limpeza em muitas horas e ficava com muitas dores no dia seguinte, agora ele faz em minutos e agora não terá mais problemas de dores. O produto é leve e prático, mesmo sendo ligado na rede elétrica. Estamo muito satisfeitos."
223,5,"Excelente produto, na potência ideal para a limpeza do quintal. O cabo de força é muito curto, mas não atrapalha na execução do trabalho que necessariamente precisará de extensão. Comprei para minha mãe, que é idosa utilizar, e ele adorou porque não precisa se abaixar para utilizar, visto o cano ser mais comprido, e as duas velocidades do sopro contribuem bastante. Além disso é muito leve, não cansando o braço."
224,4,"Cara gostei bastante. A força dele me surpreendeu. Leve, pequeno e compacto para guardar. O preço muito satisfatório. Acredito ser o melhor custo beneficio. Unico contra é q o botao de desligar é muiito duro. Depois de alguns usos nao consegui mais desligar. Tive q desmontar e pasaa uma graxa dentro. Essa parte foi mau projetada."
225,5,"Ótimo produto. Minha esposa pediu de dia dos namorados um secador de cabelos e eu estava precisando de alguma coisa pra facilicar varrer as folhas do meu jardim. Com esse produto consegui os dois, é um bom secador de cabelos e como soprador de folhas é ótimo. Unica coisa é que folhas sobre grama ficam um pouco mais dificeis de sair, mas nada de outro mundo."
226,5,"Produto excelente e potente!. 
Cumpre o que promete. 
Referente ao cabo da tomada ele é de tamanho seguro. O equipamento foi projetado para ser usado com uma extensão. 
Vamos imaginar se o cabo tivesse 1,5 metros ou mais aí você iria trabalhar arrastando a tomada pelo chão. 
O equipamento tem um local na traseira para você prender sua extensão auxiliar, evitando desconexões indesejadas do plug."
227,5,"Excelente custo benefício, supriu todas as minhas expectativas. Tenho um quintal grande todo encimentado, tem arvores grandes e cai muitas folhas, fora a terra que junta. Usei o soprador, foi show, tem duas velocidades, além de ser muito forte o vento, leva folha, terra, pedregulho, o q tiver pela frente. Super recomendo."
228,4,"É bom, só que sopra muito forte e acaba q tenho que finalizar na vassoura, pois ele espalha muito, por ser forte. 
O botão de liga desliga não é bacana, duro e dá problema, tem que desligar na tomada pq ele as vezes não quer funcionar. O barulho é muito forte também, muito estressante e desagradável. Mas cumpre, sopra bem."
229,5,"Adorei o produto. Deve ficar atento ao que você deseja. No meu caso, adquirimos somente o soprador pq nosso intuito era ""varrer"" as folhas que caem no entorno da casa do sítio, para esse fim o equipamento é excelente. Fácil de manusear, não é pesado demais e faz pouco barulho. Consegue até varrer as folhas por cima da grama. Estou muito satisfeita."
230,5,"Comprem sem medo, pelo preço comparado aos concorrentes da a sensação de ser um produto ruim, ou frágil. Usei ele duas vezes já, e o produto é excelente para limpeza de patio ( o meu é enorme) e para secagem do carro! aconselho para quem quer gastar pouco e ter um produto otimo."
231,5,"Eu amei!!! exatamente o que eu queria. Estava com medo de não ser bom para meu quintal. Moro em uma chácara que tem uma grande parte de gramado, com árvores em volta. 
E ele dá conta do trabalho perfeitamente!!! o que eu levava a mais de 2 horas para deixar em ordem rastelando, ágora 30 min. Está prontinho!!!??."
232,5,"Comprei para soprar folhas secas de hibisco que caem sobre as britas, e estou muito satisfeito. Achei que as pedrinhas (que não são aquelas específicas de jardinagem) fossem voar, mas isso só acontece se eu colocar o soprador bem perto do solo. Por 209 reais valeu muito a pena. Espero que dure!."
233,5,"Comprei pra limpar computador,  muito bom. Adianta o trabalho demais e o melhor de tudo é que não esquenta e aguentar ficar ligado direto por vários minutos, talvez ate horas ( não levei nem 10 minutos para limpar o pc). Muito melhor que comprar aqueles baratinhos de 100 reais que queimam atoa."
234,5,"Atende muito bem ao uso residencial. Boa pressão de sopro (se aproximar o bico de alguma superfície, dá um tipo de ""coice""). Optei por esse modelo em vez do modelo com aspiração por causa do menor peso e volume (também considerei avaliação de usuários que informam que o aspirador do modelo maior não é tão eficaz). Estou satisfeito."
235,5,"O produto é muito bom e realiza perfeitamente o trabalho desejado. Ê leve e fácil de usar. O vento sai com bastante força e dá conta de soprar todas as folhas. O tempo que se perdia varrendo as folhas do chão, agora foi resolvido com a utilização do soprador. Excelente. Recomendo."
236,4,"É muito potente, empurra até cavaco de metal no chão, ajuda muito na limpeza, o único inconveniente é o cabo de energia que é extremamente curto e exige o uso de extensões e não tem nem como amarrar, fica soltando toda hora, do resto não tenho do que reclamar."
237,5,"Leve, potente e eficiente, um bom custo benefício. Varrer o chão ficou muito fácil e é bom também para secar carros e principalmente motos pelos difíceis acessos. É um pouco barulhento, mas pra quem se incomodar, basta usar um protetor auricular. O fio é bem curto, tem uns 30cm. Você irá precisar de uma extensão."
238,4,"Para um jardim urbano ou quintal pequeno com poucas folhas é viável, mas para um local com muitas folhas e algumas mais pesadas ele deixa a desejar. Para o meu caso teria que ser um mais potente. Vou poupar para comprar um a gasolina ( pq o fio atrapalha) e maior potência."
239,5,"Espetacular. Facilitou muito a minha vida. Varre bem folhas, pêlos e pedrinhas. Leve e o cabo curtinho não atrapalha em nada pois é só usar uma extensão. Quase não faz barulho. Bom pra soprar poeira e água de carros ou motos, soprar cachorro depois do banho tb. Muito bom!."
240,5,"Bom produto, atendeu as minhas expectativas, bom custo x beneficio, eficiente na limpeza dos 5 mil metros da chácara principalmente em lugares de difícil acesso com o rastelo. Único inconveniente é o tamanho do fio e por desplugar  facilmente da extensão. Mas no quesito do trabalho do soprador excelente."
241,3,"Quebra um galho, tem que saber usar, senão espalha mais a sujeira e levanta um pó miserável. No mais, funciona, faz um barulho grande, deve consumir uma luz daquelas porque meu relógio ficou violento. Fio cotoco curto, se não comprar uma extensão de no mínimo 10 metros vai passar raiva."
242,4,"Alta potência, sopra com força limpando a área por onde o vendo é direcionado. 
O cabo de energia é uma vergonha, você terá que providenciar uma extensão na metragem que necessitar. 
Compacto, leve e fácil de guardar. 
Vale o preço que se paga comparado a outras ferramentas desse grupo."
243,4,"Surpreendente a potência dele, só não dei 5 estrelas pelo cabo ser muito curto, se faz necessária uma extensão, de resto, meu patio é de brita e é enorme levaria 1 hora em média para rastelar, agora em 10 minutos tudo pronto."
244,5,"Melhor aquisição que tive até o momento, comprei esse soprador com a finalidade de secar o carro e limpar meu computador, pra mim atende perfeitamente bem. Super recomendo, o vento produzido é forte. O único ponto fraco é o tamanho do cabo, mas isso é resolvido com uma extensão."
245,3,"Comprei no intuito de secar o carro. O cabo de energia é bem curto, deve ter uns 30 centímetros no máximo. 
Não é muito potente, não atende completamente para o meu uso (preciso finalizar com um pano), mas a descrição também não fala que serve para tal finalidade."
246,5,Produto maravilhoso realmente atende o que promete testei ele hoje muito bom logo vou comprar outro só esperar a fatura do cartão fechar para levar para fazenda e deixar um aqui em casa podem comprar sem medo não vão se arrepender.
247,5,"Excelente compra, pois é muito pratica para varrer folhas e outras sujeiras em quintal, e muito leve para se manusear. O que ficou a desejar foi o tamanho do fio que veio muito pequeno mas como tem de adquirir uma extensão para passar por todo o quintal ok. 
Recomendo."
248,5,Muito bom o assoprador leve e venta muito o barulho que faz e igual a um secador de cabelo vassoura aposentada kkk recomendo o produto mais não e um produto profissional para ficar o dia inteiro ligado mais e perfeito para sua residência e manter quintal limpo.
249,4,Boa e econêmica e forte. Somente a chave devigar que vai do médio para o forte que é complicada pois quando colocamos no forte fica muito difícil de desligar ou muda para o médio depoius. Devem mudaressa chave de ligação!!!.
250,5,"Produto muito bom pra quem trabalha com jardim e  ajuda que em vez de ficar varrendo é só asoprar. 
Super indico. 
Excelente ferramenta. 
Economizei tempo no meu serviço. 
Pra limpar calçadas , jardineiras, até mesmo o quintal. 
Eu uso até em casa pra tirar poeira em lugares difícil."
251,5,"Muito bom soprador comprei um para secar o meu veículo após as lavagens, porque foi vitrificado e me recomendaram secar com um soprador para não usar toalhas de microfibra porque risca a vitrificação, é potente muito bom leve, estou gostando muito é fácil e prático de usar."
252,3,"Ótimo custo benefício!!! cumpre o prometido. Não tem muita potência. Mas em relação ao preço, não posso reclamar!. 
Ótimo pra soprar folhas. Mas em relação a galhos pequenos não é aconselhável!!!!. 
É um produto pra casa mesmo!!! no geral. Recomendo!!!!."
253,4,"Ótimo produto, bem reforçado e a tesoura é bem afiada também. Recomendo."
254,5,Produto muito bom. Joguei fora a tramontina que eu tinha.
255,5,Absolutamente maravilhoso facilitou em muito meus trabalhos de jardinagem.
256,5,Produto de material de qualidade e bem acabado.
257,4,"Muito bom, atendeu a necessidade."
258,5,"A lona é muito boa,resistente, por não ter ilhós de alumínio ou reforçado deixa um pouco a desejar mas o valor compensa se ela não for forçada ao extremo."
259,5,"Pazinha muito boa, resistente, e tamanho bom, serviu muito bem para o meu proposito, recomendo."
260,5,Ótimo produto boa qualidade atendeu bem minhas espequitativas.
261,5,"Boa qualidade e acabamento. 
Cumpriu minhas expectativas."
262,4,"Muito bom, super prático e resistente. Recomendo."
263,5,"Muito bom, boa qualidade, vale a pena."
264,5,A pazinha é muito boa. Achei perfeita.
265,5,Boa qualidade  bonita e parece resistente.
266,5,Adorei. Muito prática. Recomendo muito.
267,5,Gostei demais do produto !!!!   perfeito.
268,4,"Ótimo esse aguenta pau ,maneiro e resistente inagurei numa agaroba seca saia até fogo de tão dura mas o motoserra levou d boa recomendo, principalmente pra nós aqui do nordeste."
269,5,Bom dia o produto e bom a minha veio vazando olho da corrente levei na asistencia e madei arruma o resto tudo  bem e de boa marca nota dez.
270,5,"Produto muito bom e recomendo, tenho uma roçadeira dessa mesma marca há  4 anos e até agora coloquei gasolina e facas novas."
271,4,"Achei meio frágil pois o botão da trava do acelerador já qebrou. Nao consegui achar a marca oregon nas peças,."
272,5,"Muito boa, ela é leve e muito potente. Para trabalhos leves e otima."
273,5,Otimo produto  otimo preco na relacao custo beneficio.
274,1,Deu defeito com uma hora de uso.
275,5,Muito bom e atende às nossas expectativas.
276,5,"Muito bom, superou as expectativas."
277,5,"É legal, recomendo."
278,5,"Produto de otima qualidade ,super potente exelente para corte de mato alto valor muito bom para uma rocadeira  muito potente vale o investimento ,estou muito satisfeito ,recomendo aos compradores do ml ,boa noite."
279,4,"Teste feito e venho aqui modificar minha opinião. É uma excelente roçadeira, mas como ja havia dito, esperava mais potência p 52cc e 2hp de motor. Mas p uso casual como eu farei é ótima, bem mais potente que a stihl fs120 que tenho. O cinto não é dos melhores, comprei um da marca stihl que foi o melhor que ja trabalhei até hj, o parafuso que prende a lâmina não presta, espanou, tive que substituir por outro, mas é baratinho, a lâmina de 3 pontas que vem é muito frágil, espessura horrível, não aguenta tranco, comprei 2 lâminas novas de 3 pontas da marca wonder de espessura 4mm e uma de 2 pontas da marca toyama de 3mm de espessura. Essas são extremamente resistêntes. O carretel é bom. O consumo dela achei um pouco elevado, gasta em torno de um tanque por hora se precisar usar aceleração máxima, se for usar moderadamente faz uma hora e meia com um tanque. Mas acredito que pela potencia o consumo é aceitável. No demais estou satisfeito com a compra."
280,5,Bom dia. Nos primeiras horas de serviços parau de repente e não pegou mas. Eu estava longe da cidade. Voltei para ver qual era o defeito. Avela tinha queimado não passava corrente. Troquei e ela pegou espero que não queime mas. Pois está na garantia. So tem um dia de uso. Ou 5 horas de serviço. Mas tem muita potência e muito forte. E eu confio nesta marca. Eu fosse campra eu compraria a mesma. Por causa dum pequeno defeito isso acontece nas melhores marcas do mundo.
281,5,"Até o momento não deixa a desejar. Eu ja tinha uma toyama, e também trabalho com sthil, toyama não fica atrás. Muito potente e confiável. Apenas alguns acessórios que precisa substituir pq são bem frágeis e desconfortável, como: cinto, lâmina de 3 pontas, porcas que prende a lamina e do engraxe. Mas a máquina em si é muito top, além de ter um custo muito menor que qualquer outras de marcas mais conhecidas e com cilindradas inferiores."
282,1,Produto de péssima qualidade usei uma vez não pegou mais levei na assistencia técnica 30 dias pra ver o que houve e eles me informaram que na maiorias das vezes a garantia não cobre o conserto então na hora de compra pense 10x para não ter dor de cabeça.
283,1,"Ruim , 4 dias de serviço,  já está com o pistão danificado, prejuízo de 250 ,00 reais. Péssima aquisição. Produto muito ruim, não presta. 
Parece que é uma roçadeira descartável,  usou 1 vez, tem que jogar fora, descartar. 
Tenha + respeito pelo consumidor, deixem de vender/ anunciar produtos ruins."
284,3,O produto é bom veio com uma peça amaçada mas consegui resolver tive também um problema com o acelerador que escapou o cabo e terei que regula-lo mas isso farei qdo for roçar a chacara novamente mas no mais é bom sim.
285,5,"A princípio comprei, mas preocupado com os comentários negativos, mas me surpreendi, fiquei muito satisfeito com a roçadeira. Corta muito bem, tem muita força e o desempenho é muito satisfatório, para bens para a marca toyama tbc52h."
286,1,"Comprei com 2 meses de uso apresentou defeito no cabo de acelerar fica travando ,retirei a tampa de proteção do moto e constatei q a máquina veio com a parti de cima quebrada ,a camisa veio amassada."
287,3,"Máquina potente mas com muito pouco uso soltou o cabo do acelerador soltou todos os parafusos do cabo ,então pra ser sincero não gostei pois a máquina está novinha e já vou ter que levar pro concerto."
288,1,"Infelizmente terei que avaliar mal pois usei 3 vezes e apresentou problemas, não liga mais, levei para autorizado hoje, mais ainda não sei qual o problema, mais pelo menos tem assistência técnica, pesquisei isso antes de comprar."
289,1,"Veio com defeito, não funcionava. Tive que levar em uma oficina e trocar uma peça  que veio quebrada ,  enfim ,  gastei mais 100$ pra poder usar a máquina. Super insatisfeito."
290,3,"Produto bem acabado, parece bom. 
Já liguei e testei e funcionou bem. 
Gera bastante fumaça, mas não sei se é normal pois nunca trabalhei com este tipo de produto."
291,4,"O produto é potente, mas não indicaria para gramados residenciais, é difícil manter o corte homogêneo e gasta bastante combustível se comparado ao cortador de carrinho tradicional."
292,1,"O máquina deu problema, levei na assistência e me disseram que a garantia é só de 90 dias! sendo que foi falado que seria de um ano."
293,4,O defeito da rocadeira era a porca que prende o magneto que veio frouxa quando eu liguei soulto o magneto devido este problema rraxou o mesmo.
294,4,"Muito boa, só um detalhe que a minha perdeu o parafuso q fixa o acelerador, devido não vir vem apertado, fora isso muito boa, valente."
295,5,"Muito boa excelente qualidade bem robusta aguenta o tranco,usei pra corta 2 hectares de mato ela se saio muito bem otima marca recomendo."
296,5,"Comprei o produto por indicação de um amigo e estou em fase de teste, mas estou gostando muito; supriu todas as minhas expectativas."
297,1,Diz que corta até árvore mas quebrou o ferro no primeiro corte de grama e estou com problemas para devolver.
298,5,"Produto excelente,  estou muito satisfeito, o material é de primeira,  a potência é muito boa e fácil pra manusear."
299,5,Primeiro uso sem qualquer novidade ! só achei que vibra um pouco mas pode ser devido a potência ! produto aprovado !.
300,5,Compraria de olhos fechados o produto. Qualidade e bom preço em um só material. Excelente produto = cliente satisfeito.
301,5,"Eu mesmo já fiz atividades de roçagem com essa máquina. É um sucesso, e estou muito satisfeito. Obrigado."
302,5,"Excelente produto,  muito forte e econômico, com 1 tanque trabalhei 1:45 h. Ótima aquisição,  recomendo."
303,4,"Minha área a ser cortada é de 2. 000m2 ela deu conta do recado, muito boa."
304,4,Um produto que responde o q vc quer de marca compre não vai se arrepender.
305,5,"Bom dia. 
Usei gastei apenas um tanque de combustível e estous bem satifeito até momento."
306,5,"Muito bom, excelente. 
Já um tempo trabalhando com ele estou tendo uma experiência muito boa."
307,5,Ecelete produto só peça um pouquinho nos acessórios cinto e faça são fracas.
308,5,Super satisfeito. Troquei o carretel e ficou do jeito q eu gosto. Obrigado.
309,5,Máquina muito boa forte e muito leve primeira partida já pegou ótimo produto.
310,5,O que dizer da rocadeira toyama  senão dizer que é a melhor.
311,5,"Por enquanto muito bom, só resta saber se tem uma boa durabilidade."
312,5,"Boa para minhas necessidades,  2 dias de 2 em 2 meses."
313,5,"O produto é bem acabado, porém ainda não foi usado. Att."
314,5,Gostei muito do produto recomendo pra quem quiser adquirir a rossadeira.
315,5,Muito bom e prático. Recomendo este produto mesmo para serviços pesados.
316,5,"Ótimo produto, vem completa, muita força para roçar. Show de bola. !!!!."
317,5,Ótimo produto mas o consumo de combustível e muito elevado.
318,5,Muito boa usei o dia todo. Superou minhas espequitati vá.
319,5,"Até o momento, muito bom, funcionando perfeitamente, atende minha necessidade."
320,5,Muito bom! muito potente! estou muito satisfeito com o produto!.
321,5,Muito bom tem muita força e e fácil de manusear.
322,5,"Forte robusto atende perfeitamente o que promete, estou super satisfeito."
323,5,Ótimo produto já usei e muito boa estou satisfeito.
324,5,"Achei ótimo a rocadeira,  o trabalho rende. Muito eficiente."
325,5,Muito bom eu gostei muito e recumendo  pra todos.
326,5,"Produto excelente qualidade, muito potente;pode comprar sem medo."
327,5,Gostei do produto. Muito eficiente e divertido fácil manuseio.
328,5,"Muito boa, gostei bastante, me atende muito bem."
329,5,"Muito boa recomendo,. Muito potente to gostando dela."
330,5,Produto de boa qualidade gostei aconselho a comprar.
331,4,Produto muito bom gostei de momento está aguentando.
332,5,Roçadeira muito boa! estou satisfeito com o produto.
333,4,Produto muito bom atende todas as minhas expectativas.
334,5,"Recomendo a todos do mercado livre, ótimo produto!."
335,5,"Exelente, pelo preço que paguei, superou minha expectativa."
336,5,"Muito bom, era o que eu estava precisando."
337,5,Gostei bastante do produto estou muito satisfeito.
338,5,O produto atendeu as expectativas. Estou satisfeito.
339,5,Ótima roçadeira. Muito bom custo x beneficio.
340,4,"Bom produto, muito potente,  valeu o investimento."
341,5,"Muito potente. 
Está me atendendo muito bem."
342,3,Produto muito bom de qualidade eu recomendo.
343,5,O produto superou minhas expectativas. É excelente.
344,5,"Ótimo produto , boa potência , bom custo beneficio."
345,5,Muito bom do jeito que eu imaginei.
346,5,Ótimo produto! recomendo a todos  do ml.
347,5,Gostei muinto do produto. Recomendo para todos.
348,5,Muito bom e prático de montar. Excelente.
349,1,"Roçadeira parou de funcionar , como faço."
350,2,Muito boa valeu apena pelo preço.
351,5,Muito bom recomendo pode comprar recomendo.
352,4,Boa qualidade e dentro das especificações.
353,5,"Produto excelente, ótimo acabamento e resistência."
354,5,Ótimo produto recomendo  leve e economico.
355,5,"Excelente roçadeira, forte e fácil manuseio."
356,5,"Muito boa roçadeira, leve e potente!."
357,5,"Excelente produto, superou as minhas espectativas."
358,5,"Muito boa, roçadeira de excelente potência."
359,5,Atendeu minhas necessidades. Recomendo o produto.
360,4,"Muito bom, produto de boa qualidade."
361,5,Muito boa forte ótimo produto resistente.
362,5,Muito bom o produto. Gostei bastante.
363,4,Produto muito bom forte bom acabamento.
364,5,"Gostei muito produto otimo. 
10."
365,5,Excelente roçadeira de alta qualidade.
366,5,"Produto de ótima qualidade, adorei!."
367,5,"Produto de boa qualidade , recomendo."
368,5,Produto muito bom estou satisfeito.
369,4,Top de linha otimo                         lkkkkkkkkkkk.
370,5,Bom dentro da expectativa. Atendeu.
371,4,"Produto muito bom, gostei muito."
372,5,Muito boa. Superou as espectativas. !.
373,4,Bom protudo. Tá recomendado pessoal.
374,5,Atendeu bem recomendo este produto.
375,4,O equipamento atendeu as espectativas.
376,4,"Produto de ótima qualidade, recomendo."
377,5,"Produto de boa qualidade, exelente."
378,5,"Produto muito bom , lubrifica bem, recomendo."
379,5,Produto ótimo podem comprar tudo certo.
380,5,Ótimo muito bon vai me ajudar muito  excelente produto.
381,5,Muito bom. Atendeu muito bem no que eu previsava. Recomendo!!.
382,1,"Boa noite. 
Infelizmente nao gostei do produto. Motor muito fraco. E o cabo nao é fixo, toda hora tem que parar para fixar pq sai do lugar. 
Horrivel de fixar no lugar, precisa fazer força. Gostaria de ficar mas achei muito dificil de manusear a maquina."
383,5,"Produto de ótimo qualidade. Arrojado para serviços leves. Não indicado para granados muito alto. Se manter a grama baixa, não terá problema na roçagem."
384,5,1400. Bom o equipamento. Escrever opinao ê um saco.
385,4,"Ótimo produto. Bonito e muito funcional. Recomendo. Porém, acho que o recolhedor deveria ser maior para diminuir as paradas e haver maior rendimento no trabalho."
386,5,Top de mais colhe quese toda grama ficando quase nada para juntar depois muito bom produto.
387,5,Produto muito bom. Vou comprar mais um.
388,4,"Achei bom, o recolhedor escapa às gramas finas, poderia ser menores às saídas."
389,4,Dentro de sua capacidade me atendeu bem apesar de ter usado só uma vez.
390,5,Muito bom produto atende as minhas necessidades.
391,5,Máquina de. Boa qualidade. Superou minha expectativa. Muito boa mesmo.
392,5,Top muito bom! podem comprar sem medo!.
393,5,"Perfeito, me surpreendeu produto de alta qualidade facil manuzeio."
394,5,"Produto muito bom, recomendo a compra."
395,5,"Funcionou como o esperado, valeu a pena."
396,4,Cortei grama alta e funcionou bem.
397,4,"Muito bom. 
Muito bom. 
Muito bom."
398,5,"Ótimo produto muito potente, gostei muito."
399,5,"Cumpre oq promete, corta bem sim."
400,5,Excelente qualidade. Produto top demais.
401,5,"Ótimo produto, cumpre o que promete!."
402,5,"Excelente aquisição. 
Estou muito satisfeito."
403,5,"Gostei do produto, fácil de montar."
404,5,Produto superou minhas expectativas!.
