,score,comment
0,3,"As arandelas são lindas, porém estetica não é tudo. O acabamento deixa muito a desejar, chegaram muito mal embaladas, soltas e em saco plastico (um produto com vidro em saco plastico. ) uma arandela para ser utilizada em area externa, os vidros tem frestas enormes onde a agua da chuva pode entrar e queimar o produto, sem falar que elas chegaram algumas com o vidro soltando, e outras com o vidro completamente soltos. Terei que gastar mais para ajeitar uma coisa que por obrigação deveria ter chegado como no anunciado. Eu sinceramente, nao compraria novamente pela falta de comprometimento com o consumidor que ta pagando caro por um produto que deixa a desejar."
1,5,"Produto ficou lindo na parede, agora começará a chuva e poderei melhor avaliá-lo se realmente é para área externa ou não, contudo muito fácil de instalar e muito bonita. Amei."
2,3,"Produto é até bom, mas veio com furacões erradas, nem sei como vou instalar ainda, preciso fazer direto na parede, não fixa na caixa de energia padrão de tomadas."
3,5,"Produto muito bom! só em uma parte do corredor, que no meu caso, seria necessário lâmpadas mais fortes (considerando altura até o chão e distância entre elas)."
4,4,"Muito bonito, otimo acabamento! apenas fica aberto nos fundos, podendo entrar bichinhos. Se fosse fechado, seria perfeito! mas o produto é ótimo! muito boa compra!."
5,5,"Ótimo acabamento, já está instalado há uns dois meses e está no tempo, nenhum problema apresentado neste tempo, lâmpada também está ok. Super recomendo!."
6,5,Já comprei e comprei de novo. E vou comprar mais amei super fácil de adaptação perfeito fica o ambiente.
7,1,"Produto ate esta ok, mas veio na cor errada, fiz conforme fui orientado e ainda assim veio errado."
8,5,"Ficaram lindas, um efeito bacana na parede. Para decoração e não para quem quer iluminar eu recomendo."
9,3,"Arandela simples, com pouca luminosidade. Apenas decora com uma iluminação bem fraca. Quase não se destaca."
10,5,Produto de boa qualidade e bem bonito. Perfeito para o que queria no meu ambiente.
11,5,"Boa apresentação, boa qualidade, mas ainda não pude instalar para emitir uma opiniai mais clara."
12,2,Produto bonito. Porem porcaria. Todas as 3 arandelas que comprei estao descolando os vidros.
13,5,"Produto muito bom, veio dentro do praso e está funcionando bem , atendeu minha nessecitade."
14,5,"Produto bem acabado e de fácil instalação. 
Cria um efeito na iluminação muito bonito."
15,4,Produto bom de mais que as lâmpadas nao veio de 5w veio 3. 5w.
16,5,Muito linda amei !!! não clareia muito mas da um belo efeito na parede.
17,4,"Muito bonito como na foto,o encaixe da led veio com defeito."
18,5,"Maravilhosas, comprei 11 unidades, fiquei maravilhada com os efeitos delas a noite."
19,5,Surpreendeu minhas espectativas! muito linda e funcional. Esta de parabens otima qualidade.
20,5,"As arandelas são lindas, ótimo acabamento e super bem embaladas! muito satisfeita."
21,4,"Produto muito bom, com acabamento excelente. Ficou lindo ao lado da cama."
22,5,"Produto muito bom, ficaram lindas, não ilumina muito, mais para efeito decorativo."
23,5,"O produto é exatamente o anunciado, com boa qualidade e bonito."
24,5,Muito bom. Fácil instalação e ficou muito top. Com leds. Parabéns.
25,5,"Excelente produto, ótima qualidade, muito bem acabado, superou minhas expectativas. Recomendo."
26,5,Produto de boa qualidade melhor do que o esperado recomendo.
27,5,Produto excelente. Ilumina muito bem. Ficou lindo no meu muro.
28,5,Muito bom. Otimo produto. Exatamente como aparece na foto.
29,5,"Excelente. Compraria novamente. Está de parabéns, produto de qualidade."
30,5,"Produto excelente, tem uma ótima construção, aparenta ser resistente."
31,4,Bonita e fácil de instalar. Gostei do produto.
32,5,Muito bacana. Dá um efeito legal no jardim.
33,5,Perfeito! muito top! irei compra mais 4 unidades.
34,5,Ótimo produto!! ficaram lindas depois de instaladas!!! recomendo!!!.
35,5,Excelente produto. Bom preço e material de primeira.
36,5,Excelente!! produto de qualidade e baixo custo. Recomendo !!.
37,5,"Produto de ótima qualidade, recomendo a todos."
38,5,"Ainda não iinstalei, mas achei muito bonito."
39,5,"Amei! muito bonita e bem embalada. 
Recomendo."
40,5,Muito bom o produto ! recomendo a todos.
41,5,Excelente produto! ficou perfeito para minha necessidade.
42,5,Excelente. Ficou ótimo na sacada. Fácil instalação.
43,5,O produto atendeu a minha expectativa. Gostei.
44,5,"Excelente aquisicao, de acordo com as especificacoes."
45,5,"Arandelas lindas, ótima qualidade. Ficaram perfeitas."
46,5,"Produto de qualidade, dentro do esperado!!!."
47,5,Excelente! praticidade e visual muito bonito!.
48,4,"Gostei muito, atendeu as minhas expectativas."
49,5,Arandela linda e de otima qualidade!.
50,5,Material de qualidade e muito bonito.
51,5,Exatamente como na foto. Adorei.
52,5,Muito satisfeita! otimo custo beneficio.
53,5,Muito show! efeito maravilhoso! recomendo.
54,5,Tudo de bom!!! são lindas.
55,5,Produto completo e bem acabado.
56,5,Muito bom! produto de qualidade.
57,5,"Muito bom , elegante e delicada."
58,5,"Excelente, estou muito satisfeita!! recomendo."
59,5,"Bom produto, gostei e recomendo."
60,5,Otimo supreou minhas expectativas.
61,5,Recomendo muito boa recomendo.
62,5,"Produto excelente, recomendo!!!."
63,3,Senti falta dos parafusos de fixação para cx 4x2. Uma lâmpada já queimou.
64,5,Muito lindo. Produto mais bonito do que na foto.
65,5,Material e cor tudo do jeito que combinei.
66,4,"Estéticamente o pendente é bem bonito e com uma pintura bem resistente a riscos, o que deixa a desejar é a lâmpada que vem inclusa, ela tem 1w ou seja seu fluxo luminoso é quase invisivel, comprei outras lâmpadas de 7w e ai ficou show!."
67,5,"Ótimo produto, com pintura de qualidade e fácil de ser instalado. A luz também achei ótima. Comprei para colocar no quarto a cima da mesa de cabeceira e a luz tem uma cor confortável e ilumina muito bem! até regulei a altura da luz para nao ficar tão claro. Recomendo demais o produto, ainda mais pelo valor!."
68,5,"Elegantes e com ótima relação custo benefício. Antes de comprar, vi algumas avaliações relatando serem as lâmpadas muito fracas - as versões eram de 1w. A questão foi resolvida, agora, ao que parece, fornecem com 3,5w. São fáceis de montar e tem ajustes para que fiquem na altura perfeita."
69,3,"O produto e bom só ficou meio confuso quanto a descrição e a foto do produto!. 
A descrição e kit 2 pendentes e na foto são 3. Acho que pode alguém se enganar quanto isso aí!."
70,3,"Produto muito bonito e bem acabado. Comprei o preto, mas o cabo veio diferente da foto (não veio cabo de tecido). 
A luminosidade muito fraca, é só para decorar o ambiente mesmo."
71,5,Superou minhas expectativas. São lindos e de excelente qualidade! e é o melhor preço que encontrei. Vale muito a pena! não compre de lojas caras ou marcas caras! compre este!.
72,5,"Ainda não instalei os pendentes, mas gostei dos produtos, bonito, otimo acabamento e ja vieram com lampadas de leads."
73,5,Luminárias lindas e com ótimo custo benefício comparadas as que compramos em lojas físicas. Ótimo acabamento.
74,5,"Maravilhoso! ficou perfeito no meu banheiro. Material de excelente qualidade, acabamento e estética. Super recomendo."
75,5,"Ainda não instalei, mas veio tudo certo e ela é mais bonita pessoalmente."
76,5,Lindo  coloquei no minha cabeceira e ficou  show de tão lindo amei.
77,5,"Excelente produto,tanto na estética e quanto na facilidade de instalação."
78,5,Ótimo produto! comprei o preto e ficou bacana na varanda!.
79,5,Bom. De acordo com a imagem e com a descrição.
80,4,"Ainda não instalei, mas achei bom e bonito o produto."
81,3,"Produto ate bom, porem pedi uma cor e veio outra."
82,5,Ficou muito bom lindo adorei meu quarto ficou show.
83,3,"Bonito, mas a lâmpada não durou 3 meses."
84,5,"Maravilhoso e lindos, o fio é bem comprido."
85,5,Muito bom. Vale a pena comprar  ese peoduto6.
86,4,Produto bom! recomendo a compra. Bom custo benefício.
87,5,"Muito bonito, ficou perfeito no meu quarto."
88,4,Ótima qualidade e um preço super bom.
89,4,"Bom custo benefício, produto atendeu minha necessidade."
90,4,"Muito lindo,igualzinho como mostra a foto."
91,5,"Amei. Veio tudo encaixadinho, pronto para instalar!."
92,5,Produto muito bonito e com bom acabamento.
93,5,Muito satisfeito recomendo a todos produtos 100%.
94,5,Muito bonito e material de boa qualidade.
95,5,Luminárias muito bonitas e bem acabadas! recomendo!.
96,5,Delicado e muito bonito. Bom acabamento.
97,5,Tudo em perfeitas condições  amei parabéns.
98,5,"Produdo bem acabado ,. Indico a compra !!!."
99,5,Muito bonito e de boa qualidade.
100,5,Top. Ficou muito bonito na cozinha.
101,1,Não gostei parece um cano pintado.
102,5,Excelente produto atende perfeitamente como anunciado.
103,5,Muito bom. Ficou excelente no quarto.
104,5,Lindo e de excelente qualidade. Recomendo.
105,5,Produto de ótima qualidade recomendo.
106,5,Maravilhso!! valeu a pena comprar.
107,5,Produto de muito boa qualidade.
108,5,Produto excelente de ótima qualidade.
109,5,Bem enbalado pruduto conforme esperado.
110,5,Excelente produto. Tudo como esperado.
111,4,"Muito bom, recomendo o produto."
112,5,"Bonito, recomendo, fiquei satisfeito,."
113,5,"Bom custo benefício, fiz o teste ligando na parede e ficou muito bom."
114,5,Excelente! recomendo à todos!!!.
115,5,Cortina com um ótimo acabamento e material. Gostei muito da compra.
116,3,"Não é da mesma cor da foto, os detalhes são prata e não preto, porém qndo colocada e a luz apagada fica igual da imagem. Oque me decepcionou na compra foi a cor achei que fosse totalmente preta e escura como aparece na foto, porém o tecido é ótimo de ótima qualidade. 
Deixa o ambiente bem escuro e foi oq eu mais gostei, não troquei o produto pq iria dá muito trabalho."
117,5,"Comprei duas cortinas brancas para meus dois quartos e amei! são lindas! tecido maravilhoso, muito bonito. Comprei a medida de 4 metros e usei um varão de 2 metros e ficou bom."
118,3,Boa noite! a cortina é linda. Mas ñ cobre td a claridade d quarto! comprei errada só comprimento!  era pra ser curta mas td bm. Vou usar agora assim mesmo !.
119,5,"A cortina é muito bonita, material de qualidade, só gostaria que ela fosse um pouquinho mais grossa, não segura a luz, mas também não é translúcida. Vale a pena."
120,5,E linda amei bom material só achei q poderia ser mais grosso pra ficar mais escuro rs mais em geral e linda.
121,2,"Qualidade não é legal, estampa não é bonita como nas fotos e não escurece quase nada o ambiente."
122,5,"Produto conforme informado, material de ótima qualidade e escurece bem o ambiente, pois era essa a minha intenção."
123,5,Linda ! tecido muito bom não deixa transparente superou minhas expectativas. Amei minha cortina super recomendo.
124,5,Lindas cortinas material lindo e de otima qualidade! a branca é linda demais.
125,5,"Excelente cortina, acabamento perfeito eno design da estampa é muito lindo, super satisfeita."
126,4,Gostei ajuda bem com o vento que entra pela fresta da janela.
127,5,"Maravilhosa, amei minha compra. 
Comprarei mais, com certeza. 
Mercado livre sempre arrasando."
128,5,O produto e top fora que o material e de boa qualidade.
129,5,"Amei a cortina é linda deu certinho na minha sala, ficou linda."
130,5,"Gente, a cortina é linda! amei, vale muito a pena comprar!!!."
131,5,Muito boa. Estou pensando até em comprar outra para minha mãe.
132,4,"Muito linda,o tecido é muito transparente mais eu gostei."
133,5,Ótimo! da cor exata que eu queria! vale a pena!.
134,5,"Gostei muito da cortina,o tecido e de ótima qualidade."
135,5,"Excelente cortina, vale a pena comprar, vem exatamente com descrito."
136,5,"Linda, material e acabamento bons, escurece bem. Muito satisfeita! ????."
137,5,"Minha esposa gostou muito da cortina, recomendo a todos."
138,5,"Cortina muito bonita! ficou perfeita na minha sala, recomendo!."
139,5,Produto lindo! de ótima qualidade. Vou comprar  outra.
140,5,Linda maravilhosa amei vou comprar outra parabéns.
141,5,"Linda,linda. De excelente qualidade. Super recomendo."
142,4,Produto de boa qualidade. Superou a expectativa.
143,5,Adorei a cor o material tudo perfeito.
144,4,"Achei bonita, combinou com minha sala."
145,5,Tecido e acabamento muito boa qualidade.
146,5,"Produto maravilhoso, recomendo material bem resistente."
147,4,"Produto muito bom, atendeu minha  necessidade."
148,5,Amei. Muito bom o tecido. Excelente!!!.
149,5,Otimo valeu apena comprar com voçes.
150,5,Muito boa qualidade!!!! gostei bastante!!!.
151,5,"Tecido excelente, indico a compra."
152,5,"Perfeita, melhor que imaginava, linda!."
153,5,"Produto excelente, material de qualidade."
154,5,"Ótima qualidade, adorei o produto."
155,5,Ótimo produto superou minhas espectativa.
156,5,Excelente !! ótimoo produto! recomendo.
157,5,"Excelente,bonita , qualidade superior."
158,5,"Maravilhosa, superou minhas expectativas."
159,5,"Excelente produto, muito bonita."
160,5,"Lindo! apenas para enfeitar , porque não corta nem 30% da luz. Mas é um produto de qualidade. Ameiiiiiiiiiiii muitooooooo."
161,5,"Lindooo! amei! acabamento lindo, recomendo a todos! material excelente!."
162,5,"Espetacular, acabamento perfeito. Tudo perfeito!. Super recomendo!."
163,5,"Muito boa compra ,muito satisfeita!."
164,5,Linda! adorei. Recomendo à todos.
165,5,"Produto bonito que cumpre o que promete, veio com um pequeno machucado na madeira mas nada que comprometesse."
166,5,"Muito bom o acabamento e estilo, pelo valor vale muito a pena. Recomendo."
167,4,"Produto bom, a lampada é show ficou muito bonito o ambiente gostei."
168,5,Lindo e muito bem acabado!! a lampada tbm é linda! muito satisfeita.
169,5,"Lindo pendente, de ótima qualidade e por um preço incrível! super recomendo."
170,5,O produto é bem contemporâneo e deixou o ambiente muito acolhedor.
171,5,"Produto lindo e enorme, a lâmpada é maravilhosa e gigantesca. Recomendo."
172,5,O produto é muito lindo e de ótima qualidade.
173,5,Adorei o pendente superou todas as minhas expectativas.
174,5,"Muito bom, elegante. Gostei do produto. Super recomendo."
175,3,"Produto bom, mas veio um pouco tordo."
176,5,"Boa iluminária, porém um pouco frágil."
177,5,Muito bonito e de boa qualidade!.
178,5,Produto como descrito. Pode confiar!.
179,5,"Maravilhoso ,muito bonito ,adorei."
180,5,Muito linda. Recomendo. Show.
181,5,"Produto de qualidade , recomendo!."
182,5,Topissimo ! muito bonito !.
183,5,Perfeito !!! cortinas maravilhosas de ótima qualidade cobre 100% a luminosidade amei tudo. Os tapetes são lindos e de boa qualidade. Cortinas são de um tecido ótimo estão de parabéns!!.
184,2,"O tecido da cortina não bloqueia 100%, mas ja ajuda bastante. Porém o acabamento deixa totalmente a desejar, não tem bainha nas cortinas, apenas costura overlock para não desfiar. Se não fosse por esse detalhe ganharia 5 estrelas. Mas a falta de acabamento empobrece o produto."
185,1,"Cortina não é blecaute, e apenas tecido costurado encima de tecido, ainda veio sujo. 
Ainda dei a oportunidade achando que talvez o quarto fosse ficar escuro de dia rs rs. 
Só rindo. Meu quarto clareou todo assim que o dia amanheceu. 
E a parte que desliza na vara seria de cor prata, veio quase todos descascados. 
Literalmente não vale pagar 140,00, pela qualidade do produto que se diz blecaute e não é, e fora a parte descascada e suja. 
Insatisfeita é pouco !. 
Ainda terei que comprar o blecaute pra colocar na cortina e mandar pra costureira pra não ser 100% do meu dinheiro jogado no lixo."
186,5,"Se você está indo pelas reclamações aqui vai:. 
A cortina é sim de ótima qualidade, porém, não é para pessoas chatas, perfeccionistas que veem qualquer probleminha e reclamam. Sim ela é blackout, porém eu comprei a cor preta, se escolher outra cor saiba que quanto mais clara a cortina, menos retenção de iluminação ela terá, isso é normal. E a cima de tudo, olhe o preço, se quer algo bom e maravilhoso invista em algo mais caro e não procure coisas baratas achando que vai achar milagre. 
Comprei e não me arrependo, achei linda e irei comprar mais para por em todas as janelas da casa."
187,4,"A cortina é relativamente decente, queria que tivesse uma cor mais branca, a opção de branco gelo é mais próximo de cinza do que branco. Não bloqueia 100% como descrito mas deixa o ambiente escuro e remove o reflexo da tv, então já me atende. Não entendi a parte em que falaram ser duas folhas, não vi isso, só tem um tecido mesmo, mas pelo menos não é de plástico. Sobre o tapete de brinde é bem feinho, são vários tecidos de várias cores nada a ver, não gostei rs."
188,4,"Prós - tecido de boa qualidade, fiquei com receio por conta dos comentários mas comprei assim mesmo, se não prestasse eu devolveria. Pra minha surpresa o produto é bom, tecido resistente e grosso, ilhós reforçado e bloqueia aproximadamente 99% isso pq aqui o sol bate de frente, então fica uma leve claridade quase imperceptível. 
Contra - o tecido não parece ter 3m de largura, a impressão é que a medida da largura tá uns 30 cm a menos, mas serviu pra mim pq cobre a porta. 
Resumindo, ótimo custo benefício."
189,1,"O tamanho não veio de acordo com o que pedi, veio bem menor. A costura é grosseira, mal acabada e com o tecido franzido pela mal costura. O tecido é gostoso, macio. Não testei em questão de claridade pq a decepção foi grande demais. Paguei caro pra uma porcaria. Não indico! é bom ver todos os comentários antes de comprar. Pensei em comprar uma cortina pronta, mas se soubesse que viria uma porcaria dessa eu mesma teria feito."
190,4,"Ótimo produto, o tapete é bastante útil também. Só a altura que é menor do que informada. Talvez seja 2,5 m de altura o todo o tecido em si. Mas com a dobra onde fica os ilhoes, ele fica menor que 2,5. Precisei baixar o varão para poder ajustar a cortina no chão. A minha outra tinha 2,5m exatos e ficava do piso ao teto como eu sempre quis."
191,5,"Excelente produto! sinceramente, eu levo muito em consideração os comentários antes de comprar pela internet, e ultimamente minhas compras tem sido todas pela internet. Esse produto tem comentários bons e ruins, comprei com um pé atrás,  porque pela descrição me pareceu um produto bom. Eu particularmente não tive problema nenhum, pelo contrário,  achei perfeito o produto e com certeza comprarei mais dele assim que possível. Muito linda, excelente acabamento, excelente tecido."
192,3,"Mediano. Pelo menos as cores claras não impedem a passagem da luz. Mesmo o tecido sendo grossinho, não é forrado e o ambiente fica pouca coisa mais escuro. E não sei se é porque apenas a minha veio com defeito, mas uma folha é maior em largura que a outra. Uma tem oito ilhós e a outra sete. Ficou um pouco desregulada no varão. Mas é bonitinha."
193,2,"Não bloqueia nem perto de 100%. Eu diria uns 40%. Ainda fica muito muito claro com ela. Cortina é até que bonita mas tem uma risca no bem no meio, não é costura, parece ser um defeito do tecido. Só fiquei com ela pois coloquei as duas partes uma na frente da outra pois minha janela é estreita. Assim deu pra tampar a claridade um pouco mais."
194,3,"A cortina de forma nenhuma é blackout pois ela não bloqueia a luz totalmente. O acabamento não é muito bom. É básica, simples e só. Ainda bem que tinha uma cortina blackout menor na minha janela e só usei essa apenas para completar a parede toda. Quem realmente está procurando uma cortina blackout para bloquear a luz não indico de forma nenhuma comprar essa."
195,3,"O produto legal da pra usar mas nao veio como pedi o tamanho veio muito grande isso que pesquiswi muito antes de efetiar a compra. A largura nao parecer ter o que ta na descricao e o tamanho bem maior que a descricao entao o gasto pra arrumar. E pra devolver tem toda uma demora. Mas enfin. 
Nao foi o que eu esperava."
196,5,"Lindo de maravilhoso, porem se vc procura algo blackout nao compre cores claras, o tecido é bem grosso e muito bom porem ele nao tem akele plastico(oq particularmente eu amei) porem se comprar de tons escuros como o cinza ele fica lindo e escurece totalmente a casa, isso deixa a cortina leve e facil de lavar sem aquele plastico chato. Eu amei??."
197,5,"B noite a cortina não tive problema algum, mas gostaria de deixar minha insatisfação referente ao brinde que informaram. Gente o que realmente é aquilo? fiquei a olhar sem entender ou meio que sem acreditar que se tratava de um tapete, e por mais um tapete se assim posso falar de péssima qualidade. Super sem gosto algum, enfim deixo aqui minha insatisfação."
198,3,"A qualidade do tecido é boa, bloqueia bem a entrada de luz pela janela. Existem alguns pontos negativos:. 
. 
- a largura das cortinas juntas deveria ser de 3 metros, porém falta 8 centímetros em cada, totalizando a diferença de 16 centímetros, ou seja, 2,84 metros, infelizmente só descobri isso depois de ter feito a barra da cortina;. 
- os ilhoses se desencaixam."
199,5,"A principio fiquei com medo por ver varios tipos de comentarios de todas as formas. (varios ruins). 
Nunca julguem o livro pela capa !. 
Ao chegar me surpreendi com o produto. Principalmente pelo valor e qualidade. 
Comprei a cor cinza , bloqueia sim a luz solar. Fiquei extremamente satisfeita. Podem comprar sem medo. Custo x beneficio ta de parabens !."
200,2,"O produto veio cheio de falhas, como se tivesse passado a costura no tecido e depois removido. Veio cheia de buracos. Parece que no final da fabricacao nao tem ninguem pra olhar se esta tudo nos conformes, ou ate mesmo antes de fabricar, seria interessante dar um confere no tecido pra ver se esta tudo ok."
201,1,"Não é blackout como diz a descrição! comprei a cortina por dizer ser blackout. Se soubesse que não tem absolutamente nada de blackout, teria comprado uma cortina pela beleza e não pelo propósito de cortar luz!. 
Não vou devolver somente pelo trabalho. Não recomendo para quem quer cortar a luz do ambiente! ela nao faz isso!."
202,2,"A cortina é bonita, gostei do tecido, mas blecaute 100% como está  na descrição do produto não tem!. 
Se você gosta do ambiente bem escuro, não vai aprovar esse ""blecaute"" aí não!. 
O sol nasce clareia o ambiente todo. 
Vou precisar comprar um blecaute para por atrás para eu não perder a cortina."
203,2,"A cortina super linda. Realmente bloqueia a claridade. Excelente qualidade, porém a minha veio com um defeito. Fio puxado bem no meio de uma das partes. Não é tão aparente, só se olhar bem. Então, como estou com preguiça de devolver e esperar mais um tempo para a troca. Ficarei com essa mesmo."
204,2,A cortina e bonita! so que falar que bloqueia a luz e uma palhacada! ela e bem dizer um pano que passa qualquer luz! se voce quer comprar por beleza ok! pelo preco que paga ela nao e de otima qualidade porem fica bonita! mas nao tem nada de bloqueio de luz.
205,5,"Produto bom, blackout 90% cumpre exatamente o que propõe, veio com um fiozinho puxado mas nada demais deu pra arrumar. Eu vou precisar fazer a barra, por causa da altura do meu varao, mas do contrario o acabamento esta ok!. 
E um tapetinho de tecido muito fofinho! produto honesto pelo valor!."
206,4,"Pontos positivo - bonita e confeccionada com tecido de boa qualidade, proporciona inclusive redução de ruído externo. 
Ponto negativo - o acabamento na bainha de uma das partes, não acompanha o nível da bainha do outro lado, deixando a desejar se for instalada em uma sala, por exemplo, ou seja, pecou no acabamento."
207,5,"Ótima qualidade adorei !! blackout 90% conforme a  descrição, tecido muito bom, acabamento simples na barra, mas como ficou grande vou ter qe leva para cortar aí refaço a barra. Comprei na cor tabaco, minha sacada ficou bem escura. E o tapete de brinde muito bom, reforçado por ser um brinde!."
208,1,"Péssimo material,a cortina apresenta defeitos e com fios soltando e desfiada no meio,para completar  a medida q pedi veio maior,inventei de cortar para poder usar e para minha surpresa,ela desfiou todinha,isso mesmo antes de começar a fazer a barra,infelizmente joguei meu dinheiro fora."
209,1,"Cortina muito bonita. Gostei do tecido. Mas as argolas onde se passa o varão são muito frágeis e ela não é blackout. Troquei a minha cortina por essa justamente por dizer que era blackout. Obs. : não compre essa cortina se precisarem de um blackout, vao passar raiva."
210,1,"A qualidade do blackout deve ser bem inferior, pois a claridade do dia deixa evidente defeitos do tecido, olhando parece que veio com furos, mas são pontos e linhas continuas que passa a luz, que passa a claridade que deveria bloquear. Tenho fotos, como faço para enviar?."
211,3,"Qualidade tecido boa , mais não é blackout como fala na descrição , protege uns 70 por cento da luz solar. 
Eu estava esperando uma proteção de 100 % como fala na descrição, tive que levar costureira e colocar mais um tecido como forro para ficar como eu esperava."
212,4,"O tecido é excelente, macio e fluido, porém não corta a luz 100%, o que não foi um problema, pois comprei para sala. Diria que ela corta uns 75% da luz. O acabamento não é perfeito, mas no geral, achei linda e compraria novamente, sem dúvidas."
213,4,"Cumpre o que promete. Não bloqueia completamente o sol, mas deixa o ambiente escurinho o suficiente para ficar confortável. Dá para assistir tv sem medo de reflexo, por exemplo. No entanto, as barras são um pouco mal feitas (tortas) e a minha cortina veio com sujeiras."
