,score,comment
1702,5,"Produdo bem acabado ,. Indico a compra !!!."
1703,5,Muito bonito e de boa qualidade.
1704,5,Top. Ficou muito bonito na cozinha.
1705,1,Não gostei parece um cano pintado.
1706,5,Excelente produto atende perfeitamente como anunciado.
1707,5,Muito bom. Ficou excelente no quarto.
1708,5,Lindo e de excelente qualidade. Recomendo.
1709,5,Produto de ótima qualidade recomendo.
1710,5,Maravilhso!! valeu a pena comprar.
1711,5,Produto de muito boa qualidade.
1712,5,Produto excelente de ótima qualidade.
1713,5,Bem enbalado pruduto conforme esperado.
1714,5,Excelente produto. Tudo como esperado.
1715,4,"Muito bom, recomendo o produto."
1716,5,"Bonito, recomendo, fiquei satisfeito,."
1717,5,"As almofadas são lindas! achei que pudessem ser pequenas, mas não são. São grandes e bem cheias e as cores bem vivas. Superou minhas expectativas!."
1718,4,"Como o esperado, são bonitos ornamentos para quartos ou salas. A almofada é maior do que pensava, cores exatamente como nas fotos. Uma veio levemente maior que a outra e desfiam um pouco, mas por causa do tecido utilizado, nada demais. Estou bem satisfeita."
1719,4,"São bem pequenas achei q era maior, mas mesmo assim são bonitas e bem feitas não dei 5 estrelas pq uma delas veio suja aí tô tentando achar uma maneira de levá-la. Não tenho idéia de como levar uma almofada dessas."
1720,4,"Solicitei uma rosa é uma preta, são iguais as fotos, só o tecido que não é muito bom a preta já veio soltando pelinhos do tecido mesmo, parece que já estava um pouco velha. A rosa estava perfeita."
1721,3,"Eu gostei do produto, porém conforme o uso , vai saindo os fios que foi usado pra encher ele e quanto mais usa mais sai a minha por exemplo já está cheia de fios brancos aparecendo."
1722,4,"Gostei, porém não é forrada aí fica saindo frepa do enchimento ,mais fora isso é macia e deixa bem arrumado o local ,só deviam ver isso e botar um forró antes da malha."
1723,1,Produto muito inferior a foto! comprei duas almofadas e uma é muito menor q a outra. Ambas vieram com costuras abertas e soltam linhas pelo tecido. O preço não vale a pena.
1724,5,"As almofadas são lindas, tem um tamanho bom , são bem acabadas , o único ponto negativo é que o enchimento fica com algumas fibras soltando , mais de reto recomendo a todos."
1725,4,"Muito bonita, exatamente como as fotos/descrição. 
Único ponto é que depois de alguns dias começou a soltar/aparecer uns fios através do tecido, como já foi comentado."
1726,5,"Nossa ,eu amei muito bem feito e de qualidades a malha e boa,podem comprar sem medo, vi alguns comentários  negativos mas são pessoas complicadas mesmo."
1727,5,Essa almofada nó ao vivo eh bem mais bonita e um excelente tecido. É grande e não esperava tão linda assim. Perfeita. Amei e super indico.
1728,5,"Amei amei! são lindas as cores, peguei a cinza claro e a pink, já quero comprar mais! são bem firmes e o tecido bem costurado. ;)."
1729,3,O produto é menor do que eu achei que fosse e eu pedi a cor palha mas veio branco. No mais é um bom produto.
1730,5,"Uma graça! pelo valor, não esperava muita qualidade, mas, são super bem feitas e num tamanho ótimo. Pretendo comprar mais cores no futuro. :)."
1731,5,"Estou apaixonada! qualidade excepcional, as cores ao vivo são ainda mais bonitas, tecido muito bom, adorei! com certeza vou comprar mais cores!."
1732,4,"Gostei bastante,cor linda,porém agora está saindo a fibra pelo tecido, isso que só fica de decoração em cima da cama."
1733,5,"Excelente eu amei, são lindas bom acabamento as cores lindas, vieram certinhas as cores que pedi amei msm vou comprar mais."
1734,1,"O tecido da almofada é tão fino que o enchimento fica saindo, isso em menos de uma semana de uso."
1735,5,As almofadas são lindas. Perfeitas! muito bem embaladas! podem comprar sem medo. Ficou lindas na minha cama. Estão de parabéns!.
1736,5,Estou apaixonada e vou efetuar nova compra. Elas são lindas e bem maiores do que as que já vi. Parabéns.
1737,1,Muito pequeno achei que seria mesmo uma almofada mais não da é muito pequeno e não vale o valor cobrado.
1738,5,"A rosa bebê é linda, são um charme pra decoração da cama, poltrona ou sofá. Quero todas as cores, amei!."
1739,5,"Produto muito lindo, ficou perfeito no quarto dos meus filhos, comprei uma rosa e uma azul, igual as imagens!."
1740,5,"Muito lindas, maior que o esperado,só fica saindo ums pelinhos do enchimento,fora isso são perfeitas,eu amei."
1741,5,"Gostei do produto , preço e benefício , não é um tecido nossa que ótimo , porém é bom , curti e indico."
1742,5,"Adorei, achei que fosse menor, porém surpreendeu minhas expectativas, compraria de novo sim e indico tbém! edilma pereira."
1743,5,"Amei as minhas almofadas de nó, cores vivas e acabamento perfeito. Estou muito feliz com a minha compra."
1744,5,Excelente material e cor de acordo com a imagem do produto. Boa costura. Ótima para decorar ambientes.
1745,5,Adorei era o que eu esperava. O material é muito bom e os nós vem bem cheios.
1746,5,Adorei produto bom de qualidade recomendo a quem quiser comprar pode comprar sem medo de ser feliz.
1747,5,"Resistente e de qualidade, cheia de charme e combinou muito com a decoração do meu quarto!."
1748,5,Sao lindas achei ate que iam ser menores sao grandes eu amei sao de otima qualidade.
1749,5,"Achei que era um pouco maior, mas mesmo assim elas não deixam de ser lindas. Recomendo."
1750,5,"Eu amei as almofadas, superou minhas expectativas, são grandes e lindas, parabéns pela qualidade do produto."
1751,4,Muito bom mas e muito pequeno  mas gostei vou compra mas espero que venha melhor.
1752,5,Cor perfeita tamanho também perfeito não é uma almofada dura amei vou faltar a comprar.
1753,5,"Nunca vi outro igual, que perfeicao gente, recomendo de versade, vou comprar mais com certeza."
1754,5,"Produto de ótima qualidade, super macio, super gostoso, a cor condiz com a foto. Recomendo!."
1755,4,"Boa qualidade, são de malha ,não muito grande , a cor não é viva gostei."
1756,5,"Ameiiiiiii, super indico, elas são lindas e perfeitas, com certeza voltarei a comprar. Obrigada."
1757,4,"É um pouco menor do que imaginei mas cumpre a proposta. 
. 
Embelezou meu sofá."
1758,5,"Comprei a vinho, sao lindas ! o pano é bem fofinho e tem otimo acabamento."
1759,5,"Eu amei as almofadas,são lindas e bem acabadas! deixaram meu ambiente um charme."
1760,5,Produto muito bom e bem feito! atendeu as expectativas. Tamanho certo e tecido macio.
1761,5,"Produto maravilhoso. De ótima qualidade e cor bem viva !. 
Amei muito e super indico."
1762,5,"As almofadas são uma graça, muito bonitas! o tecido junta pelinhos, mas nada demais."
1763,5,"Linda. Super moderna, uso em varios ambientes da casa, quarto sala e escritorio."
1764,5,"Gostei muito do produto. Do tamanho imaginado, cores perfeitas, qualidade ótima! gostei bastante!."
1765,5,"Simplesmente perfeitas. As almofadas são lindas, e mto bem acabadas. Recomendo. 
Com certeza!."
1766,5,"E muito lindo, as cores muito vivas, comprei azul royal e amarelo, amei."
1767,1,"Produto de ma qualidade,pelo valor tinha que ser maior,costuras mal feita."
1768,4,"Só não gostei do tecido,mas o acabamento e o produto vieram corretamente."
1769,5,"Incrivel a qualidade e acabamento. Excelente almofada, adoramos, combinou muito com nosso espaço."
1770,5,"Lindas!!! perfeitas, cores maravilhosas, muito macias, tamanho ideal, bem cheinhas. Me surpreendeu, adorei!."
1771,5,"Adorei a almofada, o tamanho é ótimo, logo mais comprarei outras cores."
1772,4,"O material e o tamanho é bom, porem mandaram a cor errada."
1773,5,Lindas. Perfeitas. Gostei tanto que comprei mais pra enfeitar o meu atelier.
1774,5,Lindas! gotei muito. Voltarei a comprar. A decoração fica muito bonita. Recomendo!!.
1775,5,"Lindas! otimo tecido, enchimento muito macio! super recomendo! quero todas as cores."
1776,5,São lindas! amei perfeita pode comprar sem medo tamanho e material excelente.
1777,5,São lindass e bem maiores que eu esperava material também muito bom.
1778,5,O produto é ótimo! as almofadas são lindas e de muita qualidade!.
1779,5,"Gostei bastante,a qualidade do tecido me surpreendeu. Super indico a loja."
1780,5,"Maravilhoso! estou aoaixonada, o tamanho é ótimo! com certeza comprarei mais vezes."
1781,5,"Super indico ótimo tamanho ,as cores são lindas são bem feitas."
1782,5,"Gostei muito, são lindas,bem feitas,ficaram belíssimas na minha cama."
1783,5,As almofadas são lindas grandes me  surpreendi muito bem feitas amei!.
1784,5,"Amei, produto de otima qualidade. Super indico! só demorou pra chegar."
1785,5,"Linda, perfeita! superou minhas expectativas vai dar um charme no quarto!."
1786,5,"Ótima qualidade, além de decorar a casa, é ótimo para relaxar!."
1787,5,"Eu amei muito  lindas superou minhas expectativas, depois vou comprar mais."
1788,5,As almofadas são perfeitas! gostei tanto que até comprei mais duas!.
1789,5,"Lindo amei do jeito que eu vi na foto, super apaixonada."
1790,5,Eu amei o material em de boa qualidade em maravilhoso.
1791,5,"Amei ""são muito lindas. 
São grande e de ótima qualidade."
1792,5,"Tecido de boa qualidade ,cores vibrantes,fiz uma  ótima compra."
1793,5,Amei as almofadas. Bem feitas e o tamanho muito bom.
1794,5,Amei do jeito que eu queria ameii demais obrigada i.
1795,5,"Muito bonitas e elegantes, dar um toque especial na decoração."
1796,5,"Produto maravilhoso, exatamente como na descrição!. 
Indico de olhos fechados!."
1797,5,"Adorei minhas almofadas de nó chegaram antes do previsto. 
Lindas."
1798,3,Bonita. Só  pequena e fica soltando um pouco o enchimento.
1799,5,Muito bem feito e bonito. Super moderno! superou minha expectativa.
1800,5,"Eu amei as almofadas, elas são ótimas. De super qualidade."
1801,4,Gostei são muito bonitas só podia ser um pouco maior.
1802,5,"Lindo. As cores sao bem vivas, bem feitas. Otimo acabamento."
1803,5,"Ótimo e ótima qualidade, sanou muito o que eu precisava."
1804,5,Foi um presente para minha amiga  ela  amou  são lindas.
1805,5,"Ótimas! são lindas eu amei, podem comprar vale a pena."
1806,4,"Tudo certo com o produto. Verificar tecido, nao é suede."
1807,5,Excelente. Superou minhas expectativas. São lindas e com muita qualidade.
1808,4,"Adorei! super indicou, o tamanho e bom! o material tbm!."
1809,5,"Produto de boa qualidade, o preço vale a pena."
1810,5,"Mais lindo que na imagem, super qualidade, recomendo muito!."
1811,5,"Super recomendo, perfeito de tamanho e as cores lindaa."
1812,5,Lindas! amei! ficaram lindas na minha decoração do quarto!.
1813,5,"Amei muito, tem o tamanho ideal é muito macia."
1814,5,"Lindas! material excelente, cores lindas, exatamente como eu imaginava!."
1815,5,"Amei as almofadas,são lindas. Superou minhas expectativas. Obrigada!."
1816,5,"São lindas, minha esposa adorou, produto atendi muito bem."
1817,5,E linda tamanho ótimo. Eu recomendo para um amigo.
1818,5,"Liindass!!!ameeiii!!! cores delicadas como eu queria, me apaixonei !!!."
1819,5,"Amei, são lindas como na foto, eu estou apaixonada."
1820,3,Bem simples. Tamanho médio pro pequeno. Dar um charminho.
1821,5,"As almofadas são ótimas, macias e bem feitas! adorei *-*."
1822,5,Almofadas de nó bem feita. Comprarei mais um  kit.
1823,5,"Muito lindas,superou as expectativas,logo comprarei outras cores."
1824,5,"São lindíssimas, eu amei!. 
Recomendo a todos do ml."
1825,5,"Muito lindas, fofinhas, bem macias do jeito que queria."
1826,5,Amei as almofadas com certeza irei comprar mais! recomendo.
1827,5,"Gostei bastante, ficou super lindo na minha cama, recomendo!!."
1828,4,Simplesmente amei essa almofada exatamente como está na foto.
1829,5,Lindas igualzinha da foto amei vou pegar mais cores.
1830,5,Adorei! super bem feito. Superou minhas expectativas. Muito obrigada!.
1831,5,"Perfeitas, bom custo benefício, ótimas para decoração, são fofas."
1832,3,"Não gostei do tecido. 
Achei q ele fosse sued."
1833,4,"Produto de qualidade, preco em conta. Vale a pena."
1834,5,"Amei minhas almofadas, acabamento e qualidade do material perfeitos!!!."
1835,5,Melhor preço que encontrei e produto exatamente como descrito.
1836,5,Muito lindas anciosa para usar no. Meu quarto novo ????????.
1837,5,"Lindas, como nas fotos, vem bem embaladas, uma graça!."
1838,5,Lindo amei suoer recomendo  igual ao da foto amei.
1839,5,Amei o produto superou minhas expectativa. Super indico top.
1840,5,"Almofadas são iguais as da imagem,  são de qualidade."
1841,4,Eu amei as almofadas são lindas e grandes.
1842,5,"Lindas, cores vibrantes e produto mt bem acabado!."
1843,5,"Lindo, tamanho top, amei??. 
Minhas filhas estão apaixonadas."
1844,5,"Muito bom, realmente o que é na foto."
1845,5,Bonitas e fofas! recomendo! são como as fotos!.
1846,5,"Muito boa, macia e o tamanho é perfeito!."
1847,5,Muito bom produto muito lindo recomendo a todos.
1848,5,Lindas e bem feita e grande eu amei.
1849,5,Amei as almofadas são lindas e de qualidade ??.
1850,5,Sao lindas! eu amei muito. Comprem sem medo!!!.
1851,5,"Muito lindas, material ótimo super confortável  ,enfim amei."
1852,4,"É bem grande, tecido macio! muito ljnda mesmo!."
1853,5,Me surpreendeu. Me apaixonei e vou comprar mais.
1854,5,"Gostei muito, bastante diferente ficou bonito no sofá."
1855,5,Amei  as almofadas são lindas e boas recomendo.
1856,5,Eu amei são lindas e grade super índico.
1857,5,Gostei bastante. Deram um charme no meu quarto!!!.
1858,5,Lindas de mais. Eu amei as minhas almofadas.
1859,5,Lindas e a cor é igual do anunciado.
1860,5,"São lindas ,gostei é tem um tamanho bom."
1861,1,Pq veio a cor errada!!!!! não fiquei satisfeita.
1862,5,"Lindas, fofas, macias, perfeitas e chegaram super rapido!!."
1863,4,Produto de boa qualidade. Bom custo x benefício.
1864,5,São lindas e dão um charme no ambiente.
1865,5,Bem lindoo almofadas qualidade boa só achei pequena.
1866,5,"As almofadas nó são lindas, recomendo a compra."
1867,5,Sao lindas amei vou comprar mais!super recomendo.
1868,5,"Gostei muito, igual a foto! minha sobrinha amou!."
1869,5,"Muito bom, atendeu a todas as minhas expectativas!."
1870,4,Veio na data prevista e em boas condições!.
1871,5,Lindas e de qualidade com um preço ótimo.
1872,5,Linda demais adorei depois vou comprar outra.
1873,5,Otima qualidade tamanho conforme anunciado super indico.
1874,5,"Produto de excelente qualidade, amei super indico."
1875,5,"São lindas e grandes. 
De excelente qualidade."
1876,5,Produto maravilhoso! vou comprar mais com certeza.
1877,5,Perfeito bem acabadinho excelente qualidade super recomendo.
1878,5,"Tamanho bom, material bom, ótimo acabamento. Perfeito."
1879,5,Lindos e cores bem vivas. Super reforçado.
1880,5,É linda demais!  voltarei a comprar mais!!.
1881,5,"Produto excelente, grande e com acabamento perfeito."
1882,4,"Gostei bastante, satisfeita com a minha compra."
1883,5,Ótimo lindas veio do jeitinho que esperava! ??.
1884,5,Qualidade excelente. Só gostaria que fossem maiores.
1885,5,"Perfeitas. 
Super charme no ambiente!!!. 
Comprarei novamente."
1886,5,"Lindas e bem acabadas, meu filho adorou!."
1887,5,Produto de ótima qualidade e tamanho ideal.
1888,5,"Produto muito bom , lindo amei, material bom."
1889,5,"Lindas,  ficaram ótimas na cama , uma graça."
1890,5,"Superou minhas expectativas, super recomendo. São lindas."
1891,5,Maravilhosas! adoramos. Mais bonita que a foto.
1892,5,Gnt comprem é mto linda eu amei!!!.
1893,5,"Excelente produto, tamanho ideal e material ótimo."
1894,5,Gostei muito! com certeza voltarei a comprar!.
1895,5,Gostei são bonitas pretendo comprar mais cores.
1896,5,É lindo! bem como a foto! amei!!!!!!.
1897,5,São lindas e grandes. Ótimo custo/benefício.
1898,5,"Perfeita,porém vieram sujar mais tá valendo."
1899,5,"Lindo simplesmente amei ,podem comprar sem medo."
1900,5,Nó bonito e fofinho! indico o produto!.
1901,5,"Perfeitas , maior q e lu esperava,amei."
1902,5,"Adorei!!! produto de qualidade, superou minha expectativa!!!."
1903,5,Bom. Gostei bem como está na foto.
1904,5,"Produto lindo e de qualidade, super adorei."
1905,5,Amei minhas almofadas já tobquerendo pedi mais.
1906,5,Lindo recomendo a todos vcs pode compra.
1907,5,"Amei!!!. 
Comprei 4 e vou comprar mais."
1908,5,"Produto muito bom, de boa qualidade, atendey."
1909,5,"Amei são lindas as almofadas, estou feliz."
1910,5,Lindas amei exatamente o que eu esperava.
1911,5,Produto maravilhoso excelente acabamento perfeito super recomendo.
1912,5,"Adorei, são lindas, feitas com muito capricho."
1913,5,Adorei. Tamanho ótimo e cor super viva.
1914,5,As almofadas são lindas e bem feitas.
1915,5,Ótimo produto excelente vendendor recomendo a todos.
1916,5,Lindas otimo produto  adorei voltarei compra.
1917,5,"Produto lindo, muito bem confeccionado!! adorei ????."
1918,5,São lindas as almofadas. Ótima qualidade.
1919,5,Produto bom e  de ótima qualidade.
1920,5,"Super lindas e macias, gostei muito."
1921,5,"Maravilhosoooo, amamos! sao enormes e lindas."
1922,5,"Lindas e material de qualidade, recomendo!."
1923,5,"Ameii, lindas ,não tenho oque reclamar."
1924,5,Amei! simplesmente amei e me apaixonei!.
1925,5,"Lindo igual ao mencionado, super indico."
1926,4,Adorei!!! lindas! exatamente como na foto.
1927,5,Amei! lindo demais! muito bem acabado!.
1928,5,Lindas! ótima qualidade! super bem feitas.
1929,5,Perfeitas e lindas! comprem sem medo.
1930,5,Produto bonito e confortável. Super recomendo.
1931,5,Excelente almofada bem macia ficou linda.
1932,5,Excelente produto com ótimo custo benefício!.
1933,5,"Lindas amei perfeitas ,produto boa qualidade."
1934,5,"Bem feitinho, excelente acabamento, uma fofura."
1935,5,"Lindas, exatamente como nas fotos. Indico!!."
1936,5,"Lindas,perfeitas estou apaixonada,hiper recomendo."
1937,5,"Lindas, super indico,  são bem feitas."
1938,5,"Otima almofada , lindas e macias , recomendo."
1939,5,Lindas almofadas! com qualidade na costura.
1940,5,"Adoreiii, material muito bom, tamanho exelente."
1941,4,Amei minha compra. Elas são lindas.
1942,5,São lindas. Cores vivas. Bem feitas!.
1943,5,"Almofadas maravilhosas, vou até comprar mais."
1944,5,"São lindas e super fofas,recomendo."
1945,5,Exatamente como na foto. Umas gracinhas.
1946,5,"Amei minhas almofadas. Macias ,lindas d+."
1947,5,Almofadas lindas! valeu muito a pena!.
1948,5,Maravilhoso!!!! lindas almofadas igual a foto.
1949,5,Produto lindo e de otima qualidade.
1950,5,"Bom produto, tudo conforme o anunciado."
1951,5,Lindas! adorei. Produto de boa qualidade.
1952,3,Bom mas achei que fossem maiores.
1953,5,Excelente acabamento perfeito amei super recomento.
1954,5,Incrivel! essa almofada é um charme.
1955,5,"Maravilhosa! muito bem feita, e grande!."
1956,5,"Muito bom, atendeu as minhas expectativas."
1957,5,"Bonito, bem feito, lindas cores."
1958,5,"Muito boa a almofada , recomendo."
1959,5,"Iguais da foto, almofadas lindas."
1960,5,Maravilhoso  demais deus  que abençoe.
1961,5,"Maravilhosa, encantada, irei comprar mais ??."
1962,5,Lindos as crianças  amou recomendo.
1963,5,"Ótima qualidade,lindas,cores vivas."
1964,5,Amei sao lindas  acabamentos  perfeito.
1965,5,Produto muito bacana e bonito!.
1966,5,"Qualidade indiscutível, arrojado e estiloso."
1967,5,"Almofadas lindíssimas, super da moda."
1968,5,Adorei a almofada. Lindas cores.
1969,4,Boa qualidade gostei do produto.
1970,5,"Lindas e grandes amei. 
Perfeitas."
1971,5,Aiii ameiii mega lindo recomendo.
1972,5,Muito lindo! valeu cada cebtavo.
1973,5,Muito bonitas!! custo beneficio excelente.
1974,5,Muito bom material bem acabado.
1975,5,"Muito bonitas ,vale a pena ,. ,."
1976,5,"Ótimo, recomendo. 
Comprem sem medo!."
1977,5,Produto muito lindo! super indico.
1978,5,São lindas. Superou minhas expectativas.
1979,5,Lindo maravilhoso igual na foto.
1980,5,"Ótimo produto, recomendo a compra."
1981,5,"Lindas! amei, compraria de novo!!."
1982,5,"Linda, tamanho e material excelentes."
1983,4,"Produto de excelente qualidade, recomendo."
1984,5,Excelente bom acabamento super recomendo.
1985,5,Muito lindas produto de qualidade.
1986,5,Adorei. Lindas. Material super confortável.
1987,5,Mercadoria bem acabado otima qualidade.
1988,5,Parabéns pelo produto muito bom.
1989,5,Lindíssimas. Produtos de ótima qualidade!.
1990,5,"Produto bom. 
. 
Almofadas são  bonitas."
1991,5,Amei as almofadas são maravilhosas.
1992,5,Produto de qualidade. Recomendo.
1993,5,"Lindassssss adorei, bem macias."
1994,5,Perfeito. Adorei. Super recomendo.
1995,5,Perfeito!!! produto exatamente igual.
1996,5,Otimo produto ! exclenge qualidade.
1997,5,Amei. Lindas. Comprarei novamente.
1998,5,"Muito lindas, excelente material!."
1999,5,"Produto maravilhoso, boa qualidade."
2000,5,"Produto de qualidade, adorei."
2001,5,Linda! atendeu minhas expectativas.
2002,5,Ótimo produto! excelente qualidade.
2003,5,"Ótimo produto, simplesmente adorei."
2004,5,"Produto excelente , como descrito."
2005,5,Excelente qualidade! lindas!! adorei.
2006,5,Aconchegante. Macia  e confortável.
2007,5,"Simplesmente maravilhosas, excelente qualidade."
2008,5,"Otimoo muito bom,."
2009,5,Maravilhosaaaaa perfeito acabamento.
2010,5,Conforme anunciado. Execelente.
2011,3,"Lindo, bom material, só não dou 5 estrelas pq o bocal onde vai a lâmpada é muito frágil e nada funcional. 
Qdo giramos a lâmpada para colocar ou retirar o bocal gira junto, torcendo os fios que como disse são frágeis."
2012,5,Lindos tamanho ideal para areas menores lindos podem comprar material ótimo.
2013,5,"Muito bom produto de alta qualidade, e preço muito justo."
2014,5,Produto de acordo com descrição apresentada pelo site.
2015,5,"Produto muito bonito, acabamento muito bom."
2016,5,Excelência em qualidade!!! excelente custo-benefício!!!.
2017,5,Amei o lustre! excelente compra!.
2018,5,"Produto lindo, de ótima qualidade!."
2019,5,Recomendo.
2020,4,"Gostei muito desse varão de cortina e ficou lindo porém o material usado para juntar as duas partes do varão poderia ser melhor, ele é simples e frágil, apenas um pedaço de plástico resumindo."
2021,5,Maravilhoso. Muito mais bonito que na foto e a coroa da ponta é grande e linda. É de ferro muito bem pintado e resistente.
2022,5,"Muito bonito, de ótima qualidade. Fácil de instalar. Dá um charme na decoração, ficou lindo na minha sala."
2023,5,"Ótimo produto, eu já tinha do mesmo na cor cromado, agora comprei esses dois na cor dourado."
2024,5,"Varão maravilhoso! minha sala ficou linda, estou muito satisfeita, ficou perfeito,recomendo a todos do mercado livre."
2025,5,De acordo com a foto. Produto bonito. Aparência refinada e muito pratico por ser extensivel.
2026,5,"Produto muito bonito e de fácil instalação, ficou lindo aqui em casa, recomendo."
2027,5,Adorei pois deixou minha sala mais arrojada e linda. É de fácil instalação!.
2028,5,"Produto excelente,  comprei um para conhecer e acabei comprando mais três, super indico,."
2029,5,Lindo. Um produto de altíssima qualidade. Belíssimo e de acabamento impecável. Simplesmente amei.
2030,5,"Lindo! e de ótima qualidade, o produto ficou lindo na minha sala."
2031,5,"Ainda não instalei, mas já vi que é muito boa a qualidade."
2032,5,"Amei. O varão é lindo, resistente e perfeito, superou minhas expectativas."
2033,5,"Produto de muito boa qualidade, bem acabado e bonito, recomendo."
2034,4,Muito bom e lindo!! recomendo a todos do ml.
2035,5,O produto é muito bonito e de boa qualidade :).
2036,5,"De ótima qualidade, muito bonito, e embeleza o ambiente."
2037,5,"Kit todo em metal, ótimo acabamento, bem estruturado."
2038,5,Produto de ótima qualidade amei minha 3 compra.
2039,5,"Maravilhoso, super charmoso e elegante. Material otimo!."
2040,5,É lindo demais. O acabamento é bom.
2041,5,"Lindo  parece ser resistente. 
Ainda não usei."
2042,5,Muito bonito e material de boa qualidade.
2043,5,Prefeito. Recomendo. Amei. Produto de otima qualidade.
2044,5,Produto lindo e de qualidade! adorei!.
2045,5,Excelente produto. Recomendo. Prático e bonito.
2046,5,"Perfeito, mais bonito do que imaginava!."
2047,5,Maravilhoso. Eu amei. Fico muito lindo.
2048,5,"Muito bom o material, está aprovado."
2049,5,"Ótimo acabamento, resistente, prático de montar."
2050,5,"Lindo, acabamento muito bom, recomendo!!."
2051,5,Ótimo produto e qualidade excelente.
2052,5,Lindo. Maravilhoso. Fácil instalação.
2053,5,Gostei maior do que imaginava. Fixou lindo na minha cozinha. Mas pedi preto brilhante e veio fosco. Mas nao incomodou. Prestem atencao pq todos estao comprando o brilhante e vindo o fosco.
2054,4,"Os pendentes são lindos, minha cozinha ficou linda. Faço apenas uma ressalva, a boquilha quando colocamos a lâmpada ela não fica central, fica torto. Poderíam verificar esse probleminha pra ficar excelente."
2055,5,"Bom acabamento, muito bonito, só o material é meio fino e tem que cuidar pra não amassar, mas pelo valor vale muito a pena."
2056,1,Produto diferente do solicitado isso porque ainda mandei um e-mail reforçando. Pedi brilhoso veio fosco. Vergonha. Não respeitam o cliente.
2057,5,"Produto em excelente estado! bom acabamento, leve, cor bonita, tamanho bom, atendeu todas as minhas expectativas."
2058,5,"Muito bom e bonito. Um pouco fino demais, mas o custo/beneficio é excelente!."
2059,5,"Ma-ra-vi-lho-so. 
Otimo produto, excelente qualidade  por um preço barato."
2060,5,"Excelente! lindo!. 
Ficou ótimo na vitrine de minha loja!."
2061,5,"Bonitos e grandes, bem feito mas ainda não instalei."
2062,5,Produto de excelente curso benefício. Veio conforme o anunciado.
2063,5,"Boa qualidade, atende as expectativas e o custo baixo."
2064,4,"Nao instalei ainda , mas aparentemente muito bom , lindoooo."
2065,5,Muito bom o produto. Atendeu as expectativas.
2066,5,Adorei. Perfeito. Produto superou as expectativas.
2067,5,"Excelente produto!. 
Design impecável, alta qualidade."
